id,price,price_display,frequency,property_type,bedrooms,bathrooms,address,summary,property_url,contact_url,branch,branch_id,added_or_reduced,first_visible_date,let_type,postcode,search_date,letting_details,property_size_sqft,property_size_sqm,scraping_success,scraping_error,coordinates,distance_to_center_km,price_score,location_score,size_score,overall_score,size_data_status,geocoding_status
167903633,1350,"£1,350 pcm",monthly,Flat,1,1.0,"Haydons Road, Wimbledon, London","This newly refurbished ground flat in Wimbledon, London is a stunning property that offers modern living in a highly sought-after area. The flat features one spacious bedroom, a stylish bathroom, and a cozy living area that opens up to a small patio, perfect for enjoying your morning coffee or ho...",https://www.rightmove.co.uk/properties/167903633#/?channel=RES_LET,/property-to-rent/contactBranch.html?propertyId=167903633,"Sharpes Estates Ltd, Colliers Wood",5353,Reduced yesterday,2025-10-07T12:01:05Z,,,2025-10-15T18:49:28.011641,"{'let available date': 'Now', 'deposit': '£1,557', 'min. tenancy': 'Ask agent', 'let type': 'Long term', 'furnish type': 'Unfurnished', 'council tax': 'Ask agent'}",560.0,52.0,True,,"(51.4253627, -0.1883425)",10.126775135221884,81.11111111111111,79.74644972955623,52.0,74.74,actual,geocoded
168209354,1500,"£1,500 pcm",monthly,Flat,1,1.0,"Norwood Road, Herne Hill",Stunning apartment with gallery style bedroom. Spacious open plan living area. Parking. Close to Herne Hill Station.,https://www.rightmove.co.uk/properties/168209354#/?channel=RES_LET,/property-to-rent/contactBranch.html?propertyId=168209354,"Credential, Tooting",64891,Added today,2025-10-15T14:55:09Z,,,2025-10-15T18:49:23.151639,"{'let available date': '06/12/2025', 'deposit': '£1,730', 'min. tenancy': 'Ask agent', 'let type': 'Long term', 'furnish type': 'Part furnished', 'council tax': 'Ask agent'}",,,True,,"(51.4523921, -0.10148)",6.458085411588905,77.77777777777779,87.08382917682219,43.729438202247195,74.69,estimated,geocoded
167827292,1400,"£1,400 pcm",monthly,Flat,1,1.0,"Parkview Court, London, SW18","A well-presented studio apartment featuring a large reception/bedroom area, separate kitchen and modern bathroomIdeal for Professionals Seeking Serenity Allocated FREE parking;Perfect location for... ** Property Reference: 2644228 **",https://www.rightmove.co.uk/properties/167827292#/?channel=RES_LET,/property-to-rent/contactBranch.html?propertyId=167827292,"OpenRent, London",96668,Added on 05/10/2025,2025-10-05T23:08:51Z,,SW18,2025-10-15T18:49:54.205756,"{'let available date': '30/11/2025', 'deposit': '£1,615', 'min. tenancy': 'Ask agent', 'let type': 'Long term', 'furnish type': 'Furnished', 'council tax': 'Ask agent'}",,,True,,"(51.455385, -0.1970402)",7.59390565408413,80.0,84.81218869183174,43.729438202247195,74.67,estimated,geocoded
166119896,1500,"£1,500 pcm",monthly,Apartment,1,1.0,"Fairbridge Road, N19","A contemporary, one double bedroom, ground floor converted flat with a modern open plan reception room, double bedroom with En-suite facilities. Fairbridge Road is a lovely tree lined street in the heart of Archway, offering great access to both Archway Station (Northern Line) and Upper Holloway...",https://www.rightmove.co.uk/properties/166119896#/?channel=RES_LET,/property-to-rent/contactBranch.html?propertyId=166119896,"JTM Homes, North London",29933,Reduced on 29/09/2025,2025-08-22T16:54:30Z,,N19,2025-10-15T18:50:04.125751,"{'let available date': 'Now', 'deposit': '£1,731', 'min. tenancy': 'Ask agent', 'let type': 'Long term', 'furnish type': 'Unfurnished', 'council tax': 'Ask agent'}",,,True,,"(51.5673615, -0.1254903)",6.594973407578521,77.77777777777779,86.81005318484296,43.729438202247195,74.58,estimated,geocoded
127088078,1500,"£1,500 pcm",monthly,Flat,1,1.0,"Norwood Road, London, SE24","1 bedroom flat located on the 3rd floor. Separate kitchen & living room, one double bedroom. Furnished or unfurnished. Available immediately.",https://www.rightmove.co.uk/properties/127088078#/?channel=RES_LET,/property-to-rent/contactBranch.html?propertyId=127088078,"Milegate, London",123322,Added on 05/09/2025,2022-09-15T01:35:18Z,,SE24,2025-10-15T18:50:16.520970,"{'let available date': 'Ask agent', 'deposit': '£1,730', 'min. tenancy': 'Ask agent', 'let type': 'Long term', 'furnish type': 'Furnished or unfurnished, landlord is flexible', 'council tax': 'Ask agent'}",,,True,,"(51.4511062, -0.1006667)",6.6112848358716745,77.77777777777779,86.77743032825666,43.729438202247195,74.57,estimated,geocoded
168003071,1400,"£1,400 pcm",monthly,Apartment,1,1.0,"Norwood Road, London, SE27","A one bedroom apartment in the heart of West Norwood. This beautiful modern one bedroom apartment is compact but offers a reception room, double bedroom, a modern separate kitchen and bathroom. Located in the heart of West Norwood, less than an approximate 5-minute walk to ...",https://www.rightmove.co.uk/properties/168003071#/?channel=RES_LET,/property-to-rent/contactBranch.html?propertyId=168003071,"Stirling Ackroyd Lettings, Streatham - Lettings",12694,Added on 08/10/2025,2025-10-08T17:30:51Z,,SE27,2025-10-15T18:49:43.835228,"{'let available date': '31/10/2025', 'deposit': '£1,615', 'min. tenancy': '12 months', 'let type': 'Long term', 'furnish type': 'Unfurnished', 'council tax': 'Ask agent'}",,,True,,"(51.4398458, -0.1061123)",7.739150530511876,80.0,84.52169893897624,43.729438202247195,74.55,estimated,geocoded
168004529,1500,"£1,500 pcm",monthly,Flat,1,1.0,Buchan Road London SE15,"Acorn are delighted to offer this stunning one bedroom flat to let. Perfect for a professional couple or single, the property is ideally located within a short walk of both Queens Road and Nunhead train stations. Energy Efficiency Rating - D",https://www.rightmove.co.uk/properties/168004529#/?channel=RES_LET,/property-to-rent/contactBranch.html?propertyId=168004529,"Acorn, Peckham Rye",50692,Reduced on 07/10/2025,2025-10-08T18:03:47Z,,SE15,2025-10-15T18:49:51.505853,"{'let available date': '25/10/2025', 'deposit': '£1,731', 'min. tenancy': 'Ask agent', 'let type': 'Long term', 'furnish type': 'Unfurnished', 'council tax': 'Ask agent'}",479.0,45.0,True,,"(51.4656606, -0.0532739)",6.996300043190462,77.77777777777779,86.00739991361908,45.0,74.51,actual,geocoded
168110753,1420,"£1,420 pcm",monthly,Flat,1,,"Tulse Hill, London, SW2",***ONE MONTH RENT FREE IF MOVE IN BY 31ST OCTOBER***AVAILABLE NOW***FURNISHED***GREAT LOCATION***,https://www.rightmove.co.uk/properties/168110753#/?channel=RES_LET,/property-to-rent/contactBranch.html?propertyId=168110753,"HC-GB, South",238694,Added on 10/10/2025,2025-10-10T23:26:02Z,,SW2,2025-10-15T18:49:35.769262,"{'let available date': '17/10/2025', 'deposit': '£1,700', 'min. tenancy': '12 months', 'let type': 'Long term', 'furnish type': 'Unfurnished', 'council tax': 'Ask agent'}",,,True,,"(51.4405631, -0.1106266)",7.6059577372046885,79.55555555555556,84.78808452559062,43.729438202247195,74.48,estimated,geocoded
168008279,1500,"£1,500 pcm",monthly,Flat,1,1.0,"Uxbridge Road, Shepherds Bush, W12","Available NOW - Spacious one-bedroom flat with high ceilings, a large living room, modern kitchen and bathroom. Ideally located on Uxbridge Road, W12, moments from Westfield London and multiple Tube stations offering quick access to Central London, Hammersmith and Ealing.",https://www.rightmove.co.uk/properties/168008279#/?channel=RES_LET,/property-to-rent/contactBranch.html?propertyId=168008279,"Citydeal Estates, London",96880,Added on 09/10/2025,2025-10-09T00:05:39Z,,W12,2025-10-15T18:49:43.835142,"{'let available date': 'Ask agent', 'deposit': '£1,730', 'min. tenancy': 'Ask agent', 'let type': 'Long term', 'furnish type': 'Furnished', 'council tax': 'Ask agent'}",,,True,,"(51.5040544, -0.2247685)",6.761530962017628,77.77777777777779,86.47693807596474,43.729438202247195,74.45,estimated,geocoded
87327993,1300,"£1,300 pcm",monthly,Apartment,1,1.0,"C Stanthorpe Road, Streatham, London, SW16","Charming one double bedroom second floor conversion in a popular location of Streatham. The property boasts a fitted kitchen, tiled bathroom with shower attachment, a lounge, plenty of storage space, laminate flooring and neutral decor throughout.",https://www.rightmove.co.uk/properties/87327993#/?channel=RES_LET,/property-to-rent/contactBranch.html?propertyId=87327993,"Andrews Letting and Management, Streatham",34358,Added yesterday,2025-10-14T21:13:09Z,,SW16,2025-10-15T18:49:28.011597,"{'let available date': 'Now', 'deposit': '£1,500', 'min. tenancy': 'Ask agent', 'let type': 'Long term', 'furnish type': 'Furnished', 'council tax': 'Ask agent'}",,,True,,"(51.4273642, -0.1306706)",8.984974454164801,82.22222222222221,82.0300510916704,43.729438202247195,74.45,estimated,geocoded
167590415,1500,"£1,500 pcm",monthly,Flat,1,1.0,"Well Street, London, E9","Charming 1-bed flat in the heart of Hackney, close to London Fields & Victoria Park. Ideal for professionals or couples seeking a vibrant East London lifestyle with excellent transport links & local amenities.",https://www.rightmove.co.uk/properties/167590415#/?channel=RES_LET,/property-to-rent/contactBranch.html?propertyId=167590415,"Oakland Estates, Barkingside",55705,Added on 30/09/2025,2025-09-30T09:29:19Z,,E9,2025-10-15T18:50:01.586700,"{'let available date': '17/10/2025', 'deposit': '£1,730', 'min. tenancy': '12 months', 'let type': 'Long term', 'furnish type': 'Unfurnished', 'council tax': 'Ask agent'}",,,True,,"(51.5441402, -0.0472162)",6.870238300123319,77.77777777777779,86.25952339975336,43.729438202247195,74.36,estimated,geocoded
166770674,1500,"£1,500 pcm",monthly,Flat,1,1.0,"Lower Clapton Road, Hackney","OIEO: £1500pcm. This well appointed one bedroom apartment is situated in the heart of Lower Clapton, offering a range of cafés and shopping facilities at your doorstep. The property boasts its own front entrance, an open plan reception/kitchen, contemporary shower-room, and a double bedroom. Exce...",https://www.rightmove.co.uk/properties/166770674#/?channel=RES_LET,/property-to-rent/contactBranch.html?propertyId=166770674,"Wild & Co., Hackney",127876,Reduced on 13/10/2025,2025-09-09T13:17:48Z,,,2025-10-15T18:49:35.769202,"{'let available date': 'Now', 'deposit': '£1,730', 'min. tenancy': 'Ask agent', 'let type': 'Long term', 'furnish type': 'Unfurnished', 'council tax': 'Ask agent'}",,,True,,"(51.5503809, -0.0535682)",6.965821228522877,77.77777777777779,86.06835754295425,43.729438202247195,74.28,estimated,geocoded
167931074,1400,"£1,400 pcm",monthly,Flat,1,1.0,"Archdale Road, East Dulwich, SE22","This one's for you if... Light, space, and simplicity come together beautifully in this Dulwich home. With wooden floors underfoot, an open-plan kitchen and living space filled with natural light, and a well-proportioned bedroom and bathroom, it’s the kind of place that feels eas...",https://www.rightmove.co.uk/properties/167931074#/?channel=RES_LET,/property-to-rent/contactBranch.html?propertyId=167931074,"Paramount, London - Lettings",62636,Added on 07/10/2025,2025-10-07T17:06:03Z,,SE22,2025-10-15T18:49:48.893136,"{'let available date': 'Now', 'deposit': '£1,615', 'min. tenancy': 'Ask agent', 'let type': 'Long term', 'furnish type': 'Unfurnished', 'council tax': 'Ask agent'}",412.0,38.0,True,,"(51.4584829, -0.0732269)",6.688777221381762,80.0,86.62244555723647,38.0,74.25,actual,geocoded
165070139,1300,"£1,300 pcm",monthly,Apartment,1,1.0,"Mitcham Road, Tooting, SW17",Bright 1 Bedroom Ground Floor Flat Near Tooting Broadway Station,https://www.rightmove.co.uk/properties/165070139#/?channel=RES_LET,/property-to-rent/contactBranch.html?propertyId=165070139,"Concept Estate Agents, London",82211,Reduced yesterday,2025-07-29T12:26:54Z,,SW17,2025-10-15T18:49:30.583948,"{'let available date': 'Now', 'deposit': '£1,500', 'min. tenancy': 'Ask agent', 'let type': 'Long term', 'furnish type': 'Part furnished', 'council tax': 'Ask agent'}",,,True,,"(51.4276408, -0.1676511)",9.374332734001348,82.22222222222221,81.2513345319973,43.729438202247195,74.14,estimated,geocoded
166094471,1350,"£1,350 pcm",monthly,Flat,1,1.0,"Effingham Road, Hornsey, N8","Available now/Unfurnished: Set on the top floor on this period residence on the popular Harringay Ladder is this bright and airy one bedroom apartment. Further comprising reception, separate kitchen and shower room. ",https://www.rightmove.co.uk/properties/166094471#/?channel=RES_LET,/property-to-rent/contactBranch.html?propertyId=166094471,"Castles Estate Agents, Crouch End",174338,Added on 22/08/2025,2025-08-22T11:15:03Z,,N8,2025-10-15T18:50:19.037653,"{'let available date': 'Now', 'deposit': '£1,557', 'min. tenancy': 'Ask agent', 'let type': 'Long term', 'furnish type': 'Unfurnished', 'council tax': 'Ask agent'}",,,True,,"(51.5873645, -0.1209667)",8.830864773570061,81.11111111111111,82.33827045285987,43.729438202247195,74.13,estimated,geocoded
167746622,300,"£1,300 pcm",weekly,Flat,1,1.0,"Elm Grove, Cricklewood","This one bedroom top floor period conversion is ideally situated close to local amenities and transport links. The property has a double bedroom, a bright reception, a separate kitchen and a tiled bathroom with bath and shower.",https://www.rightmove.co.uk/properties/167746622#/?channel=RES_LET,/property-to-rent/contactBranch.html?propertyId=167746622,"Dexters, Cricklewood",72541,Added on 03/10/2025,2025-10-03T09:30:41Z,,,2025-10-15T18:49:56.802806,"{'let available date': 'Ask agent', 'deposit': '£1,500', 'min. tenancy': 'Ask agent', 'let type': 'Long term', 'furnish type': 'Part furnished', 'council tax': 'Ask agent'}",352.7,32.8,True,,"(51.368937, -0.1546591)",15.596716034161185,100.0,68.80656793167763,32.8,74.08,actual,geocoded
168110588,1466,"£1,466 pcm",monthly,Flat,1,,"Tulse Hill, London, SW2",***ONE MONTH FREE RENT IF MOVE IN BY 31ST OCTOBER***AVAILABLE NOW***UNFURNISHED***GREAT LOCATION***,https://www.rightmove.co.uk/properties/168110588#/?channel=RES_LET,/property-to-rent/contactBranch.html?propertyId=168110588,"HC-GB, South",238694,Added on 10/10/2025,2025-10-10T22:44:44Z,,SW2,2025-10-15T18:49:38.504336,"{'let available date': '17/10/2025', 'deposit': '£1,800', 'min. tenancy': '12 months', 'let type': 'Long term', 'furnish type': 'Unfurnished', 'council tax': 'Ask agent'}",,,True,,"(51.4405631, -0.1106266)",7.6059577372046885,78.53333333333333,84.78808452559062,43.729438202247195,74.07,estimated,geocoded
167624387,1400,"£1,400 pcm",monthly,Apartment,1,1.0,"Rushey Green, London, SE6","A smart and bright one bedroom apartment located in Catford. The station is approximately a 14 minute walk, added benefit of a entrance phone. Plenty of local amenities are nearby.",https://www.rightmove.co.uk/properties/167624387#/?channel=RES_LET,/property-to-rent/contactBranch.html?propertyId=167624387,"Bryan & Keegan, London",102278,Reduced on 08/10/2025,2025-09-30T16:15:16Z,,SE6,2025-10-15T18:49:43.835234,"{'let available date': 'Now', 'deposit': '£1,500', 'min. tenancy': 'Ask agent', 'let type': 'Long term', 'furnish type': 'Unfurnished', 'council tax': 'Ask agent'}",546.0,51.0,True,,"(51.4457082, -0.0197638)",10.213467112256781,80.0,79.57306577548644,51.0,74.03,actual,geocoded
167163404,1350,"£1,350 pcm",monthly,Apartment,1,1.0,"Golders Way, Golders Green, NW11","Convenient location. This modern one bedroom flat which is located above shops within minutes’ walk of Golders Green Station, restaurants and bus routes. Benefitting from gas central heating, fitted wardrobe, wooden floors, entryphone system and a small timber decked communal te...",https://www.rightmove.co.uk/properties/167163404#/?channel=RES_LET,/property-to-rent/contactBranch.html?propertyId=167163404,"Ellis & Co, Golders Green",6769,Added on 18/09/2025,2025-09-18T17:19:41Z,,NW11,2025-10-15T18:49:35.769145,"{'let available date': '28/10/2025', 'deposit': '£1,577', 'min. tenancy': 'Ask agent', 'let type': 'Long term', 'furnish type': 'Furnished', 'council tax': 'Ask agent'}",,,True,,"(51.5783789, -0.1907867)",8.964067517695913,81.11111111111111,82.07186496460818,43.729438202247195,74.02,estimated,geocoded
167821127,1450,"£1,450 pcm",monthly,Flat,1,1.0,"Rosendale Road, SE21","Relocators are delighted to offer this larger than average one bedroom conversion to rent which is set on the top floor of this elegant Victorian building. This property boasts a large reception room with a Juliet balcony, a large double bedroom with fitted cupboard, a modern fitted eat in kitche...",https://www.rightmove.co.uk/properties/167821127#/?channel=RES_LET,/property-to-rent/contactBranch.html?propertyId=167821127,"Relocators, London",277085,Added on 05/10/2025,2025-10-05T13:12:25Z,,SE21,2025-10-15T18:49:54.205765,"{'let available date': 'Ask agent', 'deposit': '£1,673', 'min. tenancy': 'Ask agent', 'let type': 'Long term', 'furnish type': 'Ask agent', 'council tax': 'Ask agent'}",,,True,,"(51.4402249, -0.0958242)",7.8677174992990375,78.88888888888889,84.26456500140192,43.729438202247195,74.01,estimated,geocoded
168105869,1450,"£1,450 pcm",monthly,Flat,1,1.0,"Rosendale Road, SE21","**Viewings Sat 11th**Book your slot today** Relocators are delighted to offer this larger than average one bedroom conversion to rent which is set on the top floor of this elegant Victorian building. This property boasts a large reception room with a Juliet balcony, a large double bedroom with fi...",https://www.rightmove.co.uk/properties/168105869#/?channel=RES_LET,/property-to-rent/contactBranch.html?propertyId=168105869,"Relocators, London",277085,Added on 05/10/2025,2025-10-10T18:13:13Z,,SE21,2025-10-15T18:49:54.205762,"{'let available date': 'Ask agent', 'deposit': '£1,673', 'min. tenancy': 'Ask agent', 'let type': 'Long term', 'furnish type': 'Ask agent', 'council tax': 'Ask agent'}",,,True,,"(51.4402249, -0.0958242)",7.8677174992990375,78.88888888888889,84.26456500140192,43.729438202247195,74.01,estimated,geocoded
165626666,1500,"£1,500 pcm",monthly,Flat,1,1.0,"Telford Avenue, London, SW2 4XL","Property number 26778.
Stunning one bedroom, split level flat in the sought after Telford Park area. Stylish with lots of storage inc full wall of wardrobe space.",https://www.rightmove.co.uk/properties/165626666#/?channel=RES_LET,/property-to-rent/contactBranch.html?propertyId=165626666,"Visum, Nationwide",35298,Reduced on 01/10/2025,2025-08-11T19:51:22Z,,SW2,2025-10-15T18:50:01.586536,"{'let available date': 'Now', 'deposit': '£1,500', 'min. tenancy': 'Ask agent', 'let type': 'Long term', 'furnish type': 'Furnished', 'council tax': 'Ask agent'}",,,True,,"(51.4421676, -0.1302303)",7.337740768836978,77.77777777777779,85.32451846232604,43.729438202247195,73.99,estimated,geocoded
168048218,1375,"£1,375 pcm",monthly,Apartment,1,1.0,"Wolfington Road, London, SE27","A one bedroom Victorian apartment in West Norwood. This spacious one bedroom property comprises a large reception room, separate modern kitchen, double bedroom and a grey bathroom suite. This Victorian apartment is filled with plenty of character features including large sas...",https://www.rightmove.co.uk/properties/168048218#/?channel=RES_LET,/property-to-rent/contactBranch.html?propertyId=168048218,"Stirling Ackroyd Lettings, Streatham - Lettings",12694,Added on 09/10/2025,2025-10-09T16:35:54Z,,SE27,2025-10-15T18:49:40.916224,"{'let available date': '03/11/2025', 'deposit': '£1,586', 'min. tenancy': '12 months', 'let type': 'Long term', 'furnish type': 'Unfurnished', 'council tax': 'Ask agent'}",,,True,,"(51.4306877, -0.1080356)",8.719312569110496,80.55555555555556,82.561374861779,43.729438202247195,73.99,estimated,geocoded
167976485,1500,"£1,500 pcm",monthly,Not Specified,1,1.0,"Balham High Road, SW17","A charming one bedroom split level apartment, conveniently located on the popular Balham High Road.",https://www.rightmove.co.uk/properties/167976485#/?channel=RES_LET,/property-to-rent/contactBranch.html?propertyId=167976485,"Rampton Baseley, Balham & Tooting",218114,Added on 08/10/2025,2025-10-08T11:35:41Z,,SW17,2025-10-15T18:49:46.492442,"{'let available date': '24/10/2025', 'deposit': '£1,730', 'min. tenancy': 'Ask agent', 'let type': 'Long term', 'furnish type': 'Furnished', 'council tax': 'Ask agent'}",,,True,,"(51.4437422, -0.1525806)",7.3676212204876625,77.77777777777779,85.26475755902467,43.729438202247195,73.96,estimated,geocoded
166826654,1450,"£1,450 pcm",monthly,Flat,1,1.0,Baildon Street,One bed apartment,https://www.rightmove.co.uk/properties/166826654#/?channel=RES_LET,/property-to-rent/contactBranch.html?propertyId=166826654,"Valley Homes, Coulsden",293618,Added on 10/09/2025,2025-09-10T13:28:44Z,,,2025-10-15T18:50:14.111253,"{'let available date': 'Now', 'deposit': '£1,673', 'min. tenancy': '12 months', 'let type': 'Long term', 'furnish type': 'Unfurnished', 'council tax': 'Ask agent'}",463.0,43.0,True,,"(51.4758274, -0.0286445)",7.754135813171962,78.88888888888889,84.49172837365607,43.0,73.95,actual,geocoded
165797681,1400,"£1,400 pcm",monthly,Flat,1,1.0,"Church Road, Norwood","A stylish second floor apartment ideally located in the heart of the Crystal Palace Triangle. This well-presented one bedroom flat offers a spacious reception room with separate fitted kitchen, modern bathroom, and excellent storage including two hallway cupboards. Offered unfurnished with one of...",https://www.rightmove.co.uk/properties/165797681#/?channel=RES_LET,/property-to-rent/contactBranch.html?propertyId=165797681,"Dexters, Honor Oak",7189,Reduced on 08/09/2025,2025-08-15T13:37:22Z,,,2025-10-15T18:50:14.111262,"{'let available date': 'Ask agent', 'deposit': '£1,615', 'min. tenancy': 'Ask agent', 'let type': 'Long term', 'furnish type': 'Unfurnished', 'council tax': 'Ask agent'}",,,True,,"(51.4330712, -0.1029573)",8.521310334232867,80.0,82.95737933153427,43.729438202247195,73.93,estimated,geocoded
167565944,1475,"£1,475 pcm",monthly,Flat,1,1.0,"Haringey, London, N4","Top floor one bedroom split level flat. The property comprises of a lounge/kitchen, bathroom and separate bedroom. Closest station Haringey. Professional applicants. Summary & Exclusions: -... ** Property Reference: 2641207 **",https://www.rightmove.co.uk/properties/167565944#/?channel=RES_LET,/property-to-rent/contactBranch.html?propertyId=167565944,"OpenRent, London",96668,Reduced today,2025-09-29T15:09:54Z,,N4,2025-10-15T18:49:25.586934,"{'let available date': '18/10/2025', 'deposit': '£1,475', 'min. tenancy': 'Ask agent', 'let type': 'Long term', 'furnish type': 'Furnished', 'council tax': 'Ask agent'}",,,True,,"(51.5765788, -0.112544)",7.690125980205529,78.33333333333333,84.61974803958894,43.729438202247195,73.93,estimated,geocoded
167845547,1400,"£1,400 pcm",monthly,Not Specified,1,1.0,"Becmead Avenue, London, SW16","A charming one bedroom flat in the heart of Streatham Becmead Avenue is in a prime location just off Streatham High Road and its many amenities such as High Street banks, restaurants, bars, coffee shops, cinema and gyms. The property is equidistant to both Streatham Statio...",https://www.rightmove.co.uk/properties/167845547#/?channel=RES_LET,/property-to-rent/contactBranch.html?propertyId=167845547,"Stirling Ackroyd Lettings, Streatham - Lettings",12694,Added on 06/10/2025,2025-10-06T11:32:51Z,,SW16,2025-10-15T18:49:51.505921,"{'let available date': '14/11/2025', 'deposit': '£1,615', 'min. tenancy': '12 months', 'let type': 'Long term', 'furnish type': 'Ask agent', 'council tax': 'Ask agent'}",,,True,,"(51.4315295, -0.1354429)",8.536437462101963,80.0,82.92712507579607,43.729438202247195,73.92,estimated,geocoded
167560070,1500,"£1,500 pcm",monthly,Flat,1,1.0,"Bright 1-bedroom flat situated within a well-connected location, Glenarm Road, E5","This bright 1-bedroom flat for rent on Glenarm Road, London, E5. Featuring double glazing, an en suite bathroom, and a fitted kitchen with a kitchen diner this property offers convenience and comfort. An ideal choice for single professionals or couples seeking a stylish urban retreat.",https://www.rightmove.co.uk/properties/167560070#/?channel=RES_LET,/property-to-rent/contactBranch.html?propertyId=167560070,"Maxwells Estates, Islington",88079,Reduced on 10/10/2025,2025-09-29T13:51:34Z,,E5,2025-10-15T18:49:38.504351,"{'let available date': 'Now', 'deposit': '£1,500', 'min. tenancy': 'Ask agent', 'let type': 'Long term', 'furnish type': 'Ask agent', 'council tax': 'Ask agent'}",,,True,,"(51.552855, -0.0479512)",7.439331910157325,77.77777777777779,85.12133617968536,43.729438202247195,73.91,estimated,geocoded
167839298,1450,"£1,450 pcm",monthly,Apartment,1,1.0,"Brockley Road, SE4","Right in the hub of Crofton Park, South East London's best kept secret, this well proportioned one bedroom flat has just become available to rent.",https://www.rightmove.co.uk/properties/167839298#/?channel=RES_LET,/property-to-rent/contactBranch.html?propertyId=167839298,"Truepenny's, Dulwich",49874,Added on 06/10/2025,2025-10-06T10:14:24Z,,SE4,2025-10-15T18:49:54.205737,"{'let available date': '16/10/2025', 'deposit': '£1,673', 'min. tenancy': 'Ask agent', 'let type': 'Long term', 'furnish type': 'Unfurnished', 'council tax': 'Ask agent'}",,,True,,"(51.4641146, -0.0361647)",8.017897300984304,78.88888888888889,83.9642053980314,43.729438202247195,73.89,estimated,geocoded
