id,price,price_display,frequency,property_type,bedrooms,bathrooms,address,summary,property_url,contact_url,branch,branch_id,added_or_reduced,first_visible_date,let_type,postcode,search_date,letting_details,property_size_sqft,property_size_sqm,scraping_success,scraping_error,coordinates,distance_to_center_km,price_score,location_score,size_score,overall_score,size_data_status,geocoding_status
167966717,345,"£1,495 pcm",weekly,Flat,1,1.0,"Chapter Road, Willesden Green","This one bedroom top floor flat in Willesden Green has a spacious open plan living area with a contemporary kitchen, a well sized bedroom and tiled bathroom. The flat has neutral decor throughout and is situated close to local amenities and transport links.",https://www.rightmove.co.uk/properties/167966717#/?channel=RES_LET,/property-to-rent/contactBranch.html?propertyId=167966717,"Dexters, Cricklewood",72541,Reduced on 13/10/2025,2025-10-08T09:32:13Z,,,2025-10-15T18:49:35.769187,"{'let available date': 'Ask agent', 'deposit': '£1,845', 'min. tenancy': 'Ask agent', 'let type': 'Long term', 'furnish type': 'Unfurnished', 'council tax': 'Ask agent'}",,,True,,"(51.4857711, -0.101756)",3.0647449375193485,100.0,93.8705101249613,43.729438202247195,86.29,estimated,geocoded
166296290,335,"£1,452 pcm",weekly,Apartment,1,,"Shepherds Bush Road, LONDON","Recently Fully refurbished large studio lower ground apartment. The apartment features separate eat in kitchen with sleek integrated kitchen appliances, worktops and a washer/dryer. Carpet flooring and a small patio area. Over 300 sqft available early October The apartment has additional ...",https://www.rightmove.co.uk/properties/166296290#/?channel=RES_LET,/property-to-rent/contactBranch.html?propertyId=166296290,"Barnard Marcus Lettings, West Kensington - Lettings",50966,Added on 28/08/2025,2025-08-28T10:34:21Z,,,2025-10-15T18:50:16.521116,"{'let available date': 'Now', 'deposit': 'Ask agent', 'min. tenancy': 'Ask agent', 'let type': 'Long term', 'furnish type': 'Furnished or unfurnished, landlord is flexible', 'council tax': 'Ask agent'}",,,True,,"(51.501156, -0.2219707)",6.5978742220614235,100.0,86.80425155587716,43.729438202247195,83.47,estimated,geocoded
167971880,335,"£1,452 pcm",weekly,Flat,1,1.0,"Fortune Green Road, West Hampstead NW6",Cedar Estates are delighted to offer this 1-bedroom flat with a private patio conveniently located a short walk from the shops and transport links of West Hampstead. The property consists of a modern open plan kitchen with laminate flooring and a fully tiled bathroom.,https://www.rightmove.co.uk/properties/167971880#/?channel=RES_LET,/property-to-rent/contactBranch.html?propertyId=167971880,"Cedar Estates, West Hampstead",79883,Added on 08/10/2025,2025-10-08T10:43:21Z,,NW6,2025-10-15T18:49:46.492450,"{'let available date': 'Now', 'deposit': 'Ask agent', 'min. tenancy': 'Ask agent', 'let type': 'Long term', 'furnish type': 'Furnished or unfurnished, landlord is flexible', 'council tax': 'Ask agent'}",,,True,,"(51.5526977, -0.1930498)",6.726699374390917,100.0,86.54660125121816,43.729438202247195,83.36,estimated,geocoded
168005612,300,"£1,300 pcm",weekly,Flat,1,1.0,"Hudson Close, White City Estate","This lovely one bedroom flat has recently been refurnished and offers a spacious lounge, with a newly fitted open plan kitchen and tiled bathroom.",https://www.rightmove.co.uk/properties/168005612#/?channel=RES_LET,/property-to-rent/contactBranch.html?propertyId=168005612,"Fletchers, Brook Green",50719,Reduced yesterday,2025-10-08T18:56:31Z,,,2025-10-15T18:49:28.011687,"{'let available date': 'Ask agent', 'deposit': '£1,500', 'min. tenancy': 'Ask agent', 'let type': 'Long term', 'furnish type': 'Furnished or unfurnished, landlord is flexible', 'council tax': 'Ask agent'}",,,True,,"(51.5127782, -0.2320877)",7.272670434432964,100.0,85.45465913113406,43.729438202247195,82.93,estimated,geocoded
165653903,346,"£1,499 pcm",weekly,Flat,1,1.0,"White City Estate, Shepherds Bush","This lovely one bedroom flat has recently been refurnished and offers a spacious lounge, with a newly fitted open plan kitchen and tiled bathroom.",https://www.rightmove.co.uk/properties/165653903#/?channel=RES_LET,/property-to-rent/contactBranch.html?propertyId=165653903,"Fletchers, Brook Green",50719,Reduced on 01/10/2025,2025-08-12T13:22:53Z,,,2025-10-15T18:49:59.184723,"{'let available date': 'Ask agent', 'deposit': '£1,730', 'min. tenancy': 'Ask agent', 'let type': 'Long term', 'furnish type': 'Ask agent', 'council tax': 'Ask agent'}",,,True,,"(51.5126389, -0.2326312)",7.309230445574748,100.0,85.3815391088505,43.729438202247195,82.9,estimated,geocoded
165738683,346,"£1,499 pcm",weekly,Flat,1,1.0,"White City Estate, Shepherds Bush",A large one bedroom property compromising a separate kitchen. The property has undergone a full re-paint and new carpet flooring.,https://www.rightmove.co.uk/properties/165738683#/?channel=RES_LET,/property-to-rent/contactBranch.html?propertyId=165738683,"Dexters, Shepherds Bush",84833,Reduced on 01/10/2025,2025-08-14T10:59:26Z,,,2025-10-15T18:49:59.184719,"{'let available date': 'Ask agent', 'deposit': '£1,730', 'min. tenancy': 'Ask agent', 'let type': 'Long term', 'furnish type': 'Furnished or unfurnished, landlord is flexible', 'council tax': 'Ask agent'}",,,True,,"(51.5126389, -0.2326312)",7.309230445574748,100.0,85.3815391088505,43.729438202247195,82.9,estimated,geocoded
166847507,323,"£1,400 pcm",weekly,Flat,1,1.0,"Cricklewood Lane, Cricklewood NW2","As sole agents, we are delighted to offer this well proportioned one-bedroom flat, located on the ground floor of a purpose-built block situated just moments from Cricklewood Thameslink station, this property offers excellent convenience and accessibility.",https://www.rightmove.co.uk/properties/166847507#/?channel=RES_LET,/property-to-rent/contactBranch.html?propertyId=166847507,"Cedar Estates, West Hampstead",79883,Added on 10/09/2025,2025-09-10T17:44:22Z,,NW2,2025-10-15T18:50:14.111245,"{'let available date': 'Now', 'deposit': 'Ask agent', 'min. tenancy': 'Ask agent', 'let type': 'Long term', 'furnish type': 'Furnished or unfurnished, landlord is flexible', 'council tax': 'Ask agent'}",,,True,,"(51.5497553, -0.2204186)",7.935288807365541,100.0,84.12942238526892,43.729438202247195,82.4,estimated,geocoded
168080051,306,"£1,326 pcm",weekly,Apartment,1,1.0,"Atelier Court North, Leven Road, London, E14","Modern 1-bed apartment in Atelier Court, E14. Bright open-plan living/kitchen area, private balcony, stylish bathroom, lift access & secure entry. Moments from Langdon Park DLR & close to Canary Wharf. Ideal for professionals or couples. Book your viewing today!",https://www.rightmove.co.uk/properties/168080051#/?channel=RES_LET,/property-to-rent/contactBranch.html?propertyId=168080051,"Sanctuary Housing, Sanctuary Housing",117370,Added on 13/10/2025,2025-10-13T17:11:21Z,,E14,2025-10-15T18:49:33.363210,"{'let available date': 'Now', 'deposit': '£1,836', 'min. tenancy': 'Ask agent', 'let type': 'Long term', 'furnish type': 'Unfurnished', 'council tax': 'Ask agent'}",,,True,,"(51.5167933, -0.0075744)",8.388315419802396,100.0,83.22336916039521,43.729438202247195,82.04,estimated,geocoded
164827133,323,"£1,400 pcm",weekly,Flat,2,1.0,"Cheviot Gardens, Golders Green Estate","This well presented top floor conversion is bight and spacious with a separate reception, fitted modern kitchen, a well sized double bedroom and a further room. The flat is has been recently refurbished and is ideally situated in the Golders Green Estate.",https://www.rightmove.co.uk/properties/164827133#/?channel=RES_LET,/property-to-rent/contactBranch.html?propertyId=164827133,"Dexters, Cricklewood",72541,Reduced on 03/10/2025,2025-07-22T19:21:17Z,,,2025-10-15T18:49:56.802786,"{'let available date': 'Ask agent', 'deposit': '£1,955', 'min. tenancy': 'Ask agent', 'let type': 'Long term', 'furnish type': 'Part furnished', 'council tax': 'Ask agent'}",,,True,,"(51.5643175, -0.2131995)",8.625368117739136,100.0,82.74926376452173,43.729438202247195,81.85,estimated,geocoded
87315885,1500,"£1,500 pcm",monthly,Apartment,1,1.0,"Grove Place, Eltham, London, SE9",Modern spacious one bedroom apartment in newly constructed portered development in prime Eltham location ,https://www.rightmove.co.uk/properties/87315885#/?channel=RES_LET,/property-to-rent/contactBranch.html?propertyId=87315885,"jdm, Greenwich",250727,Added yesterday,2025-10-14T15:49:51Z,,SE9,2025-10-15T18:49:28.011667,"{'let available date': '20/10/2025', 'deposit': '£1,730', 'min. tenancy': '12 months', 'let type': 'Long term', 'furnish type': 'Unfurnished', 'council tax': 'Ask agent'}",673.0,63.0,True,,"(51.4893335, -0.1440551)",2.380153846150935,77.77777777777779,95.23969230769814,63.0,81.81,actual,geocoded
41835423,1300,"£1,300 pcm",monthly,Flat,1,,"Chigwell Road, London, E18","Step inside this beautifully refurbished one/two bedroom apartment in the heart of South Woodford. Bright, stylish, and perfectly located for transport, shops, and cafés - it's ready for you to move in and make your own..",https://www.rightmove.co.uk/properties/41835423#/?channel=RES_LET,/property-to-rent/contactBranch.html?propertyId=41835423,"Yellands, South Woodford",62254,Reduced on 02/10/2025,2016-05-12T11:57:57Z,,E18,2025-10-15T18:49:59.184688,"{'let available date': 'Now', 'deposit': '£1,730', 'min. tenancy': 'Ask agent', 'let type': 'Long term', 'furnish type': 'Part furnished', 'council tax': 'Ask agent'}",,,True,,"(51.5074456, -0.1277653)",0.07370619589533926,82.22222222222221,99.85258760820932,43.729438202247195,81.58,estimated,geocoded
127639184,1300,"£1,300 pcm",monthly,Maisonette,1,,"Franklin Way, Croydon, London, CR0",** Ground Floor ** ** Maisonette ** ** One Bedroom ** ** Separate Kitchen ** ** Good Size Lounge ** ** Bathroom ** ** Available 4th November ** ** Bed & Wardrobe Included **,https://www.rightmove.co.uk/properties/127639184#/?channel=RES_LET,/property-to-rent/contactBranch.html?propertyId=127639184,"LG New Homes, London",80511,Added on 30/09/2025,2022-10-03T08:53:44Z,,CR0,2025-10-15T18:50:01.586540,"{'let available date': '04/11/2025', 'deposit': 'Ask agent', 'min. tenancy': 'Ask agent', 'let type': 'Long term', 'furnish type': 'Part furnished', 'council tax': 'Ask agent'}",,,True,,"(51.5074456, -0.1277653)",0.07370619589533926,82.22222222222221,99.85258760820932,43.729438202247195,81.58,estimated,geocoded
167891594,1300,"£1,300 pcm",monthly,Ground Flat,1,1.0,"Marlborough Lane, London, SE7",Newly refurbished and perfect for a single occupant or couple seeking modern comfort.,https://www.rightmove.co.uk/properties/167891594#/?channel=RES_LET,/property-to-rent/contactBranch.html?propertyId=167891594,"Berkleys Property Group, London",290588,Added on 07/10/2025,2025-10-07T09:33:52Z,,SE7,2025-10-15T18:49:51.505857,"{'let available date': 'Ask agent', 'deposit': '£1,300', 'min. tenancy': '6 months', 'let type': 'Long term', 'furnish type': 'Furnished', 'council tax': 'Ask agent'}",,,True,,"(51.5074456, -0.1277653)",0.07370619589533926,82.22222222222221,99.85258760820932,43.729438202247195,81.58,estimated,geocoded
167536760,1325,"£1,325 pcm",monthly,Maisonette,1,1.0,"Ashcroft, London, N14","Bright and well-presented one bedroom maisonette flat, offered inclusive of some bills including Council Tax and water but excluding electricity. It is situated on the ground floor of a small purp... ** Property Reference: 2640086 **",https://www.rightmove.co.uk/properties/167536760#/?channel=RES_LET,/property-to-rent/contactBranch.html?propertyId=167536760,"OpenRent, London",96668,Added on 28/09/2025,2025-09-28T20:07:42Z,,N14,2025-10-15T18:50:04.125774,"{'let available date': '18/10/2025', 'deposit': '£1,325', 'min. tenancy': 'Ask agent', 'let type': 'Long term', 'furnish type': 'Furnished', 'council tax': 'Ask agent'}",,,True,,"(51.5074456, -0.1277653)",0.07370619589533926,81.66666666666667,99.85258760820932,43.729438202247195,81.35,estimated,geocoded
167981456,1500,"£1,500 pcm",monthly,Flat,1,1.0,"Robin Hood Way, Kingston Vale, London, SW15","ZERO DEPOSIT AVAILABLE. LONG LET. A highly desirable location moments from Richmond Park, this spacious 1-bedroom apartment offers good size rooms throughout. Located in a fantastic location with lots of amenities close by.",https://www.rightmove.co.uk/properties/167981456#/?channel=RES_LET,/property-to-rent/contactBranch.html?propertyId=167981456,"Foxtons, Kingston",57272,Added on 08/10/2025,2025-10-08T12:46:40Z,,SW15,2025-10-15T18:49:46.492428,"{'let available date': 'Ask agent', 'deposit': '£1,731', 'min. tenancy': 'Ask agent', 'let type': 'Long term', 'furnish type': 'Part furnished', 'council tax': 'Ask agent'}",1166.0,108.0,True,,"(51.4329297, -0.2567637)",12.26760003506499,77.77777777777779,75.46479992987003,100.0,81.3,actual,geocoded
167684171,1400,"£1,400 pcm",monthly,Flat,1,1.0,"Oak Apple Court, London, SE12",Stunning and Spacious one Bedroom Purpose Built Flat in a Quiet Newly Built Estate based in quiet residential location which can be perfect for working professionals. Flat is meticulously maintain... ** Property Reference: 2559563 **,https://www.rightmove.co.uk/properties/167684171#/?channel=RES_LET,/property-to-rent/contactBranch.html?propertyId=167684171,"OpenRent, London",96668,Added on 01/10/2025,2025-10-01T17:33:27Z,,SE12,2025-10-15T18:49:59.184702,"{'let available date': 'Now', 'deposit': '£1,400', 'min. tenancy': 'Ask agent', 'let type': 'Long term', 'furnish type': 'Unfurnished', 'council tax': 'Ask agent'}",,,True,,"(51.5074456, -0.1277653)",0.07370619589533926,80.0,99.85258760820932,43.729438202247195,80.69,estimated,geocoded
167678723,1400,"£1,400 pcm",monthly,Flat,1,1.0,"Brackenbury Gardens, London, W6","Oaklands Estates are pleased to offer this spacious one bedroom Ground Floor flat close to Hammersmith Grove.The property has an ideal layout comprising of a double bedroom, separate living room with dining area, family bathroom and a fitted kitchen. Also, a huge rear communal garden with bench se",https://www.rightmove.co.uk/properties/167678723#/?channel=RES_LET,/property-to-rent/contactBranch.html?propertyId=167678723,"Oaklands Estates, London",98294,Added on 01/10/2025,2025-10-01T16:32:46Z,,W6,2025-10-15T18:49:59.184709,"{'let available date': 'Ask agent', 'deposit': 'Ask agent', 'min. tenancy': 'Ask agent', 'let type': 'Long term', 'furnish type': 'Furnished', 'council tax': 'Ask agent'}",,,True,,"(51.5074456, -0.1277653)",0.07370619589533926,80.0,99.85258760820932,43.729438202247195,80.69,estimated,geocoded
167708309,1400,"£1,400 pcm",monthly,Flat,1,1.0,"Charles Bradlaugh House, Haynes Close, Tottenham, London, N17","NEW! Knights are delighted to offer to let this ground floor one bedroom flat located close to all amenities including transport links. The flat has recently been refurbished and boasts a new fitted kitchen, new bathroom suite, separate lounge/diner, private balcony area, double bedroom, laminate...",https://www.rightmove.co.uk/properties/167708309#/?channel=RES_LET,/property-to-rent/contactBranch.html?propertyId=167708309,"Knights Residential, London",82394,Added on 02/10/2025,2025-10-02T12:20:59Z,,N17,2025-10-15T18:49:56.802836,"{'let available date': 'Now', 'deposit': 'Ask agent', 'min. tenancy': 'Ask agent', 'let type': 'Long term', 'furnish type': 'Unfurnished', 'council tax': 'Ask agent'}",,,True,,"(51.5074456, -0.1277653)",0.07370619589533926,80.0,99.85258760820932,43.729438202247195,80.69,estimated,geocoded
167758373,1400,"£1,400 pcm",monthly,Apartment,1,1.0,"Rambler Court, Swynford Gdns, Hendon, London, NW4","A Spacious One Bedroom First Floor Flat, Furnished, Fully Fitted Kitchen, One Bathroom, On Modern Development, Excellent Condition, Near Tube, Parking, Available 6th November 2025.",https://www.rightmove.co.uk/properties/167758373#/?channel=RES_LET,/property-to-rent/contactBranch.html?propertyId=167758373,"Jayson Russell, Hendon",43502,Added on 03/10/2025,2025-10-03T11:21:23Z,,NW4,2025-10-15T18:49:56.802802,"{'let available date': '06/11/2025', 'deposit': '£1,615', 'min. tenancy': 'Ask agent', 'let type': 'Long term', 'furnish type': 'Part furnished', 'council tax': 'Ask agent'}",,,True,,"(51.5074456, -0.1277653)",0.07370619589533926,80.0,99.85258760820932,43.729438202247195,80.69,estimated,geocoded
146039813,1400,"£1,400 pcm",monthly,Flat,1,1.0,"Martin Close, London, N9","Superb One-Bedroom Flat First Floor EdmontonAvailable from 20th October 2025, this bright and spacious first-floor flat offers a fantastic living space in one of Edmonton's most convenient locations.The property features a light-filled reception room, a separate fully fitted kitchen, a large do",https://www.rightmove.co.uk/properties/146039813#/?channel=RES_LET,/property-to-rent/contactBranch.html?propertyId=146039813,"Discover Residential Ltd, Loughton",184304,Added on 06/10/2025,2024-03-22T11:17:09Z,,N9,2025-10-15T18:49:54.205747,"{'let available date': 'Ask agent', 'deposit': '£1,615', 'min. tenancy': 'Ask agent', 'let type': 'Long term', 'furnish type': 'Part furnished', 'council tax': 'Ask agent'}",,,True,,"(51.5074456, -0.1277653)",0.07370619589533926,80.0,99.85258760820932,43.729438202247195,80.69,estimated,geocoded
167916326,323,"£1,400 pcm",weekly,Flat,1,1.0,"Hendon Lane, Finchley, N3","A delightful one double bedroom apartment situated only moments to Finchley Central Underground Station. This bright and airy property benefits from family bathroom, open plan kitchen with integrated white goods, spacious reception and large double bedroom. Located only a stones throw from the m...",https://www.rightmove.co.uk/properties/167916326#/?channel=RES_LET,/property-to-rent/contactBranch.html?propertyId=167916326,"Primden Group, Camden",261275,Reduced on 09/10/2025,2025-10-07T14:26:08Z,,N3,2025-10-15T18:49:43.835126,"{'let available date': 'Now', 'deposit': '£1,615', 'min. tenancy': 'Ask agent', 'let type': 'Long term', 'furnish type': 'Ask agent', 'council tax': 'Ask agent'}",,,True,,"(51.5973246, -0.1805587)",10.584822954630809,100.0,78.83035409073838,43.729438202247195,80.28,estimated,geocoded
168146225,323,"£1,400 pcm",weekly,Flat,1,1.0,"Hendon Lane, Finchley, N3","A delightful one double bedroom apartment situated only moments to Finchley Central Underground Station. This bright and airy property benefits from bathroom, open plan kitchen with integrated white goods, spacious reception and large double bedroom. Located only a stones throw from the many won...",https://www.rightmove.co.uk/properties/168146225#/?channel=RES_LET,/property-to-rent/contactBranch.html?propertyId=168146225,"Primden Group, Camden",261275,Added on 13/10/2025,2025-10-13T11:36:32Z,,N3,2025-10-15T18:49:35.769190,"{'let available date': 'Now', 'deposit': '£1,615', 'min. tenancy': 'Ask agent', 'let type': 'Long term', 'furnish type': 'Ask agent', 'council tax': 'Ask agent'}",,,True,,"(51.5973246, -0.1805587)",10.584822954630809,100.0,78.83035409073838,43.729438202247195,80.28,estimated,geocoded
167925380,1450,"£1,450 pcm",monthly,Flat,1,1.0,"Caroe Court, London, N9","1 Bed Flat, Caroe Court, N9 We are proud to offer this delightful 1 bedroom, 1 bathroom flat in a great location. Available to move in from 31 October 2025, this property benefits from available... ** Property Reference: 2650910 **",https://www.rightmove.co.uk/properties/167925380#/?channel=RES_LET,/property-to-rent/contactBranch.html?propertyId=167925380,"OpenRent, London",96668,Added on 07/10/2025,2025-10-07T16:01:18Z,,N9,2025-10-15T18:49:48.893144,"{'let available date': '31/10/2025', 'deposit': '£1,450', 'min. tenancy': 'Ask agent', 'let type': 'Long term', 'furnish type': 'Unfurnished', 'council tax': 'Ask agent'}",,,True,,"(51.5074456, -0.1277653)",0.07370619589533926,78.88888888888889,99.85258760820932,43.729438202247195,80.24,estimated,geocoded
167282201,1450,"£1,450 pcm",monthly,Flat,1,1.0,"95 Telford Road, London, N11",Perfect 1 bedroom flat!,https://www.rightmove.co.uk/properties/167282201#/?channel=RES_LET,/property-to-rent/contactBranch.html?propertyId=167282201,"EweMove, Covering Greater London",264530,Reduced on 02/10/2025,2025-09-22T18:41:23Z,,N11,2025-10-15T18:49:59.184680,"{'let available date': 'Now', 'deposit': '£1,788', 'min. tenancy': '12 months', 'let type': 'Long term', 'furnish type': 'Unfurnished', 'council tax': 'Ask agent'}",,,True,,"(51.5074456, -0.1277653)",0.07370619589533926,78.88888888888889,99.85258760820932,43.729438202247195,80.24,estimated,geocoded
167195036,1450,"£1,450 pcm",monthly,Flat,1,1.0,"Wellmeadow Road, London, SE6",An Immaculate and stunning one double bedroom flat on the sought after Wellmeadow Road,https://www.rightmove.co.uk/properties/167195036#/?channel=RES_LET,/property-to-rent/contactBranch.html?propertyId=167195036,"Kinleigh Folkard & Hayward - Lettings, Catford",148610,Reduced on 04/10/2025,2025-09-19T14:02:17Z,,SE6,2025-10-15T18:49:54.205788,"{'let available date': '01/12/2025', 'deposit': '£1,730', 'min. tenancy': 'Ask agent', 'let type': 'Long term', 'furnish type': 'Furnished', 'council tax': 'Ask agent'}",,,True,,"(51.5074456, -0.1277653)",0.07370619589533926,78.88888888888889,99.85258760820932,43.729438202247195,80.24,estimated,geocoded
161032610,1300,"£1,300 pcm",monthly,Ground Flat,1,1.0,"Boscombe Gardens, London, SW16","Spacious 1-Bedroom Garden Flat - Streatham, SW16 A rare find! This bright and generously sized 1-bedroom ground floor flat",https://www.rightmove.co.uk/properties/161032610#/?channel=RES_LET,/property-to-rent/contactBranch.html?propertyId=161032610,"ROCKWELL GREEN PROPERTIES LIMITED, London",288347,Added on 24/04/2025,2025-04-24T14:18:52Z,,SW16,2025-10-15T18:50:21.311040,"{'let available date': 'Ask agent', 'deposit': '£1,300', 'min. tenancy': '6 months', 'let type': 'Long term', 'furnish type': 'Unfurnished', 'council tax': 'Ask agent'}",500.0,46.0,True,,"(51.4893335, -0.1440551)",2.380153846150935,82.22222222222221,95.23969230769814,46.0,80.18,actual,geocoded
167042723,1400,"£1,400 pcm",monthly,Flat,1,1.0,"Daisy Road, James Court, E18",Set within a modern development and just a one minute walk from South Woodford Central Line Station is this superb top floor one bedroom apartment.,https://www.rightmove.co.uk/properties/167042723#/?channel=RES_LET,/property-to-rent/contactBranch.html?propertyId=167042723,"Abode, Woodford Green",77447,Reduced today,2025-09-16T11:51:49Z,,E18,2025-10-15T18:49:25.586962,"{'let available date': 'Now', 'deposit': '£1,400', 'min. tenancy': '12 months', 'let type': 'Long term', 'furnish type': 'Unfurnished', 'council tax': 'Ask agent'}",,,True,,"(51.5145033, -0.1307586)",0.7454021207663117,80.0,98.50919575846737,43.729438202247195,80.15,estimated,geocoded
167792003,1500,"£1,500 pcm",monthly,Flat,1,1.0,"Cunard Crescent, London, N21","Applicant Requirements: We are searching for tenant(s) with a minimum household income of £45,000pa+ - Baker and Chase are delighted to present this nicely decorated 1-bedroom, ground floor flat, with allocated residents parking. Located on a sought-after and ...",https://www.rightmove.co.uk/properties/167792003#/?channel=RES_LET,/property-to-rent/contactBranch.html?propertyId=167792003,"Baker and Chase, North London",283727,Added on 03/10/2025,2025-10-03T18:01:58Z,,N21,2025-10-15T18:49:56.802684,"{'let available date': '20/10/2025', 'deposit': '£1,730', 'min. tenancy': 'Ask agent', 'let type': 'Long term', 'furnish type': 'Unfurnished', 'council tax': 'Ask agent'}",,,True,,"(51.5074456, -0.1277653)",0.07370619589533926,77.77777777777779,99.85258760820932,43.729438202247195,79.8,estimated,geocoded
167581937,1500,"£1,500 pcm",monthly,Flat,1,1.0,"Aragon Court, London, W13","We are proud to offer this delightful 1 bedroom, 1 bathroom flat in a great location. Available to move in from 29 September 2025. Property is offered unfurnished. Viewing highly recommended. Co... ** Property Reference: 2557586 **",https://www.rightmove.co.uk/properties/167581937#/?channel=RES_LET,/property-to-rent/contactBranch.html?propertyId=167581937,"OpenRent, London",96668,Added on 29/09/2025,2025-09-29T20:08:05Z,,W13,2025-10-15T18:50:04.125741,"{'let available date': 'Now', 'deposit': '£1,500', 'min. tenancy': 'Ask agent', 'let type': 'Long term', 'furnish type': 'Unfurnished', 'council tax': 'Ask agent'}",,,True,,"(51.5074456, -0.1277653)",0.07370619589533926,77.77777777777779,99.85258760820932,43.729438202247195,79.8,estimated,geocoded
87083523,1500,"£1,500 pcm",monthly,Maisonette,2,,"Trafalgar Road, London, TW2","WITH PRIVATE REAR GARDEN - WELL PRESENTED & SPACIOUS TWO BEDROOM GROUND FLOOR MAISONETTE SITUATED IN SOUGHT AFTER LOCATION IDEALLY POSITIONED FOR MAINLINE TRAIN STATION & LOCAL SHOPS. The property has just been refurbished and benefits from a spacious lounge/diner, separate modern fitted kitchen, tw",https://www.rightmove.co.uk/properties/87083523#/?channel=RES_LET,/property-to-rent/contactBranch.html?propertyId=87083523,"Octagon, Staines",149270,Added on 06/10/2025,2025-02-12T11:10:16Z,,TW2,2025-10-15T18:49:51.505889,"{'let available date': 'Ask agent', 'deposit': 'Ask agent', 'min. tenancy': 'Ask agent', 'let type': 'Long term', 'furnish type': 'Ask agent', 'council tax': 'Ask agent'}",,,True,,"(51.5074456, -0.1277653)",0.07370619589533926,77.77777777777779,99.85258760820932,43.729438202247195,79.8,estimated,geocoded
