id,price,price_display,frequency,property_type,bedrooms,bathrooms,address,summary,property_url,contact_url,branch,branch_id,added_or_reduced,first_visible_date,let_type,postcode,search_date,letting_details,property_size_sqft,property_size_sqm,scraping_success,scraping_error,coordinates,distance_to_center_km,price_score,location_score,size_score,overall_score
167852945,1450,"£1,450 pcm",monthly,Flat,1,1.0,"Charlton Road, N9","Target Property is delighted to present this attractive rental opportunity, ideally suited for professionals, couples, or families looking for a comfortable and well-located home. The property offers a blend of modern living and convenience, with access to local amenities and transport links. Ear...",https://www.rightmove.co.uk/properties/167852945#/?channel=RES_LET,/property-to-rent/contactBranch.html?propertyId=167852945,"Target Property, Cheshunt",74120,Added on 06/10/2025,2025-10-06T13:16:10Z,,N9,2025-10-15T18:49:51.505908,"{'let available date': 'Now', 'deposit': '£1,450', 'min. tenancy': 'Ask agent', 'let type': 'Long term', 'furnish type': 'Unfurnished', 'council tax': 'Ask agent'}",1120.0,104.0,True,,"(51.4795057, 0.0272473)",11.214823192619201,78.88888888888889,77.5703536147616,100.0,82.58
167981456,1500,"£1,500 pcm",monthly,Flat,1,1.0,"Robin Hood Way, Kingston Vale, London, SW15","ZERO DEPOSIT AVAILABLE. LONG LET. A highly desirable location moments from Richmond Park, this spacious 1-bedroom apartment offers good size rooms throughout. Located in a fantastic location with lots of amenities close by.",https://www.rightmove.co.uk/properties/167981456#/?channel=RES_LET,/property-to-rent/contactBranch.html?propertyId=167981456,"Foxtons, Kingston",57272,Added on 08/10/2025,2025-10-08T12:46:40Z,,SW15,2025-10-15T18:49:46.492428,"{'let available date': 'Ask agent', 'deposit': '£1,731', 'min. tenancy': 'Ask agent', 'let type': 'Long term', 'furnish type': 'Part furnished', 'council tax': 'Ask agent'}",1166.0,108.0,True,,"(51.4329297, -0.2567637)",12.26760003506499,77.77777777777779,75.46479992987003,100.0,81.3
160874993,1400,"£1,400 pcm",monthly,Flat,1,1.0,"Trafalgar Avenue, London, SE15",We are proud to present to the lettings market this beautiful 1 bedroom flat in characteristic Victorian terrace,https://www.rightmove.co.uk/properties/160874993#/?channel=RES_LET,/property-to-rent/contactBranch.html?propertyId=160874993,"ROCKWELL GREEN PROPERTIES LIMITED, London",288347,Reduced on 28/04/2025,2025-04-18T10:06:53Z,,SE15,2025-10-15T18:50:21.311034,"{'let available date': 'Now', 'deposit': '£1,400', 'min. tenancy': '6 months', 'let type': 'Long term', 'furnish type': 'Unfurnished', 'council tax': 'Ask agent'}",550.0,51.0,True,,"(51.4856411, -0.0740773)",4.478724189097558,80.0,91.04255162180489,51.0,78.62
87299397,1450,"£1,450 pcm",monthly,Flat,1,1.0,"Choumert Road, Peckham, London, SE15","ZERO DEPOSIT AVAILABLE. LONG LET. Presented in excellent condition throughout, this wonderful one bedroom flat is set within a superb modern development offering ample living space, quality fixtures, separate kitchen/dining room and double bedroom.",https://www.rightmove.co.uk/properties/87299397#/?channel=RES_LET,/property-to-rent/contactBranch.html?propertyId=87299397,"Foxtons, Peckham",66768,Added yesterday,2025-10-14T12:08:39Z,,SE15,2025-10-15T18:49:30.583872,"{'let available date': 'Ask agent', 'deposit': '£1,674', 'min. tenancy': 'Ask agent', 'let type': 'Long term', 'furnish type': 'Unfurnished', 'council tax': 'Ask agent'}",477.0,44.0,True,,"(51.4681258, -0.0679604)",6.077813676810385,78.88888888888889,87.84437264637923,44.0,75.49
166864766,1500,"£1,500 pcm",monthly,Flat,2,1.0,"Baizdon Road, London, SE3","""Cosy 2-bed flat in prime location. Bright living space, separate kitchen, private balcony. Residents' permit parking. EPC rating C (71), council tax band C.",https://www.rightmove.co.uk/properties/166864766#/?channel=RES_LET,/property-to-rent/contactBranch.html?propertyId=166864766,"Kallars, London",289823,Reduced on 02/10/2025,2025-09-11T10:42:12Z,,SE3,2025-10-15T18:49:59.184692,"{'let available date': 'Now', 'deposit': '£1,730', 'min. tenancy': '12 months', 'let type': 'Long term', 'furnish type': 'Part furnished', 'council tax': 'Ask agent'}",667.0,62.0,True,,"(51.4680206, 0.0040514)",10.173624603765601,77.77777777777779,79.6527507924688,62.0,75.37
167994068,1450,"£1,450 pcm",monthly,Flat,1,1.0,"High Road, Wood Green, N22","Great location! Havilands present this 1 bed flat just moments walk from Wood Green underground station (zone 3 Piccadilly line) and all the local amenities - shops and restaurants. The flat benefits from a large kitchen/diner, lounge, bedroom and spacious bathroom. Suitable for professional coup...",https://www.rightmove.co.uk/properties/167994068#/?channel=RES_LET,/property-to-rent/contactBranch.html?propertyId=167994068,"Havilands, London",82874,Added on 08/10/2025,2025-10-08T15:37:40Z,,N22,2025-10-15T18:49:46.492380,"{'let available date': 'Now', 'deposit': '£1,450', 'min. tenancy': 'Ask agent', 'let type': 'Long term', 'furnish type': 'Ask agent', 'council tax': 'Ask agent'}",603.0,56.0,True,,"(51.5920697, -0.1053176)",9.469356641797235,78.88888888888889,81.06128671640553,56.00000000000001,75.18
167924939,1500,"£1,500 pcm",monthly,Flat,1,0.0,"Grove Vale, London","Nestled in the vibrant area of Grove Vale, London, this charming one-bedroom flat offers a delightful blend of period features and modern comforts. Spanning an inviting 463 square feet, the property has been thoughtfully refurbished to create a warm and welcoming atmosphere. The flat boa...",https://www.rightmove.co.uk/properties/167924939#/?channel=RES_LET,/property-to-rent/contactBranch.html?propertyId=167924939,"Hammonds, London",39003,Added on 07/10/2025,2025-10-07T15:56:33Z,,,2025-10-15T18:49:48.893149,"{'let available date': 'Now', 'deposit': '£1,730', 'min. tenancy': 'Ask agent', 'let type': 'Long term', 'furnish type': 'Unfurnished', 'council tax': 'Ask agent'}",463.0,43.0,True,,"(51.4614378, -0.0787173)",6.203369894945749,77.77777777777779,87.5932602101085,43.0,74.75
167903633,1350,"£1,350 pcm",monthly,Flat,1,1.0,"Haydons Road, Wimbledon, London","This newly refurbished ground flat in Wimbledon, London is a stunning property that offers modern living in a highly sought-after area. The flat features one spacious bedroom, a stylish bathroom, and a cozy living area that opens up to a small patio, perfect for enjoying your morning coffee or ho...",https://www.rightmove.co.uk/properties/167903633#/?channel=RES_LET,/property-to-rent/contactBranch.html?propertyId=167903633,"Sharpes Estates Ltd, Colliers Wood",5353,Reduced yesterday,2025-10-07T12:01:05Z,,,2025-10-15T18:49:28.011641,"{'let available date': 'Now', 'deposit': '£1,557', 'min. tenancy': 'Ask agent', 'let type': 'Long term', 'furnish type': 'Unfurnished', 'council tax': 'Ask agent'}",560.0,52.0,True,,"(51.4253627, -0.1883425)",10.126775135221884,81.11111111111111,79.74644972955623,52.0,74.74
168004529,1500,"£1,500 pcm",monthly,Flat,1,1.0,Buchan Road London SE15,"Acorn are delighted to offer this stunning one bedroom flat to let. Perfect for a professional couple or single, the property is ideally located within a short walk of both Queens Road and Nunhead train stations. Energy Efficiency Rating - D",https://www.rightmove.co.uk/properties/168004529#/?channel=RES_LET,/property-to-rent/contactBranch.html?propertyId=168004529,"Acorn, Peckham Rye",50692,Reduced on 07/10/2025,2025-10-08T18:03:47Z,,SE15,2025-10-15T18:49:51.505853,"{'let available date': '25/10/2025', 'deposit': '£1,731', 'min. tenancy': 'Ask agent', 'let type': 'Long term', 'furnish type': 'Unfurnished', 'council tax': 'Ask agent'}",479.0,45.0,True,,"(51.4656606, -0.0532739)",6.996300043190462,77.77777777777779,86.00739991361908,45.0,74.51
167931074,1400,"£1,400 pcm",monthly,Flat,1,1.0,"Archdale Road, East Dulwich, SE22","This one's for you if... Light, space, and simplicity come together beautifully in this Dulwich home. With wooden floors underfoot, an open-plan kitchen and living space filled with natural light, and a well-proportioned bedroom and bathroom, it’s the kind of place that feels eas...",https://www.rightmove.co.uk/properties/167931074#/?channel=RES_LET,/property-to-rent/contactBranch.html?propertyId=167931074,"Paramount, London - Lettings",62636,Added on 07/10/2025,2025-10-07T17:06:03Z,,SE22,2025-10-15T18:49:48.893136,"{'let available date': 'Now', 'deposit': '£1,615', 'min. tenancy': 'Ask agent', 'let type': 'Long term', 'furnish type': 'Unfurnished', 'council tax': 'Ask agent'}",412.0,38.0,True,,"(51.4584829, -0.0732269)",6.688777221381762,80.0,86.62244555723647,38.0,74.25
167624387,1400,"£1,400 pcm",monthly,Apartment,1,1.0,"Rushey Green, London, SE6","A smart and bright one bedroom apartment located in Catford. The station is approximately a 14 minute walk, added benefit of a entrance phone. Plenty of local amenities are nearby.",https://www.rightmove.co.uk/properties/167624387#/?channel=RES_LET,/property-to-rent/contactBranch.html?propertyId=167624387,"Bryan & Keegan, London",102278,Reduced on 08/10/2025,2025-09-30T16:15:16Z,,SE6,2025-10-15T18:49:43.835234,"{'let available date': 'Now', 'deposit': '£1,500', 'min. tenancy': 'Ask agent', 'let type': 'Long term', 'furnish type': 'Unfurnished', 'council tax': 'Ask agent'}",546.0,51.0,True,,"(51.4457082, -0.0197638)",10.213467112256781,80.0,79.57306577548644,51.0,74.03
166826654,1450,"£1,450 pcm",monthly,Flat,1,1.0,Baildon Street,One bed apartment,https://www.rightmove.co.uk/properties/166826654#/?channel=RES_LET,/property-to-rent/contactBranch.html?propertyId=166826654,"Valley Homes, Coulsden",293618,Added on 10/09/2025,2025-09-10T13:28:44Z,,,2025-10-15T18:50:14.111253,"{'let available date': 'Now', 'deposit': '£1,673', 'min. tenancy': '12 months', 'let type': 'Long term', 'furnish type': 'Unfurnished', 'council tax': 'Ask agent'}",463.0,43.0,True,,"(51.4758274, -0.0286445)",7.754135813171962,78.88888888888889,84.49172837365607,43.0,73.95
167903528,1400,"£1,400 pcm",monthly,Flat,1,1.0,"Deptford High Street, London, SE8","Charming ground floor flat on the vibrant High Street. Open-plan kitchen living area, private garden, cosy bedroom, stylish shower. Gas central heating. EPC rating C (74), council tax Band A.",https://www.rightmove.co.uk/properties/167903528#/?channel=RES_LET,/property-to-rent/contactBranch.html?propertyId=167903528,"Kallars, London",289823,Added on 07/10/2025,2025-10-07T12:00:18Z,,SE8,2025-10-15T18:49:48.893270,"{'let available date': '22/10/2025', 'deposit': '£1,615', 'min. tenancy': '12 months', 'let type': 'Long term', 'furnish type': 'Unfurnished', 'council tax': 'Ask agent'}",431.0,40.0,True,,"(51.4810021, -0.0262818)",7.655104095553922,80.0,84.68979180889215,40.0,73.88
166117547,1500,"£1,500 pcm",monthly,Flat,1,1.0,"Dagmar Court, Manchester Road, London, E14","This fully refurbished one-bedroom apartment situated on the first floor of a purpose-built block, sits moments away from the bank of the river Thames. It benefits from laminated flooring, a modern interior, bright reception with space for dining, double aspect windows, gas heating, a contemporar...",https://www.rightmove.co.uk/properties/166117547#/?channel=RES_LET,/property-to-rent/contactBranch.html?propertyId=166117547,"Keatons, Bow",25055,Reduced on 01/10/2025,2025-08-22T16:29:07Z,,E14,2025-10-15T18:49:59.184698,"{'let available date': 'Ask agent', 'deposit': '£1,730', 'min. tenancy': 'Ask agent', 'let type': 'Long term', 'furnish type': 'Furnished', 'council tax': 'Ask agent'}",501.0,47.0,True,,"(51.4961591, -0.0080488)",8.406943396763575,77.77777777777779,83.18611320647285,47.0,73.79
167855336,1450,"£1,450 pcm",monthly,Apartment,1,1.0,"Kingsland Road, London, E8",One bedroom apartment in the heart of Dalston.,https://www.rightmove.co.uk/properties/167855336#/?channel=RES_LET,/property-to-rent/contactBranch.html?propertyId=167855336,"Savills Lettings, Hackney",68504,Added on 06/10/2025,2025-10-06T13:52:04Z,,E8,2025-10-15T18:49:51.505905,"{'let available date': 'Now', 'deposit': '£1,673', 'min. tenancy': '12 months', 'let type': 'Long term', 'furnish type': 'Furnished or unfurnished, landlord is flexible', 'council tax': 'Ask agent'}",338.0,31.0,True,,"(51.5416659, -0.0761673)",5.166061694550474,78.88888888888889,89.66787661089906,31.0,73.62
167622362,1500,"£1,500 pcm",monthly,Flat,1,1.0,"Fayland Avenue, Streatham, London, SW16",TOP FLOOR APARTMENT WITH PRIVATE BALCONY IS NOW AVAILABLE! The property comes Unfurnished.,https://www.rightmove.co.uk/properties/167622362#/?channel=RES_LET,/property-to-rent/contactBranch.html?propertyId=167622362,"Northwood, West Norwood - Lettings",222866,Added on 30/09/2025,2025-09-30T15:54:49Z,,SW16,2025-10-15T18:50:01.586647,"{'let available date': 'Now', 'deposit': '£1,730', 'min. tenancy': 'Ask agent', 'let type': 'Long term', 'furnish type': 'Unfurnished', 'council tax': 'Ask agent'}",506.0,47.0,True,,"(51.4258789, -0.1423525)",9.204954138912571,77.77777777777779,81.59009172217486,47.0,73.15
167856797,1500,"£1,500 pcm",monthly,Flat,1,1.0,"Hainthorpe Road, London, SE27",An impressive and very spacious 1 bed first floor flat in a very well maintained Victorian conversion located on a quiet residential road in West Norwood moments from the train station.This attrac... ** Property Reference: 2647262 **,https://www.rightmove.co.uk/properties/167856797#/?channel=RES_LET,/property-to-rent/contactBranch.html?propertyId=167856797,"OpenRent, London",96668,Added on 06/10/2025,2025-10-06T14:11:29Z,,SE27,2025-10-15T18:49:51.505902,"{'let available date': '24/10/2025', 'deposit': '£1,731', 'min. tenancy': 'Ask agent', 'let type': 'Long term', 'furnish type': 'Furnished', 'council tax': 'Ask agent'}",,9.0,True,,"(51.4316748, -0.1080489)",8.610703173992407,77.77777777777779,82.77859365201519,43.729438202247195,72.97
167898998,1500,"£1,500 pcm",monthly,Ground Flat,2,1.0,"Rockmount Road, London, SE18","Spacious 2-bed ground floor flat in desirable location. Private garden, bay windows, separate kitchen, modern bathroom. Gas central heating, on-street parking. Council Tax Band A, EPC rating D (66).",https://www.rightmove.co.uk/properties/167898998#/?channel=RES_LET,/property-to-rent/contactBranch.html?propertyId=167898998,"Kallars, London",289823,Added on 07/10/2025,2025-10-07T11:02:39Z,,SE18,2025-10-15T18:49:48.893292,"{'let available date': '18/10/2025', 'deposit': '£1,730', 'min. tenancy': '12 months', 'let type': 'Long term', 'furnish type': 'Unfurnished', 'council tax': 'Ask agent'}",786.0,73.0,True,,"(51.4845642, 0.1011951)",16.103244184265485,77.77777777777779,67.79351163146903,73.0,72.83
160966943,1500,"£1,500 pcm",monthly,Ground Flat,2,,"Streatham Common North, London, SW16","Stunning 2-Bedroom Flat in the Heart of Streatham, SW16!",https://www.rightmove.co.uk/properties/160966943#/?channel=RES_LET,/property-to-rent/contactBranch.html?propertyId=160966943,"ROCKWELL GREEN PROPERTIES LIMITED, London",288347,Added on 22/04/2025,2025-04-22T14:20:48Z,,SW16,2025-10-15T18:50:21.311045,"{'let available date': 'Now', 'deposit': '£1,500', 'min. tenancy': '6 months', 'let type': 'Long term', 'furnish type': 'Unfurnished', 'council tax': 'Ask agent'}",500.0,46.0,True,,"(51.4235974, -0.1146946)",9.444199181783143,77.77777777777779,81.11160163643372,46.0,72.76
168164504,1500,"£1,500 pcm",monthly,Flat,1,1.0,"Archdale Road, East Dulwich, SE22","This one's for you if... You’re someone who thrives in the sunshine, coffee in hand, book in lap, feet up in your own private garden. Whether it’s morning rituals or golden hour wind-downs, outdoor space isn’t a nice-to-have, it’s a non-negotiable. I...",https://www.rightmove.co.uk/properties/168164504#/?channel=RES_LET,/property-to-rent/contactBranch.html?propertyId=168164504,"Paramount, London - Lettings",62636,Added on 17/09/2025,2025-10-13T15:34:40Z,,SE22,2025-10-15T18:49:33.363149,"{'let available date': 'Now', 'deposit': '£1,730', 'min. tenancy': 'Ask agent', 'let type': 'Long term', 'furnish type': 'Unfurnished', 'council tax': 'Ask agent'}",382.0,35.0,True,,"(51.4584829, -0.0732269)",6.688777221381762,77.77777777777779,86.62244555723647,35.0,72.76
166584980,1450,"£1,450 pcm",monthly,Flat,1,1.0,"Churchfield Road, Acton, W3","Refurbished one-bedroom flat set above shops on Churchfield Road, offering immediate access to the cafés, restaurants and local amenities of Acton.",https://www.rightmove.co.uk/properties/166584980#/?channel=RES_LET,/property-to-rent/contactBranch.html?propertyId=166584980,"Leo Newman, London",98603,Added on 04/09/2025,2025-09-04T13:20:05Z,,W3,2025-10-15T18:50:16.521018,"{'let available date': 'Now', 'deposit': '£1,673', 'min. tenancy': 'Ask agent', 'let type': 'Long term', 'furnish type': 'Furnished or unfurnished, landlord is flexible', 'council tax': 'Ask agent'}",45.0,4.0,True,,"(51.50885, -0.264164)",9.481681565659434,78.88888888888889,81.03663686868113,43.729438202247195,72.72
166819613,1500,"£1,500 pcm",monthly,Flat,1,1.0,"Dewberry Street, Poplar, London, E14","LONG LET. A cozy 1-bedroom flat in Dewberry Street, E14 0RN featuring a bright living room, a well-equipped kitchen, a comfortable bedroom, and a clean bathroom.",https://www.rightmove.co.uk/properties/166819613#/?channel=RES_LET,/property-to-rent/contactBranch.html?propertyId=166819613,"Foxtons, Wapping",111056,Added on 05/09/2025,2025-09-10T11:49:51Z,,E14,2025-10-15T18:50:14.111270,"{'let available date': 'Ask agent', 'deposit': '£1,731', 'min. tenancy': 'Ask agent', 'let type': 'Long term', 'furnish type': 'Furnished', 'council tax': 'Ask agent'}",428.0,40.0,True,,"(51.5159319, -0.0105937)",8.169443410028377,77.77777777777779,83.66111317994324,40.0,72.58
167936168,1500,"£1,500 pcm",monthly,Flat,1,1.0,"Shepherds Bush, Shepherd's Bush, London, W12","ZERO DEPOSIT AVAILABLE. LONG LET. Ideally located for the amenities of Uxbridge Road and Shepherds Bush, this bright top floor apartment is modern throughout with an open-plan living area.",https://www.rightmove.co.uk/properties/167936168#/?channel=RES_LET,/property-to-rent/contactBranch.html?propertyId=167936168,"Foxtons, Shepherds Bush",98531,Added on 07/10/2025,2025-10-07T17:52:58Z,,W12,2025-10-15T18:49:46.492468,"{'let available date': 'Ask agent', 'deposit': '£1,731', 'min. tenancy': 'Ask agent', 'let type': 'Long term', 'furnish type': 'Furnished', 'council tax': 'Ask agent'}",363.0,34.0,True,,"(51.5057446, -0.2242997)",6.7189717266345586,77.77777777777779,86.56205654673089,34.0,72.54
87310233,1450,"£1,450 pcm",monthly,Flat,1,1.0,"Capworth Street, Leyton","** WELL PRESENTED FIRST FLOOR APARTMENT IN SOUGHT AFTER AREA IN LEYTON. MODERN FINISH THROUGHOUT. AVAILABLE NOW ** OC Homes are delighted to offer to the Lettings market, this spacious, modern one bedroom apartment, in a highly desirable area of Leyton. Situated in a prime location, with...",https://www.rightmove.co.uk/properties/87310233#/?channel=RES_LET,/property-to-rent/contactBranch.html?propertyId=87310233,"OC Homes, Leyton",71060,Added yesterday,2025-10-14T14:37:06Z,,,2025-10-15T18:49:28.011691,"{'let available date': '20/10/2025', 'deposit': '£1,673', 'min. tenancy': 'Ask agent', 'let type': 'Long term', 'furnish type': 'Unfurnished', 'council tax': 'Ask agent'}",480.0,45.0,True,,"(51.5689112, -0.0207158)",10.038436933859339,78.88888888888889,79.92312613228133,45.0,72.52
167914343,1500,"£1,500 pcm",monthly,Apartment,1,1.0,"Highfield Hill, Upper Norwood",One Bedroom Apartment. Well Presented. Spacious- 50 Sq Mts. Living Room. Separate Kitchen. Bathroom. Storage. Garage. Off Road Parking. Offered Unfurnished.,https://www.rightmove.co.uk/properties/167914343#/?channel=RES_LET,/property-to-rent/contactBranch.html?propertyId=167914343,"Martin & Co, Crystal Palace",80716,Added on 07/10/2025,2025-10-07T14:03:47Z,,,2025-10-15T18:49:48.893182,"{'let available date': '25/10/2025', 'deposit': '£1,730', 'min. tenancy': 'Ask agent', 'let type': 'Long term', 'furnish type': 'Unfurnished', 'council tax': 'Ask agent'}",,50.0,True,,"(51.4141312, -0.0882257)",10.80689900978695,77.77777777777779,78.38620198042611,50.0,72.47
167018555,1300,"£1,300 pcm",monthly,Apartment,1,1.0,"London Road, Thornton Heath, CR7","Stirling Ackroyd proudly present this stunning, new-build, one bedroom apartment offered in an amazing condition. This unit was built only last year and offers high-specification features as well as white goods. In addition to its luxury interior, it also offers a private balcony and a...",https://www.rightmove.co.uk/properties/167018555#/?channel=RES_LET,/property-to-rent/contactBranch.html?propertyId=167018555,"Stirling Ackroyd Lettings, Thornton Heath",168185,Added on 15/09/2025,2025-09-15T17:40:25Z,,CR7,2025-10-15T18:50:11.738033,"{'let available date': '03/11/2025', 'deposit': '£1,500', 'min. tenancy': '12 months', 'let type': 'Long term', 'furnish type': 'Unfurnished', 'council tax': 'Ask agent'}",501.0,47.0,True,,"(51.397271, -0.1156525)",12.358431113662373,82.22222222222221,75.28313777267525,47.0,72.4
167389439,1450,"£1,450 pcm",monthly,Flat,1,0.0,"London Road, Norbury, London, SW16","ZERO DEPOSIT AVAILABLE. LONG LET. Set in a modern development, this stylish 1 bedroom flat boasting a spacious reception room with a dining area and a fully equipped open-plan kitchen, well sized double bedroom and a 24-hour concierge service.",https://www.rightmove.co.uk/properties/167389439#/?channel=RES_LET,/property-to-rent/contactBranch.html?propertyId=167389439,"Foxtons, Norbury",253856,Added on 23/07/2025,2025-09-24T21:52:47Z,,SW16,2025-10-15T18:50:19.037756,"{'let available date': 'Ask agent', 'deposit': '£1,674', 'min. tenancy': 'Ask agent', 'let type': 'Long term', 'furnish type': 'Unfurnished', 'council tax': 'Ask agent'}",533.0,50.0,True,,"(51.4050066, -0.119875)",11.48242379739025,78.88888888888889,77.03515240521949,50.0,72.37
166917689,1500,"£1,500 pcm",monthly,Flat,1,1.0,"Wightman Road, London, N4","Spacious 1-bed flat with private living room, kitchen, bathroom, and a rare large garden. Bright interiors, modern shower room, and well-furnished bedroom. Located in North London with excellent transport links, amenities, and green spaces nearby. Perfect for a professional or couple.",https://www.rightmove.co.uk/properties/166917689#/?channel=RES_LET,/property-to-rent/contactBranch.html?propertyId=166917689,"Blackstones Estates, London",290474,Reduced on 27/09/2025,2025-09-12T11:45:00Z,,N4,2025-10-15T18:50:04.125777,"{'let available date': 'Ask agent', 'deposit': '£1,500', 'min. tenancy': 'Ask agent', 'let type': 'Long term', 'furnish type': 'Furnished', 'council tax': 'Ask agent'}",388.0,36.0,True,,"(51.5750584, -0.1044741)",7.620509377667646,77.77777777777779,84.75898124466471,36.0,72.21
168227786,1500,"£1,500 pcm",monthly,Flat,1,1.0,"Arbuthnot Road, Telegraph Hill, London, SE14","LONG LET. Set on the raised ground floor, this 1 bedroom flat boasts well arranged interiors including a bay window reception room with open-plan kitchen and a lovely double bedroom with fitted storage.",https://www.rightmove.co.uk/properties/168227786#/?channel=RES_LET,/property-to-rent/contactBranch.html?propertyId=168227786,"Foxtons, Peckham",66768,,2025-10-15T18:44:05Z,,SE14,2025-10-15T18:50:21.311062,"{'let available date': 'Ask agent', 'deposit': '£1,731', 'min. tenancy': 'Ask agent', 'let type': 'Long term', 'furnish type': 'Unfurnished', 'council tax': 'Ask agent'}",348.0,32.0,True,,"(51.46952, -0.0502547)",6.876384463390737,77.77777777777779,86.24723107321853,32.0,72.01
167440370,1500,"£1,500 pcm",monthly,Flat,1,1.0,"Hervey Road, London, SE3","Truepenny’s are delighted to offer to the market this beautifully presented one-bedroom apartment on the sought-after Hervey Road, SE3. Positioned on the second floor of an attractive period building, this charming home combines character and style with a high standard of finish throughout.",https://www.rightmove.co.uk/properties/167440370#/?channel=RES_LET,/property-to-rent/contactBranch.html?propertyId=167440370,"Truepenny's Property Consultants, Charlton",228695,Reduced yesterday,2025-09-25T18:14:49Z,,SE3,2025-10-15T18:49:30.583842,"{'let available date': 'Now', 'deposit': '£1,903', 'min. tenancy': '12 months', 'let type': 'Long term', 'furnish type': 'Furnished', 'council tax': 'Ask agent'}",541.0,50.0,True,,"(51.4737316, 0.0276065)",11.437843035305741,77.77777777777779,77.12431392938852,50.0,71.96
168022583,1500,"£1,500 pcm",monthly,Apartment,1,1.0,"Stirling Close, London, SW16",Newly Refurbished One Bedroom Apartment ,https://www.rightmove.co.uk/properties/168022583#/?channel=RES_LET,/property-to-rent/contactBranch.html?propertyId=168022583,"SLM Estate Agency, London",291020,Added on 09/10/2025,2025-10-09T11:16:43Z,,SW16,2025-10-15T18:49:43.835083,"{'let available date': 'Ask agent', 'deposit': 'Ask agent', 'min. tenancy': '12 months', 'let type': 'Long term', 'furnish type': 'Unfurnished', 'council tax': 'Ask agent'}",507.0,47.12,True,,"(51.4107862, -0.1400552)",10.861399216394753,77.77777777777779,78.2772015672105,47.12,71.85
166461398,1500,"£1,500 pcm",monthly,Flat,1,1.0,"Hopkins Road, Leyton E10","1 Bedroom First Floor Flat - Hopkins Road, Leyton E10",https://www.rightmove.co.uk/properties/166461398#/?channel=RES_LET,/property-to-rent/contactBranch.html?propertyId=166461398,"In Estates, London",38897,Reduced on 10/10/2025,2025-09-01T17:56:19Z,,E10,2025-10-15T18:49:38.504374,"{'let available date': '27/10/2025', 'deposit': '£1,730', 'min. tenancy': 'Ask agent', 'let type': 'Long term', 'furnish type': 'Part furnished', 'council tax': 'Ask agent'}",,46.0,True,,"(51.571223, -0.0115896)",10.682030272826704,77.77777777777779,78.63593945434658,46.0,71.77
168188246,1450,"£1,450 pcm",monthly,Apartment,1,1.0,"Goldsmith Road, Leyton","Petty Son and Prestwich are delighted to offer for rent this spacious one bedroom ground floor flat that has been recently refurbished. Located on the popular Goldsmith Road, with great access to Leyton underground station (0.5miles).",https://www.rightmove.co.uk/properties/168188246#/?channel=RES_LET,/property-to-rent/contactBranch.html?propertyId=168188246,"Petty Son & Prestwich Ltd, London",70202,Added today,2025-10-15T10:29:38Z,,,2025-10-15T18:49:25.586964,"{'let available date': '08/11/2025', 'deposit': '£1,673', 'min. tenancy': 'Ask agent', 'let type': 'Long term', 'furnish type': 'Unfurnished', 'council tax': 'Ask agent'}",437.0,41.0,True,,"(51.5653046, -0.0161817)",10.013539765308973,78.88888888888889,79.97292046938205,41.0,71.74
166119566,1400,"£1,400 pcm",monthly,Flat,1,0.0,"Uxbridge Road, Shepherd's Bush, London, W12","ZERO DEPOSIT AVAILABLE. LONG LET. Ideally located for the amenities of Westfield and Shepherds Bush, this compact 1 bedroom property is situated on the 1st floor of a period building.",https://www.rightmove.co.uk/properties/166119566#/?channel=RES_LET,/property-to-rent/contactBranch.html?propertyId=166119566,"Foxtons, Shepherds Bush",98531,Reduced on 09/09/2025,2025-08-22T16:50:12Z,,W12,2025-10-15T18:50:14.111257,"{'let available date': 'Ask agent', 'deposit': '£1,616', 'min. tenancy': 'Ask agent', 'let type': 'Long term', 'furnish type': 'Furnished', 'council tax': 'Ask agent'}",261.0,24.0,True,,"(51.5045816, -0.2191803)",6.370538491814808,80.0,87.25892301637039,24.0,71.7
167991914,1500,"£1,500 pcm",monthly,Flat,1,1.0,"Dawlish Road, Leyton E10",ALLEN DAVIES are delighted to offer FOR RENT a ONE BEDROOM first floor flat. The property has been RECENTLY REFURBISHED throughout by the present owner and is AVAILABLE NOW. The property is situated close to the popular FRANCIS ROAD AREA and convenient for both BUS and UNDERGROUND.,https://www.rightmove.co.uk/properties/167991914#/?channel=RES_LET,/property-to-rent/contactBranch.html?propertyId=167991914,"Allen Davies & Co, Leyton",6944,Added on 08/10/2025,2025-10-08T15:15:06Z,,E10,2025-10-15T18:49:35.769194,"{'let available date': 'Now', 'deposit': '£1,730', 'min. tenancy': 'Ask agent', 'let type': 'Long term', 'furnish type': 'Unfurnished', 'council tax': 'Ask agent'}",474.0,44.0,True,,"(51.5630334, -0.0060325)",10.416606955005523,77.77777777777779,79.16678608998896,44.0,71.58
168215024,1470,"£1,470 pcm",monthly,Flat,1,1.0,"63 Croydon Road, London","We are proud to offer a luxurious living in the heart of Penge. Introducing a pinnacle of modern urban living at Yeoman House, 63 Croydon Road, Penge, London, SE20 7TS. Exquisite and brand-new 1 and 2 bedroom apartments are nestled within a newly developed residential building, offering a...",https://www.rightmove.co.uk/properties/168215024#/?channel=RES_LET,/property-to-rent/contactBranch.html?propertyId=168215024,"Mays Management, London",229781,Added on 04/10/2025,2025-10-15T15:44:52Z,,,2025-10-15T18:49:54.205773,"{'let available date': 'Now', 'deposit': '£1,696', 'min. tenancy': 'Ask agent', 'let type': 'Long term', 'furnish type': 'Ask agent', 'council tax': 'Ask agent'}",441.0,41.0,True,,"(51.5205512, 0.0154073)",10.023573711574493,78.44444444444446,79.95285257685101,41.0,71.56
167498807,1500,"£1,500 pcm",monthly,Apartment,1,1.0,"Nursery Road, London, SW19",Bright and Airy 1-Bedroom Fully Furnished Flat located in Merton,https://www.rightmove.co.uk/properties/167498807#/?channel=RES_LET,/property-to-rent/contactBranch.html?propertyId=167498807,"Hello Neighbour, London",221711,Added on 26/09/2025,2025-09-26T17:54:46Z,,SW19,2025-10-15T18:50:04.125787,"{'let available date': '07/11/2025', 'deposit': '£1,730', 'min. tenancy': '12 months', 'let type': 'Long term', 'furnish type': 'Furnished', 'council tax': 'Ask agent'}",532.0,49.0,True,,"(51.4164669, -0.216982)",11.938246258198205,77.77777777777779,76.12350748360359,49.0,71.36
167054999,1300,"£1,300 pcm",monthly,Apartment,1,1.0,"Aaron Lodge, Burnt Ash Hill, SE12","Brown & Brooke are pleased to present this charming one-bedroom, first floor flat, available 12th October.",https://www.rightmove.co.uk/properties/167054999#/?channel=RES_LET,/property-to-rent/contactBranch.html?propertyId=167054999,"Brown & Brooke, Blackheath",50974,Reduced on 29/09/2025,2025-09-16T14:48:51Z,,SE12,2025-10-15T18:50:04.125757,"{'let available date': 'Now', 'deposit': '£1,615', 'min. tenancy': '12 months', 'let type': 'Long term', 'furnish type': 'Unfurnished', 'council tax': 'Ask agent'}",449.0,42.0,True,,"(51.4427649, 0.0177842)",12.444606875279579,82.22222222222221,75.11078624944085,42.0,71.33
154695374,1300,"£1,300 pcm",monthly,Apartment,1,1.0,"West Green Road, London","Located on West Green Road N15, we offer you this first floor 1 bedroom flat which comprises 1 double bedroom with en-suite shower room, open plan lounge/fully fitted kitchen with washing machine, fridge freezer and gas hob, laminate flooring, double glazing and gas central heating. The property...",https://www.rightmove.co.uk/properties/154695374#/?channel=RES_LET,/property-to-rent/contactBranch.html?propertyId=154695374,"Prestige Properties, London Lettings",195389,Reduced on 25/09/2025,2024-11-07T10:01:43Z,,,2025-10-15T18:50:06.850832,"{'let available date': 'Now', 'deposit': '£1,500', 'min. tenancy': 'Ask agent', 'let type': 'Long term', 'furnish type': 'Furnished', 'council tax': 'Ask agent'}",312.0,29.0,True,,"(51.5838819, -0.0724798)",9.257930650189993,82.22222222222221,81.48413869962002,28.999999999999996,71.28
167935781,1500,"£1,500 pcm",monthly,Flat,1,1.0,"West Green Road, Seven Sisters, N15","This well-presented 1-bedroom first-floor flat is ideally located on West Green Road, N15, just moments from Seven Sisters Station and a short walk to Green Lanes and Chestnuts Park. Offering modern living in a vibrant North London location, this property is perfect for professionals or couples.",https://www.rightmove.co.uk/properties/167935781#/?channel=RES_LET,/property-to-rent/contactBranch.html?propertyId=167935781,"Highcastle Estates, Stratford",198884,Added on 07/10/2025,2025-10-07T17:43:51Z,,N15,2025-10-15T18:49:48.893124,"{'let available date': 'Ask agent', 'deposit': 'Ask agent', 'min. tenancy': 'Ask agent', 'let type': 'Long term', 'furnish type': 'Furnished or unfurnished, landlord is flexible', 'council tax': 'Ask agent'}",366.0,34.0,True,,"(51.5781735, -0.0822285)",8.40771661823733,77.77777777777779,83.18456676352534,34.0,71.18
159041483,1450,"£1,450 pcm",monthly,Flat,1,1.0,"West Green Road, London","Located on West Green Road N15, we offer you this top floor 1 bedroom flat which comprises 1 double bedroom, separate lounge, fully fitted kitchen with washing machine, fridge / freezer, oak wood work top and gas hob, tiled shower room, laminate flooring, Gas central heating and door entry system...",https://www.rightmove.co.uk/properties/159041483#/?channel=RES_LET,/property-to-rent/contactBranch.html?propertyId=159041483,"Prestige Properties, London Lettings",195389,Added on 29/08/2025,2025-03-05T16:53:23Z,,,2025-10-15T18:50:16.521086,"{'let available date': '24/10/2025', 'deposit': '£1,674', 'min. tenancy': 'Ask agent', 'let type': 'Long term', 'furnish type': 'Furnished or unfurnished, landlord is flexible', 'council tax': 'Ask agent'}",377.0,35.0,True,,"(51.5838819, -0.0724798)",9.257930650189993,78.88888888888889,81.48413869962002,35.0,71.15
87295767,1450,"£1,450 pcm",monthly,Ground Flat,1,1.0,"Kingston Road, London",Newly Refurbished Double Bedroom Ground Floor Flat for Rent Price: £1450pcm,https://www.rightmove.co.uk/properties/87295767#/?channel=RES_LET,/property-to-rent/contactBranch.html?propertyId=87295767,"Sharpes Estates Ltd, Colliers Wood",5353,Reduced yesterday,2025-10-14T11:26:03Z,,,2025-10-15T18:49:30.583880,"{'let available date': 'Now', 'deposit': '£1,673', 'min. tenancy': 'Ask agent', 'let type': 'Long term', 'furnish type': 'Unfurnished', 'council tax': 'Ask agent'}",506.0,47.0,True,,"(51.410062, -0.2114895)",12.367982662109766,78.88888888888889,75.26403467578047,47.0,71.06
165785219,1300,"£1,300 pcm",monthly,Flat,1,1.0,"Ashenden Road, Homerton, E5","This one's for you if... You're looking for a cosy, intimate spot with (queue bonus) Bills included! You're a get-up-and-go kind of person, so you're always out and about working or visiting friends or family; you don't need anything too fancy, just somewhere you can feel safe and res...",https://www.rightmove.co.uk/properties/165785219#/?channel=RES_LET,/property-to-rent/contactBranch.html?propertyId=165785219,"Paramount, London - Lettings",62636,Reduced on 29/09/2025,2025-08-15T10:40:22Z,,E5,2025-10-15T18:50:04.125734,"{'let available date': 'Now', 'deposit': '£1,500', 'min. tenancy': 'Ask agent', 'let type': 'Long term', 'furnish type': 'Unfurnished', 'council tax': 'Ask agent'}",233.0,22.0,True,,"(51.5513786, -0.0389419)",7.81268011482093,82.22222222222221,84.37463977035814,22.0,71.04
167701034,1495,"£1,495 pcm",monthly,Apartment,1,1.0,"Palmerston Road, Bowes Park, London, N22","A ONE BEDROOM FIRST FLOOR FLAT AVAILABLE FROM the 19th of October 2025. Ellis & Co are delighted to present this one-bedroom unfurnished flat situated on the first floor. The property features a spacious living area, separate kitchen and three piece bathroom suite. Located close t...",https://www.rightmove.co.uk/properties/167701034#/?channel=RES_LET,/property-to-rent/contactBranch.html?propertyId=167701034,"Ellis & Co, Bounds Green",22943,Added on 02/10/2025,2025-10-02T10:40:51Z,,N22,2025-10-15T18:49:59.184675,"{'let available date': '25/10/2025', 'deposit': '£1,725', 'min. tenancy': '12 months', 'let type': 'Long term', 'furnish type': 'Furnished', 'council tax': 'Ask agent'}",482.0,45.0,True,,"(51.611186, -0.1140792)",11.507507714739008,77.88888888888889,76.98498457052199,45.0,70.95
18832358,1400,"£1,400 pcm",monthly,Flat,2,1.0,"Baker Street,Enfield,EN1",WHOLE TOP FLOOR - large two-bedroom unfurnished apartment situated above a public house. Two double bedrooms. Small kitchen with cooker and fridge freezer. Use of pub car park for one car (when available). No pets. No smokers. No children. Available November.,https://www.rightmove.co.uk/properties/18832358#/?channel=RES_LET,/property-to-rent/contactBranch.html?propertyId=18832358,"County Lettings Ware Ltd, Ware",44054,Added yesterday,2008-01-10T15:17:49Z,,EN1,2025-10-15T18:49:28.011671,"{'let available date': 'Ask agent', 'deposit': 'Ask agent', 'min. tenancy': '12 months', 'let type': 'Long term', 'furnish type': 'Unfurnished', 'council tax': 'Ask agent'}",710.0,66.0,True,,"(51.665132, -0.0742126)",17.8588314940472,80.0,64.2823370119056,66.0,70.91
167779664,1300,"£1,300 pcm",monthly,Flat,1,1.0,"Middle Park Avenue, London, SE9","Located in the heart of Mottingham, this one-bedroom apartment at Middle Park Avenue offers a wonderful opportunity to live in a well-connected and vibrant part of London. The property is beautifully finished throughout, making it an ideal home for a single professional or a couple...",https://www.rightmove.co.uk/properties/167779664#/?channel=RES_LET,/property-to-rent/contactBranch.html?propertyId=167779664,"Cockburn Estate Agents, New Eltham",124243,Reduced today,2025-10-03T15:50:59Z,,SE9,2025-10-15T18:49:25.586905,"{'let available date': 'Now', 'deposit': '£1,500', 'min. tenancy': 'Ask agent', 'let type': 'Long term', 'furnish type': 'Unfurnished', 'council tax': 'Ask agent'}",501.0,47.0,True,,"(51.4412741, 0.0472564)",14.243299177114519,82.22222222222221,71.51340164577095,47.0,70.89
151588613,1500,"£1,500 pcm",monthly,Flat,1,,"Hermon Hill, London, E11",1 BEDROOM FLAT TO RENT - WANSTEAD,https://www.rightmove.co.uk/properties/151588613#/?channel=RES_LET,/property-to-rent/contactBranch.html?propertyId=151588613,"West Essex Property Services Ltd, Woodford Green",76828,Added on 29/09/2025,2024-08-22T11:20:28Z,,E11,2025-10-15T18:50:04.125769,"{'let available date': 'Now', 'deposit': 'Ask agent', 'min. tenancy': 'Ask agent', 'let type': 'Long term', 'furnish type': 'Unfurnished', 'council tax': 'Ask agent'}",538.0,50.0,True,,"(51.5804248, 0.0235881)",13.219566196441656,77.77777777777779,73.56086760711669,50.0,70.54
167805650,1450,"£1,450 pcm",monthly,Flat,1,1.0,"Worple Road, London","Top floor ONE BEDROOM CONVERSION flat flat, just 0.6 miles from Wimbledon town centre and station, allowing for easy access to a variety of shops, restaurants, and local amenities, and along local bus routes. Spanning an inviting 468 square feet, the property features a bright reception room,...",https://www.rightmove.co.uk/properties/167805650#/?channel=RES_LET,/property-to-rent/contactBranch.html?propertyId=167805650,"Ellisons, Wimbledon",26204,Added on 04/10/2025,2025-10-04T09:50:13Z,,,2025-10-15T18:49:54.205791,"{'let available date': '14/11/2025', 'deposit': '£1,673', 'min. tenancy': 'Ask agent', 'let type': 'Long term', 'furnish type': 'Unfurnished', 'council tax': 'Ask agent'}",468.0,43.0,True,,"(51.414624, -0.2202144)",12.230592308977036,78.88888888888889,75.53881538204593,43.0,70.37
168067961,1500,"£1,500 pcm",monthly,Apartment,1,1.0,"High Road, London, N12","We are pleased to present a newly refurbished one bedroom apartment to rent in North Finchley High Road, N12. This one bedroom apartment comprises of a sleek and modern kitchen reception area, a double bedroom with built in storage and a good-sized bathroom. The development offers lift access and...",https://www.rightmove.co.uk/properties/168067961#/?channel=RES_LET,/property-to-rent/contactBranch.html?propertyId=168067961,"Nova Haus London, London",240566,Added on 10/10/2025,2025-10-10T10:15:34Z,,N12,2025-10-15T18:49:40.916084,"{'let available date': 'Now', 'deposit': '£1,730', 'min. tenancy': 'Ask agent', 'let type': 'Long term', 'furnish type': 'Furnished or unfurnished, landlord is flexible', 'council tax': 'Ask agent'}",480.0,45.0,True,,"(51.613762, -0.1760721)",12.226986752636012,77.77777777777779,75.54602649472798,45.0,70.33
167397878,1450,"£1,450 pcm",monthly,Flat,1,0.0,"Melford Road, Walthamstow, London, E17","LONG LET. This well-presented 1 bedroom flat is on the ground floor with access to a lovely rear garden, boasting a bright reception room, double bedroom and an excellent location.",https://www.rightmove.co.uk/properties/167397878#/?channel=RES_LET,/property-to-rent/contactBranch.html?propertyId=167397878,"Foxtons, Bow",82857,Reduced on 23/09/2025,2025-09-25T07:02:27Z,,E17,2025-10-15T18:50:09.284947,"{'let available date': 'Ask agent', 'deposit': '£1,674', 'min. tenancy': 'Ask agent', 'let type': 'Long term', 'furnish type': 'Unfurnished', 'council tax': 'Ask agent'}",401.0,37.0,True,,"(51.5843021, -0.0310333)",10.805260757570604,78.88888888888889,78.38947848485878,37.0,70.31
167633273,1500,"£1,500 pcm",monthly,Apartment,1,1.0,"Lordship Lane, London, N22","Bright & airy spacious self contained private 1-bedroom flat with private garden within a 5 minute walk to Wood Green Underground Station, local shops and amenities and Wood Green Town Centre with its Cinema complex, restaurants, library and bars. Bus stop outside the property with journeys direc...",https://www.rightmove.co.uk/properties/167633273#/?channel=RES_LET,/property-to-rent/contactBranch.html?propertyId=167633273,"Mortimer Surveyors, London",265268,Added on 30/09/2025,2025-09-30T17:41:16Z,,N22,2025-10-15T18:49:43.834954,"{'let available date': 'Now', 'deposit': '£1,730', 'min. tenancy': 'Ask agent', 'let type': 'Long term', 'furnish type': 'Furnished or unfurnished, landlord is flexible', 'council tax': 'Ask agent'}",388.0,36.0,True,,"(51.5975186, -0.1077501)",10.043425478592404,77.77777777777779,79.91314904281519,36.0,70.28
166992005,1450,"£1,450 pcm",monthly,Flat,2,1.0,"High Street, London, SE25",Beautifully presented two bedroom second floor flat available to rent. Short distance to Norwood Junction station. Offered unfurnished. Available in October with Zero Deposit Option.,https://www.rightmove.co.uk/properties/166992005#/?channel=RES_LET,/property-to-rent/contactBranch.html?propertyId=166992005,"Kinleigh Folkard & Hayward - Lettings, Crystal Palace",85706,Added on 15/09/2025,2025-09-15T10:01:49Z,,SE25,2025-10-15T18:50:11.738043,"{'let available date': '06/11/2025', 'deposit': '£1,673', 'min. tenancy': 'Ask agent', 'let type': 'Long term', 'furnish type': 'Unfurnished', 'council tax': 'Ask agent'}",48.0,4.0,True,,"(51.3983621, -0.0763274)",12.718669261236956,78.88888888888889,74.56266147752609,43.729438202247195,70.13
168088427,1460,"£1,460 pcm",monthly,Flat,1,1.0,"Yeoman House, 63 Croydon Road, London","We are proud to offer a luxurious living in the heart of Penge. Introducing a pinnacle of modern urban living at Yeoman House, 63 Croydon Road, Penge, London, SE20 7TS. Exquisite and brand-new 1 and 2 bedroom apartments are nestled within a newly developed residential building, offering a...",https://www.rightmove.co.uk/properties/168088427#/?channel=RES_LET,/property-to-rent/contactBranch.html?propertyId=168088427,"Mays Management, London",229781,Added on 10/10/2025,2025-10-10T14:58:16Z,,,2025-10-15T18:49:38.504359,"{'let available date': '24/10/2025', 'deposit': '£1,684', 'min. tenancy': 'Ask agent', 'let type': 'Long term', 'furnish type': 'Ask agent', 'council tax': 'Ask agent'}",441.0,41.0,True,,"(51.4108429, -0.0551612)",11.934475615454941,78.66666666666666,76.13104876909011,41.0,70.12
166277207,1440,"£1,440 pcm",monthly,Flat,1,1.0,"Calderwood Street, Greenwich, London, SE18","ZERO DEPOSIT AVAILABLE. LONG LET. A wonderful, contemporary 4th floor, 1 bedroom flat offering lovely open-plan living space with modern fittings and fixtures and a super location in a secure block with a porter and lift access.",https://www.rightmove.co.uk/properties/166277207#/?channel=RES_LET,/property-to-rent/contactBranch.html?propertyId=166277207,"Foxtons, Woolwich",227810,Reduced on 16/09/2025,2025-08-27T16:54:30Z,,SE18,2025-10-15T18:50:11.738013,"{'let available date': 'Ask agent', 'deposit': '£1,662', 'min. tenancy': 'Ask agent', 'let type': 'Long term', 'furnish type': 'Part furnished', 'council tax': 'Ask agent'}",495.0,46.0,True,,"(51.4910715, 0.0649145)",13.502002762572747,79.11111111111111,72.99599447485451,46.0,70.04
168004232,1500,"£1,500 pcm",monthly,Flat,2,1.0,"Seaford Road, Enfield","Applicant Requirements: We are searching for tenant(s) with a minimum household income of £45,000pa+ - Baker and Chase are delighted to present this newly painted, spacious 2 double bedroom flat to rent just 0.3m from Enfield Town Centre. Located on the 2nd floor (top) of th...",https://www.rightmove.co.uk/properties/168004232#/?channel=RES_LET,/property-to-rent/contactBranch.html?propertyId=168004232,"Baker and Chase, London Borough of Enfield",109898,Added on 08/10/2025,2025-10-08T17:56:00Z,,,2025-10-15T18:49:43.835209,"{'let available date': '18/10/2025', 'deposit': '£1,730', 'min. tenancy': 'Ask agent', 'let type': 'Long term', 'furnish type': 'Part furnished', 'council tax': 'Ask agent'}",632.0,59.0,True,,"(51.6504065, -0.0733726)",16.273044486086714,77.77777777777779,67.45391102782656,59.0,69.89
166643438,1500,"£1,500 pcm",monthly,Flat,1,1.0,"Leigham Court Road, London","Nestled on Leigham Court Road, this bright and welcoming one-bedroom flat is tucked away in a peaceful, gated setting—yet just moments from Streatham’s vibrant central amenities. This 1 bedroom 1 bathroom flat is primely located just a 5 minute walk from Streatham Hill Overground Station, off...",https://www.rightmove.co.uk/properties/166643438#/?channel=RES_LET,/property-to-rent/contactBranch.html?propertyId=166643438,"RocketPM, London",250460,Reduced on 07/10/2025,2025-09-05T15:22:03Z,,,2025-10-15T18:49:48.893311,"{'let available date': 'Now', 'deposit': '£1,730', 'min. tenancy': 'Ask agent', 'let type': 'Long term', 'furnish type': 'Furnished', 'council tax': 'Ask agent'}",318.0,30.0,True,,"(51.4258545, -0.1139756)",9.19925377473975,77.77777777777779,81.6014924505205,30.0,69.75
87320511,1500,"£1,500 pcm",monthly,Flat,1,1.0,"Grange Road, Upper Norwood, London, SE25","ZERO DEPOSIT AVAILABLE. LONG LET. Conveniently situated for easy access to amenities, this delightful 1 bedroom flat provides a well equipped kitchen and a reception room with space for dining.",https://www.rightmove.co.uk/properties/87320511#/?channel=RES_LET,/property-to-rent/contactBranch.html?propertyId=87320511,"Foxtons, Crystal Palace",100426,Added on 29/08/2025,2025-10-14T16:51:25Z,,SE25,2025-10-15T18:50:16.521093,"{'let available date': 'Ask agent', 'deposit': '£1,731', 'min. tenancy': 'Ask agent', 'let type': 'Long term', 'furnish type': 'Unfurnished', 'council tax': 'Ask agent'}",412.0,38.0,True,,"(51.4069524, -0.0894759)",11.561146221844469,77.77777777777779,76.87770755631107,38.0,69.46
166579106,1450,"£1,450 pcm",monthly,Flat,1,1.0,"Gleneagle Road, Streatham, London, SW16",ZERO DEPOSIT AVAILABLE. LONG LET. This charming 1 bedroom flat is situated on the 1st floor and boasts bright and airy interiors throughout. It offers great accommodation including a spacious reception room and a double bedroom.,https://www.rightmove.co.uk/properties/166579106#/?channel=RES_LET,/property-to-rent/contactBranch.html?propertyId=166579106,"Foxtons, Streatham",71419,Reduced on 13/10/2025,2025-09-04T11:59:25Z,,SW16,2025-10-15T18:49:33.363219,"{'let available date': 'Ask agent', 'deposit': '£1,674', 'min. tenancy': 'Ask agent', 'let type': 'Long term', 'furnish type': 'Unfurnished', 'council tax': 'Ask agent'}",267.0,25.0,True,,"(51.4270941, -0.1316405)",9.016863375052491,78.88888888888889,81.96627324989501,25.0,69.34
168080321,1300,"£1,300 pcm",monthly,Apartment,1,1.0,"Fieldfare Road, London, SE28",Bright and spacious top floor one bed flat.,https://www.rightmove.co.uk/properties/168080321#/?channel=RES_LET,/property-to-rent/contactBranch.html?propertyId=168080321,"jdm, Greenwich",250727,Added on 10/10/2025,2025-10-10T13:11:27Z,,SE28,2025-10-15T18:49:30.583802,"{'let available date': 'Now', 'deposit': '£1,500', 'min. tenancy': '12 months', 'let type': 'Long term', 'furnish type': 'Unfurnished', 'council tax': 'Ask agent'}",540.0,50.0,True,,"(51.5073493, 0.1215649)",17.29940754852457,82.22222222222221,65.40118490295086,50.0,69.05
167786321,1400,"£1,400 pcm",monthly,Ground Flat,1,1.0,81 Dunnock Close,"base rent: £1400, deposit: £1615.38, number of bedrooms: 1, size: 432 sq ft, apartment type: ground floor, all pets allowed, heating type: electric, number of bathrooms: 1, EPC Rating: D",https://www.rightmove.co.uk/properties/167786321#/?channel=RES_LET,/property-to-rent/contactBranch.html?propertyId=167786321,"Akelius Residential Ltd, London",102505,Added on 03/10/2025,2025-10-03T17:00:32Z,,,2025-10-15T18:49:56.802700,"{'let available date': '08/11/2025', 'deposit': '£1,615', 'min. tenancy': 'Ask agent', 'let type': 'Long term', 'furnish type': 'Ask agent', 'council tax': 'Ask agent'}",432.0,40.0,True,,"(51.6292906, -0.0425423)",14.716917795296485,80.0,70.56616440940704,40.0,68.23
166348025,1500,"£1,500 pcm",monthly,Flat,1,1.0,"Sylvan Road, Wanstead","This immaculately presented first floor flat forms part of an attractive, converted Victorian house, set just off of the high street and within a stone's throw of everything Wanstead has to offer.",https://www.rightmove.co.uk/properties/166348025#/?channel=RES_LET,/property-to-rent/contactBranch.html?propertyId=166348025,"Petty Son & Prestwich Ltd, London",70202,Reduced on 29/09/2025,2025-08-29T10:37:12Z,,,2025-10-15T18:50:04.125748,"{'let available date': '27/10/2025', 'deposit': '£1,730', 'min. tenancy': 'Ask agent', 'let type': 'Long term', 'furnish type': 'Unfurnished', 'council tax': 'Ask agent'}",407.0,38.0,True,,"(51.5822478, 0.0233973)",13.333430927723509,77.77777777777779,73.33313814455298,38.0,68.04
167525366,1499,"£1,499 pcm",monthly,Bungalow,1,1.0,"Cannon Hill Lane, Raynes Park","BRAND NEW ground floor one bedroom with OFF STREET PARKING for up to two cars, located within a mile of both Morden tube and Raynes Park train station. The property has been refurbished throughout and features and a modern kitchen and shower room, double glazing and gas central heating. EPC b...",https://www.rightmove.co.uk/properties/167525366#/?channel=RES_LET,/property-to-rent/contactBranch.html?propertyId=167525366,"Ellisons, Wimbledon",26204,Reduced on 06/10/2025,2025-09-27T13:33:00Z,,,2025-10-15T18:49:51.505891,"{'let available date': 'Ask agent', 'deposit': '£1,846', 'min. tenancy': 'Ask agent', 'let type': 'Long term', 'furnish type': 'Unfurnished', 'council tax': 'Ask agent'}",386.0,36.0,True,,"(51.4053145, -0.2123873)",12.864814599010218,77.8,74.27037080197957,36.0,68.03
165317123,1500,"£1,500 pcm",monthly,Flat,1,1.0,"Park Road, Colliers Wood","*** A RECENTLY REFURBISHED ONE DOUBLE BEDROOM GROUND FLOOR FLAT ****** This spacious one bedroom property is close to Colliers Wood northern line tube station and shops. The property consists of one bedroom, one reception room, brand new kitchen and shower room. The property a...",https://www.rightmove.co.uk/properties/165317123#/?channel=RES_LET,/property-to-rent/contactBranch.html?propertyId=165317123,"Toomey Estate Agents, Mitcham",33596,Reduced on 28/08/2025,2025-08-04T10:38:49Z,,,2025-10-15T18:50:16.521110,"{'let available date': 'Now', 'deposit': '£1,730', 'min. tenancy': 'Ask agent', 'let type': 'Long term', 'furnish type': 'Ask agent', 'council tax': 'Ask agent'}",279.0,26.0,True,,"(51.4207437, -0.1878635)",10.582930971156479,77.77777777777779,78.83413805768704,26.0,67.84
167348978,1400,"£1,400 pcm",monthly,Flat,1,1.0,"Benhill Avenue, Sutton, SM1","First Floor Apartment - 1 Double Bedroom - Modern Throughout - Off Street Parking - Absolute Must SeeIMPORTANT: An application form, including checks on credit score and affordability, must be completed before viewing.",https://www.rightmove.co.uk/properties/167348978#/?channel=RES_LET,/property-to-rent/contactBranch.html?propertyId=167348978,"Sacha Scott, Banstead",52749,Added on 24/09/2025,2025-09-24T10:02:54Z,,SM1,2025-10-15T18:50:06.850862,"{'let available date': 'Now', 'deposit': '£1,615', 'min. tenancy': '12 months', 'let type': 'Long term', 'furnish type': 'Unfurnished', 'council tax': 'Ask agent'}",486.0,45.0,True,,"(51.3660349, -0.1940526)",16.467298128225103,80.0,67.0654037435498,45.0,67.83
166332533,1500,"£1,500 pcm",monthly,Flat,1,1.0,"The Broadway, Cheam, Sutton, SM3","ZERO DEPOSIT AVAILABLE. LONG LET. Presented in excellent condition throughout, this modern 1 bedroom apartment is situated moments from an excellent selection of amenities on Cheam high street.",https://www.rightmove.co.uk/properties/166332533#/?channel=RES_LET,/property-to-rent/contactBranch.html?propertyId=166332533,"Foxtons, New Malden",149153,Added on 28/08/2025,2025-08-28T19:49:22Z,,SM3,2025-10-15T18:50:16.521105,"{'let available date': 'Ask agent', 'deposit': '£1,731', 'min. tenancy': 'Ask agent', 'let type': 'Long term', 'furnish type': 'Unfurnished', 'council tax': 'Ask agent'}",454.0,42.0,True,,"(51.3587994, -0.2165566)",17.72521273661698,77.77777777777779,64.54957452676604,42.0,65.33
161067107,1400,"£1,400 pcm",monthly,Flat,1,1.0,"Park Hill, Carshalton, Greater London, SM5",Charming 1-Bedroom Flat in the Heart of Sutton - Prime Location!,https://www.rightmove.co.uk/properties/161067107#/?channel=RES_LET,/property-to-rent/contactBranch.html?propertyId=161067107,"ROCKWELL GREEN PROPERTIES LIMITED, London",288347,Added on 04/08/2025,2025-04-24T12:01:05Z,,SM5,2025-10-15T18:50:19.037730,"{'let available date': 'Now', 'deposit': '£1,300', 'min. tenancy': '6 months', 'let type': 'Long term', 'furnish type': 'Unfurnished', 'council tax': 'Ask agent'}",350.0,33.0,True,,"(51.3602524, -0.1695849)",16.70612242519933,80.0,66.58775514960135,33.0,65.24
165488306,1500,"£1,500 pcm",monthly,Semi-Detached,2,1.0,"Carshalton Park Road, Carshalton, Greater London, SM5","Spacious 2-Bed First Floor Flat - Excellent Location - Available ImmediatelyA bright and spacious two-bedroom first-floor flat, ideally located in the heart of Carshalton Beeches, just moments from local amenities, transport links, and schools. Perfect for professionals, couples, or small families",https://www.rightmove.co.uk/properties/165488306#/?channel=RES_LET,/property-to-rent/contactBranch.html?propertyId=165488306,"ROCKWELL GREEN PROPERTIES LIMITED, London",288347,Added on 07/08/2025,2025-08-07T17:48:25Z,,SM5,2025-10-15T18:50:19.037716,"{'let available date': 'Ask agent', 'deposit': 'Ask agent', 'min. tenancy': '6 months', 'let type': 'Long term', 'furnish type': 'Unfurnished', 'council tax': 'Ask agent'}",400.0,37.0,True,,"(51.3605676, -0.1678932)",16.651394616949883,77.77777777777779,66.69721076610023,37.0,65.19
167986616,1400,"£1,400 pcm",monthly,Apartment,1,1.0,"Nelson Road, Twickenham","This smart, top-floor apartment is situated in a convenient location for Whitton High Street, the train station and within easy access to Twickenham town centre. Well presented with a bright, neutral décor, providing a living/dining room leading into a modern kitchen, a good siz...",https://www.rightmove.co.uk/properties/167986616#/?channel=RES_LET,/property-to-rent/contactBranch.html?propertyId=167986616,"Chase Buchanan, Twickenham & Strawberry Hill - Lettings",48798,Added on 08/10/2025,2025-10-08T14:06:38Z,,,2025-10-15T18:49:46.492388,"{'let available date': 'Ask agent', 'deposit': '£1,615', 'min. tenancy': '12 months', 'let type': 'Long term', 'furnish type': 'Ask agent', 'council tax': 'Ask agent'}",380.0,35.0,True,,"(51.4528362, -0.3615258)",17.37511550723064,80.0,65.24976898553872,35.0,65.1
166064060,335,"£1,452 pcm",weekly,Flat,1,1.0,"Burton Road, Kilburn",Lovely one bedroom flat on 2nd floor of period conversion. Bright neutral décor and wooden flooring throughout. Open plan kitchen lounge area with washing machine. Bedroom on separate level. Three piece shower room with attached power shower. Fully furnished. Great for couples and sharers.,https://www.rightmove.co.uk/properties/166064060#/?channel=RES_LET,/property-to-rent/contactBranch.html?propertyId=166064060,"parkinsonfarr, Willesden Green",29643,Reduced today,2025-08-21T15:21:52Z,,,2025-10-15T18:49:25.586976,"{'let available date': 'Now', 'deposit': 'Ask agent', 'min. tenancy': 'Ask agent', 'let type': 'Long term', 'furnish type': 'Furnished', 'council tax': 'Ask agent'}",35.0,3.0,True,,,,100.0,0.0,43.729438202247195,48.75
167347229,334,"£1,447 pcm",weekly,Flat,1,1.0,"Cygnet Close, Stonebridge, NW10 8TP",Spacious purpose built 1 bedroom ground floor flat * Fitted kitchen * Good size bedroom * Modern bathroom * Offered in very good condition * Free Parking Located on a quiet residential area. With good access to local amenities as the development is located just off the Bre...,https://www.rightmove.co.uk/properties/167347229#/?channel=RES_LET,/property-to-rent/contactBranch.html?propertyId=167347229,"Churchill & Mathesons, Harlesden",266774,Reduced yesterday,2025-09-24T09:38:20Z,,NW10,2025-10-15T18:49:30.583850,"{'let available date': 'Now', 'deposit': '£1,730', 'min. tenancy': 'Ask agent', 'let type': 'Long term', 'furnish type': 'Furnished or unfurnished, landlord is flexible', 'council tax': 'Ask agent'}",408.0,38.0,True,,,,100.0,0.0,38.0,47.6
167746622,300,"£1,300 pcm",weekly,Flat,1,1.0,"Elm Grove, Cricklewood","This one bedroom top floor period conversion is ideally situated close to local amenities and transport links. The property has a double bedroom, a bright reception, a separate kitchen and a tiled bathroom with bath and shower.",https://www.rightmove.co.uk/properties/167746622#/?channel=RES_LET,/property-to-rent/contactBranch.html?propertyId=167746622,"Dexters, Cricklewood",72541,Added on 03/10/2025,2025-10-03T09:30:41Z,,,2025-10-15T18:49:56.802806,"{'let available date': 'Ask agent', 'deposit': '£1,500', 'min. tenancy': 'Ask agent', 'let type': 'Long term', 'furnish type': 'Part furnished', 'council tax': 'Ask agent'}",352.7,32.8,True,,,,100.0,0.0,32.8,46.56
87315885,1500,"£1,500 pcm",monthly,Apartment,1,1.0,"Grove Place, Eltham, London, SE9",Modern spacious one bedroom apartment in newly constructed portered development in prime Eltham location ,https://www.rightmove.co.uk/properties/87315885#/?channel=RES_LET,/property-to-rent/contactBranch.html?propertyId=87315885,"jdm, Greenwich",250727,Added yesterday,2025-10-14T15:49:51Z,,SE9,2025-10-15T18:49:28.011667,"{'let available date': '20/10/2025', 'deposit': '£1,730', 'min. tenancy': '12 months', 'let type': 'Long term', 'furnish type': 'Unfurnished', 'council tax': 'Ask agent'}",673.0,63.0,True,,,,77.77777777777779,0.0,63.0,43.71
165931457,1450,"£1,450 pcm",monthly,Flat,1,1.0,"Burford Gardens, Palmers Green, N13","SPACIOUS FULLY FURNISHED ONE BED FLAT TO RENT OFF FOX LANE N13. A one double bedroom first floor converted flat located off Fox Lane within easy walking distance of Palmers Green's shops, restaurants and mainline station into Moorgate. Southgate tube station is also a short bus ride awa...",https://www.rightmove.co.uk/properties/165931457#/?channel=RES_LET,/property-to-rent/contactBranch.html?propertyId=165931457,"Anthony Webb Estate Agents, Palmers Green",9316,Reduced on 26/09/2025,2025-08-19T09:34:42Z,,N13,2025-10-15T18:50:04.125793,"{'let available date': 'Now', 'deposit': '£1,673', 'min. tenancy': 'Ask agent', 'let type': 'Long term', 'furnish type': 'Furnished', 'council tax': 'Ask agent'}",635.0,59.0,True,,,,78.88888888888889,0.0,59.0,43.36
87294834,1350,"£1,350 pcm",monthly,Ground Flat,1,,Enterprise Court,"base rent: £1350, deposit: £1557.69, additional rent for pets: £50, number of bedrooms: 1, size: 386.4 sq ft, apartment type: ground floor, all pets allowed, heating type: gas, fully integrated kitchen, unfurnished, stove: induction, dishwasher, open pla…",https://www.rightmove.co.uk/properties/87294834#/?channel=RES_LET,/property-to-rent/contactBranch.html?propertyId=87294834,"Akelius Residential Ltd, London",102505,Added yesterday,2025-10-14T11:15:00Z,,,2025-10-15T18:49:30.583882,"{'let available date': '01/11/2025', 'deposit': '£1,557', 'min. tenancy': 'Ask agent', 'let type': 'Long term', 'furnish type': 'Unfurnished', 'council tax': 'Ask agent'}",386.0,36.0,True,,"(51.415171, -0.7652633)",45.50672721207369,81.11111111111111,8.986545575852617,36.0,43.24
167847509,1500,"£1,500 pcm",monthly,House,1,1.0,"The Club House, 
65 Richmond Road, TW1",A second floor one bedroom apartment ideally located on a highly sought after Road in Twickenham less than 10 minutes’ walk to Twickenham Station.,https://www.rightmove.co.uk/properties/167847509#/?channel=RES_LET,/property-to-rent/contactBranch.html?propertyId=167847509,"Chestertons, Richmond Lettings",148955,Added on 06/10/2025,2025-10-06T12:00:37Z,,TW1,2025-10-15T18:49:51.505914,"{'let available date': '15/12/2025', 'deposit': '£1,731', 'min. tenancy': '12 months', 'let type': 'Long term', 'furnish type': 'Furnished or unfurnished, landlord is flexible', 'council tax': 'Ask agent'}",649.0,60.0,True,,,,77.77777777777779,0.0,60.0,43.11
161032610,1300,"£1,300 pcm",monthly,Ground Flat,1,1.0,"Boscombe Gardens, London, SW16","Spacious 1-Bedroom Garden Flat - Streatham, SW16 A rare find! This bright and generously sized 1-bedroom ground floor flat",https://www.rightmove.co.uk/properties/161032610#/?channel=RES_LET,/property-to-rent/contactBranch.html?propertyId=161032610,"ROCKWELL GREEN PROPERTIES LIMITED, London",288347,Added on 24/04/2025,2025-04-24T14:18:52Z,,SW16,2025-10-15T18:50:21.311040,"{'let available date': 'Ask agent', 'deposit': '£1,300', 'min. tenancy': '6 months', 'let type': 'Long term', 'furnish type': 'Unfurnished', 'council tax': 'Ask agent'}",500.0,46.0,True,,,,82.22222222222221,0.0,46.0,42.09
166712321,1350,"£1,350 pcm",monthly,Flat,1,1.0,"Tavernelle House, High Street, Sutton SM1",Modern 1 Bed Apartment with Private Balcony in Desirable Sutton Location,https://www.rightmove.co.uk/properties/166712321#/?channel=RES_LET,/property-to-rent/contactBranch.html?propertyId=166712321,"Complete Prime Residential Ltd, London",53946,Reduced on 08/10/2025,2025-09-08T11:32:46Z,,SM1,2025-10-15T18:49:46.492445,"{'let available date': 'Now', 'deposit': '£1,558', 'min. tenancy': '12 months', 'let type': 'Long term', 'furnish type': 'Unfurnished', 'council tax': 'Ask agent'}",506.0,47.0,True,,,,81.11111111111111,0.0,47.0,41.84
167272187,1450,"£1,450 pcm",monthly,Apartment,1,1.0,"Oliver Court, Isleworth","Available Beginning of November is this first floor, one double bedroom apartment which provides contemporary accommodation and benefits from the following: spacious lounge, separate kitchen with appliances, shower room, allocated parking and ample storage space. ",https://www.rightmove.co.uk/properties/167272187#/?channel=RES_LET,/property-to-rent/contactBranch.html?propertyId=167272187,"Xavi & Co, Brentford",88636,Added on 22/09/2025,2025-09-22T15:46:21Z,,,2025-10-15T18:50:09.284954,"{'let available date': '03/11/2025', 'deposit': '£1,673', 'min. tenancy': '12 months', 'let type': 'Long term', 'furnish type': 'Unfurnished', 'council tax': 'Ask agent'}",538.0,50.0,True,,,,78.88888888888889,0.0,50.0,41.56
168197408,1400,"£1,400 pcm",monthly,Apartment,1,1.0,"Dutton House, Abbey Wood","Situated on the fifth floor of Dutton House, this one bedroom apartment offers far-reaching views, a private balcony, and the added benefit of allocated parking. The layout includes a double bedroom, an open plan living and kitchen area, and a bathroom, making it a practical and comforta...",https://www.rightmove.co.uk/properties/168197408#/?channel=RES_LET,/property-to-rent/contactBranch.html?propertyId=168197408,"Hunters, Abbeywood London",62489,Added today,2025-10-15T12:15:58Z,,,2025-10-15T18:49:25.586919,"{'let available date': 'Now', 'deposit': '£1,615', 'min. tenancy': 'Ask agent', 'let type': 'Long term', 'furnish type': 'Ask agent', 'council tax': 'Ask agent'}",505.0,47.0,True,,,,80.0,0.0,47.0,41.4
168180629,1450,"£1,450 pcm",monthly,Flat,1,,"New Horizons Court, London, TW8",Quick Access to Central London & Heathrow - WIFI Included - Bright Interiors - Communal Courtyards - Pet Friendly - On-Site Parking - Modern Kitchens,https://www.rightmove.co.uk/properties/168180629#/?channel=RES_LET,/property-to-rent/contactBranch.html?propertyId=168180629,"Vonder, Vonder",79578,Added yesterday,2025-10-14T01:56:33Z,,TW8,2025-10-15T18:49:33.363188,"{'let available date': 'Now', 'deposit': 'Ask agent', 'min. tenancy': '12 months', 'let type': 'Long term', 'furnish type': 'Furnished or unfurnished, landlord is flexible', 'council tax': 'Ask agent'}",504.0,47.0,True,,,,78.88888888888889,0.0,47.0,40.96
87324111,1400,"£1,400 pcm",monthly,Flat,1,1.0,"The Spinney, Granville Road, London","*AVAILABLE NOW* *FURNISHED* One Bedroom Ground Floor Flat - West Finchley, N12 Located on the sought-after Granville Road, this charming ground floor flat offers the perfect balance of comfort and convenience.",https://www.rightmove.co.uk/properties/87324111#/?channel=RES_LET,/property-to-rent/contactBranch.html?propertyId=87324111,"James Kei London, London",79893,Added on 03/10/2025,2025-10-14T17:43:36Z,,,2025-10-15T18:49:56.802754,"{'let available date': 'Now', 'deposit': 'Ask agent', 'min. tenancy': 'Ask agent', 'let type': 'Long term', 'furnish type': 'Furnished', 'council tax': 'Ask agent'}",463.0,43.0,True,,,,80.0,0.0,43.0,40.6
168018077,1400,"£1,400 pcm",monthly,Flat,1,1.0,"Baildon Street, London, SE8","Contemporary one bedroom flat within a unique development, well-located for all local amenities and transport links. Comprising of wooden flooring, gas central heating and double glazing. Also benefiting from a separate kitchen, modern shower suite, one double bedroom with built-in wardrobe and ...",https://www.rightmove.co.uk/properties/168018077#/?channel=RES_LET,/property-to-rent/contactBranch.html?propertyId=168018077,"Keatons, Deptford",2915,Reduced on 13/10/2025,2025-10-09T10:20:03Z,,SE8,2025-10-15T18:49:35.769206,"{'let available date': 'Now', 'deposit': '£1,615', 'min. tenancy': 'Ask agent', 'let type': 'Long term', 'furnish type': 'Unfurnished', 'council tax': 'Ask agent'}",449.0,42.0,True,,,,80.0,0.0,42.0,40.4
167358197,1450,"£1,450 pcm",monthly,Flat,1,1.0,"Azalea Court, Azalea Close, Hanwell, W7","A newly decorated one bedroom flat situated on the second floor of this popular & well maintained purpose built block. The property consists of a spacious reception, a separate eat in fitted kitchen with washing machine, one double bedroom and a bathroom with bath and shower over. The flat...",https://www.rightmove.co.uk/properties/167358197#/?channel=RES_LET,/property-to-rent/contactBranch.html?propertyId=167358197,"Doyle Sales & Lettings, Hanwell",91000,Added on 24/09/2025,2025-09-24T12:05:41Z,,W7,2025-10-15T18:50:06.850856,"{'let available date': '08/11/2026', 'deposit': 'Ask agent', 'min. tenancy': '12 months', 'let type': 'Long term', 'furnish type': 'Unfurnished', 'council tax': 'Ask agent'}",471.0,44.0,True,,,,78.88888888888889,0.0,44.0,40.36
60747017,1500,"£1,500 pcm",monthly,Flat,1,1.0,"Windermere Road, London, N19","A well-proportioned one double-bedroom apartment, situated on the lower ground floor of a development on Windermere Road. Benefiting from a separate lounge and kitchen, central gas heating, double glazing, and a communal garden. Close to Archway tube station. Available 2nd January 2026",https://www.rightmove.co.uk/properties/60747017#/?channel=RES_LET,/property-to-rent/contactBranch.html?propertyId=60747017,"CP Papas Property Centre, London",78719,Added today,2016-07-20T14:58:54Z,,N19,2025-10-15T18:49:25.586943,"{'let available date': '02/01/2026', 'deposit': 'Ask agent', 'min. tenancy': '12 months', 'let type': 'Long term', 'furnish type': 'Furnished', 'council tax': 'Ask agent'}",474.0,44.0,True,,,,77.77777777777779,0.0,44.0,39.91
153223805,1425,"£1,425 pcm",monthly,Flat,1,1.0,"Wells Court, Longfield Drive, CR4","Situated an effortless stroll (5 minutes walk) away from a range of local amenities (including shops, gyms, supermarkets, cafes and restaurants) and a plethora of transport links (within 10 minutes walk) including range of bus routes and Colliers Wood Underground Station (Northern Line).This flat...",https://www.rightmove.co.uk/properties/153223805#/?channel=RES_LET,/property-to-rent/contactBranch.html?propertyId=153223805,"Rentals And Sales, Wimbledon",50366,Reduced on 08/10/2025,2024-10-01T15:55:02Z,,CR4,2025-10-15T18:49:46.492461,"{'let available date': 'Now', 'deposit': '£1,644', 'min. tenancy': 'Ask agent', 'let type': 'Long term', 'furnish type': 'Part furnished', 'council tax': 'Ask agent'}",431.0,40.0,True,,,,79.44444444444444,0.0,40.0,39.78
95816894,1450,"£1,450 pcm",monthly,Apartment,1,1.0,"Pullman Court, Streatham Hill, London, SW2","A one bedroom purpose built flat in a Grade II listed modernist block on Streatham Hill. The property benefits from having new secondary glazing, new electrical heaters and is ideally placed for easy access to Brixton, Balham, Clapham and Tulse Hill.",https://www.rightmove.co.uk/properties/95816894#/?channel=RES_LET,/property-to-rent/contactBranch.html?propertyId=95816894,"Winkworth, Streatham",34334,Added today,2020-08-07T22:10:43Z,,SW2,2025-10-15T18:49:25.586929,"{'let available date': '17/12/2025', 'deposit': '£0', 'min. tenancy': '12 months', 'let type': 'Long term', 'furnish type': 'Unfurnished', 'council tax': 'Ask agent'}",442.0,41.0,True,,,,78.88888888888889,0.0,41.0,39.76
167553827,1500,"£1,500 pcm",monthly,Apartment,1,1.0,Brentford High Street Location,"Available in October is this furnished one double bedroom apartment located close to Brentford High Street,shops and transport links.Benefits includes, lounge/diner, external drying area, gas central heating, ample storage, communal gardens, modern fitted kitchen, bathroom and access to Syon Park.",https://www.rightmove.co.uk/properties/167553827#/?channel=RES_LET,/property-to-rent/contactBranch.html?propertyId=167553827,"Xavi & Co, Brentford",88636,Added on 29/09/2025,2025-09-29T12:16:05Z,,,2025-10-15T18:50:04.125764,"{'let available date': 'Now', 'deposit': '£1,730', 'min. tenancy': 'Ask agent', 'let type': 'Long term', 'furnish type': 'Furnished', 'council tax': 'Ask agent'}",463.0,43.0,True,,,,77.77777777777779,0.0,43.0,39.71
168102197,1500,"£1,500 pcm",monthly,Flat,1,1.0,"Dairyman Close, Cricklewood, NW2","This one's for you if... You’ve always wanted a home that feels open, bright, and easy to live in. Clean, neutral interiors keep things modern and fresh, while the layout flows in a way that makes working from home simple—whether that’s at your desk or out in the com...",https://www.rightmove.co.uk/properties/168102197#/?channel=RES_LET,/property-to-rent/contactBranch.html?propertyId=168102197,"Paramount, London - Lettings",62636,Added on 10/10/2025,2025-10-10T17:14:29Z,,NW2,2025-10-15T18:49:38.504345,"{'let available date': '17/11/2025', 'deposit': '£1,730', 'min. tenancy': 'Ask agent', 'let type': 'Long term', 'furnish type': 'Part furnished', 'council tax': 'Ask agent'}",463.0,43.0,True,,,,77.77777777777779,0.0,43.0,39.71
167159576,1500,"£1,500 pcm",monthly,Flat,1,1.0,"Corbyn Street, London, N4",A spacious one-bedroom garden flat to rent. The property is located close to amenities of Stroud Green and excellent transport links including Finsbury Park Tube.,https://www.rightmove.co.uk/properties/167159576#/?channel=RES_LET,/property-to-rent/contactBranch.html?propertyId=167159576,"Kinleigh Folkard & Hayward - Lettings, Crouch End",55432,Added on 18/09/2025,2025-09-18T16:33:33Z,,N4,2025-10-15T18:50:09.284994,"{'let available date': 'Now', 'deposit': '£0', 'min. tenancy': 'Ask agent', 'let type': 'Long term', 'furnish type': 'Furnished', 'council tax': 'Ask agent'}",370.0,34.0,True,,,,77.77777777777779,0.0,34.0,37.91
167745617,1500,"£1,500 pcm",monthly,Flat,1,1.0,"Westgate House, Ealing, W5","We are pleased to present this modern studio apartment in the sought-after West Gate development in Ealing, W5. The apartment offers a bright open-plan living area, a contemporary fitted kitchen with integrated appliances, a comfortable double bedroom space, and a stylish b...",https://www.rightmove.co.uk/properties/167745617#/?channel=RES_LET,/property-to-rent/contactBranch.html?propertyId=167745617,"Holland Properties, London",36516,Reduced today,2025-10-03T09:19:51Z,,W5,2025-10-15T18:49:23.151621,"{'let available date': '12/11/2025', 'deposit': '£1,730', 'min. tenancy': 'Ask agent', 'let type': 'Long term', 'furnish type': 'Furnished', 'council tax': 'Ask agent'}",365.0,34.0,True,,,,77.77777777777779,0.0,34.0,37.91
168138026,1495,"£1,495 pcm",monthly,Flat,1,1.0,Flat 2 12 Argyle Road,"base rent: £1495, deposit: £1725, number of bedrooms: 1, size: 351 sq ft, apartment type: lower ground, , heating type: electric, furniture options available at additional costs, stove: induction, open plan kitchen, washer dryer, number of bathrooms: 1, …",https://www.rightmove.co.uk/properties/168138026#/?channel=RES_LET,/property-to-rent/contactBranch.html?propertyId=168138026,"Akelius Residential Ltd, London",102505,Added on 13/10/2025,2025-10-13T09:48:10Z,,,2025-10-15T18:49:35.769209,"{'let available date': '18/11/2025', 'deposit': '£1,725', 'min. tenancy': 'Ask agent', 'let type': 'Long term', 'furnish type': 'Ask agent', 'council tax': 'Ask agent'}",351.0,33.0,True,,,,77.88888888888889,0.0,33.0,37.76
165662927,1350,"£1,350 pcm",monthly,Flat,1,1.0,"Fordwych Road, Cricklewood, NW2","This one's for you if... You’re after a home that feels like a cosy retreat, spacious, cosy, and full of light. You don’t need flashy or ultra-modern, but it has to feel bright, comfortable, and have plenty of room to store all your bits without compromising on space. Most...",https://www.rightmove.co.uk/properties/165662927#/?channel=RES_LET,/property-to-rent/contactBranch.html?propertyId=165662927,"Paramount, London - Lettings",62636,Reduced on 15/09/2025,2025-08-12T15:35:17Z,,NW2,2025-10-15T18:49:56.802630,"{'let available date': 'Now', 'deposit': '£1,557', 'min. tenancy': 'Ask agent', 'let type': 'Long term', 'furnish type': 'Part furnished', 'council tax': 'Ask agent'}",223.0,21.0,True,,,,81.11111111111111,0.0,21.0,36.64
162180857,1350,"£1,350 pcm",monthly,Flat,1,1.0,"Lascotts Road, Wood Green","P M Estatesare delighted to present this newly refurbished and spacious one-bedroom self-contained Victorian converted flat. This charming residence is conveniently situated just off Green Lanes,",https://www.rightmove.co.uk/properties/162180857#/?channel=RES_LET,/property-to-rent/contactBranch.html?propertyId=162180857,"Peter Michael Estates & Lettings, London",25176,Reduced on 30/09/2025,2025-05-20T12:16:52Z,,,2025-10-15T18:50:01.586695,"{'let available date': 'Now', 'deposit': 'Ask agent', 'min. tenancy': 'Ask agent', 'let type': 'Long term', 'furnish type': 'Furnished or unfurnished, landlord is flexible', 'council tax': 'Ask agent'}",140.0,13.0,True,,,,81.11111111111111,0.0,13.0,35.04
