id,price,price_display,frequency,property_type,bedrooms,bathrooms,address,summary,property_url,contact_url,branch,branch_id,added_or_reduced,first_visible_date,let_type,postcode,search_date,letting_details,property_size_sqft,property_size_sqm,scraping_success,scraping_error,coordinates,distance_to_center_km,price_score,location_score,size_score,overall_score,size_data_status,geocoding_status
165831191,1300,"£1,300 pcm",monthly,Flat,1,1.0,"Footscray Road, London, SE9","Well-presented one bedroom apartment situated in the heart of Eltham, a stones throw from Eltham High Street. Offering off-street parking and a short walk to Eltham Station this property is perfect for commuters. Contact us on . ",https://www.rightmove.co.uk/properties/165831191#/?channel=RES_LET,/property-to-rent/contactBranch.html?propertyId=165831191,"Your Move, Eltham",34806,Reduced on 11/10/2025,2025-08-16T12:31:58Z,,SE9,2025-10-15T18:49:35.769228,"{'let available date': 'Now', 'deposit': '£1,500', 'min. tenancy': '6 months', 'let type': 'Long term', 'furnish type': 'Unfurnished', 'council tax': 'Ask agent'}",,,True,,"(51.4442493, 0.0634096)",15.052463386249457,82.22222222222221,69.89507322750109,43.729438202247195,69.59,estimated,geocoded
168066362,1450,"£1,450 pcm",monthly,Apartment,1,1.0,"Angelica Drive, Beckton, E6",One bedroom ground floor part furnished flat in excellent condition. The property in situated in a great location being only a short walk from Beckton Station and its many shopping facilities. The property is spacious throughout and also includes an allocated parking space. Available Now ,https://www.rightmove.co.uk/properties/168066362#/?channel=RES_LET,/property-to-rent/contactBranch.html?propertyId=168066362,"Spencer James Residential, London",283697,Added on 10/10/2025,2025-10-10T09:51:37Z,,E6,2025-10-15T18:49:40.916116,"{'let available date': 'Now', 'deposit': 'Ask agent', 'min. tenancy': '12 months', 'let type': 'Long term', 'furnish type': 'Unfurnished', 'council tax': 'Ask agent'}",,,True,,"(51.515919, 0.0657831)",13.453244242436494,78.88888888888889,73.093511515127,43.729438202247195,69.54,estimated,geocoded
167868992,1500,"£1,500 pcm",monthly,Flat,1,1.0,"Scottwell Drive, Colindale, NW9","A first floor newly refurbished one bedroom apartment in a purpose built block. The property compromises of a large living room with a separate brand new modern kitchen, a large double bedroom and a family bathroom. Benefiting from wooden flooring throughout and resident parking.",https://www.rightmove.co.uk/properties/167868992#/?channel=RES_LET,/property-to-rent/contactBranch.html?propertyId=167868992,"Chancellors, Finchley Lettings",35969,Added on 06/10/2025,2025-10-06T16:45:40Z,,NW9,2025-10-15T18:49:51.505876,"{'let available date': '30/11/2025', 'deposit': '£1,730', 'min. tenancy': 'Ask agent', 'let type': 'Long term', 'furnish type': 'Unfurnished', 'council tax': 'Ask agent'}",,,True,,"(51.5954091, -0.2499296)",12.897876812105464,77.77777777777779,74.20424637578907,43.729438202247195,69.54,estimated,geocoded
167107814,1500,"£1,500 pcm",monthly,Flat,1,1.0,"a High Street South, London",Lux Homes are excited to offer to rent this spacious one bedroom apartment. While being unfurnished the property has been maintained to a very good standard and sits in a perfect location. Close to local transport links and shops.,https://www.rightmove.co.uk/properties/167107814#/?channel=RES_LET,/property-to-rent/contactBranch.html?propertyId=167107814,"Lux Homes, London & Essex",166871,Added on 17/09/2025,2025-09-17T16:15:48Z,,,2025-10-15T18:50:11.737994,"{'let available date': 'Now', 'deposit': '£1,875', 'min. tenancy': 'Ask agent', 'let type': 'Long term', 'furnish type': 'Unfurnished', 'council tax': 'Ask agent'}",,,True,,"(51.526495, 0.0561602)",12.918710274500526,77.77777777777779,74.16257945099895,43.729438202247195,69.52,estimated,geocoded
166302419,1495,"£1,495 pcm",monthly,Flat,1,1.0,"Pepys Road, Raynes Park","This ground floor, one bedroom garden flat offers a large open plan living room/kitchen, which is great for working from home or entertaining.",https://www.rightmove.co.uk/properties/166302419#/?channel=RES_LET,/property-to-rent/contactBranch.html?propertyId=166302419,"Dexters, Wimbledon",84878,Reduced on 09/09/2025,2025-08-28T11:58:56Z,,,2025-10-15T18:50:14.111261,"{'let available date': 'Ask agent', 'deposit': '£1,788', 'min. tenancy': 'Ask agent', 'let type': 'Long term', 'furnish type': 'Unfurnished', 'council tax': 'Ask agent'}",,,True,,"(51.4098622, -0.2281921)",12.97448670947995,77.88888888888889,74.0510265810401,43.729438202247195,69.52,estimated,geocoded
167332544,1300,"£1,300 pcm",monthly,Flat,1,1.0,"Plumstead Common Road, London, SE18","Delightful 1 bedroom, 1 bathroom fully furnished flat in Woolwich. The flat is available to move in from 15 September 2025. The rent is £1300pcm (not including bills) and a deposit of £1300. The... ** Property Reference: 2603853 **",https://www.rightmove.co.uk/properties/167332544#/?channel=RES_LET,/property-to-rent/contactBranch.html?propertyId=167332544,"OpenRent, London",96668,Reduced on 05/10/2025,2025-09-23T23:05:25Z,,SE18,2025-10-15T18:49:54.205767,"{'let available date': 'Now', 'deposit': '£1,300', 'min. tenancy': 'Ask agent', 'let type': 'Long term', 'furnish type': 'Furnished', 'council tax': 'Ask agent'}",,,True,,"(51.4799306, 0.0861011)",15.168752562102547,82.22222222222221,69.6624948757949,43.729438202247195,69.5,estimated,geocoded
87320511,1500,"£1,500 pcm",monthly,Flat,1,1.0,"Grange Road, Upper Norwood, London, SE25","ZERO DEPOSIT AVAILABLE. LONG LET. Conveniently situated for easy access to amenities, this delightful 1 bedroom flat provides a well equipped kitchen and a reception room with space for dining.",https://www.rightmove.co.uk/properties/87320511#/?channel=RES_LET,/property-to-rent/contactBranch.html?propertyId=87320511,"Foxtons, Crystal Palace",100426,Added on 29/08/2025,2025-10-14T16:51:25Z,,SE25,2025-10-15T18:50:16.521093,"{'let available date': 'Ask agent', 'deposit': '£1,731', 'min. tenancy': 'Ask agent', 'let type': 'Long term', 'furnish type': 'Unfurnished', 'council tax': 'Ask agent'}",412.0,38.0,True,,"(51.4074777, -0.0892509)",11.507875615196314,77.77777777777779,76.98424876960738,38.0,69.5,actual,geocoded
167567690,1400,"£1,400 pcm",monthly,Apartment,1,1.0,Hepple Close,"Welcome to this charming one-bedroom apartment located in the highly sought-after area of Hepple Close. This delightful property offers a perfect blend of comfort and convenience, making it an ideal choice for individuals or couples seeking a cosy home. Upon entering the apartment, you w...",https://www.rightmove.co.uk/properties/167567690#/?channel=RES_LET,/property-to-rent/contactBranch.html?propertyId=167567690,"Anthony James Manser, Isleworth",37403,Added on 29/09/2025,2025-09-29T15:33:20Z,,,2025-10-15T18:50:04.125759,"{'let available date': '31/10/2025', 'deposit': '£1,615', 'min. tenancy': 'Ask agent', 'let type': 'Long term', 'furnish type': 'Unfurnished', 'council tax': 'Ask agent'}",,,True,,"(51.472933, -0.3219669)",14.055292037078534,80.0,71.88941592584294,43.729438202247195,69.5,estimated,geocoded
168205802,1450,"£1,450 pcm",monthly,Flat,1,1.0,"Calderwood Street, London, SE18","Eazy 2 Let Ltd are pleased to offer this one-bedroom 4th-floor apartment located in the heart of Woolwich, SE18 6JG. This property has an open-plan reception with a fitted kitchen with fitted appliances, a family bathroom, and a master bedroom with large",https://www.rightmove.co.uk/properties/168205802#/?channel=RES_LET,/property-to-rent/contactBranch.html?propertyId=168205802,"EAZY 2 LET LTD, London",61167,Added today,2025-10-15T14:18:05Z,,SE18,2025-10-15T18:49:23.151645,"{'let available date': '14/11/2025', 'deposit': '£1,450', 'min. tenancy': 'Ask agent', 'let type': 'Long term', 'furnish type': 'Part furnished', 'council tax': 'Ask agent'}",,,True,,"(51.4910715, 0.0649145)",13.502002762572747,78.88888888888889,72.99599447485451,43.729438202247195,69.5,estimated,geocoded
167027762,1450,"£1,450 pcm",monthly,Flat,1,1.0,"Powis Street, Woolwich","A light and well-proportioned one double bedroom, second floor flat (no lift) located on Powis Street.",https://www.rightmove.co.uk/properties/167027762#/?channel=RES_LET,/property-to-rent/contactBranch.html?propertyId=167027762,"Marsh & Parsons, Streatham Hill",207812,Added on 19/08/2025,2025-09-16T08:59:27Z,,,2025-10-15T18:50:19.037669,"{'let available date': 'Ask agent', 'deposit': '£1,638', 'min. tenancy': 'Ask agent', 'let type': 'Long term', 'furnish type': 'Furnished', 'council tax': 'Ask agent'}",,,True,,"(51.4916482, 0.0656659)",13.544762953640515,78.88888888888889,72.91047409271897,43.729438202247195,69.47,estimated,geocoded
167601419,1395,"£1,395 pcm",monthly,Flat,1,0.0,"High Road, South Woodford, London","Lifestyle Property are delighted to offer to market this modern, 1 bedroom flat to rent in South Woodford. Based on the first floor, this property is just a 5 minute walk to South Woodford Central Line Station which has easy access into Central London and surrounding areas. The property is finish...",https://www.rightmove.co.uk/properties/167601419#/?channel=RES_LET,/property-to-rent/contactBranch.html?propertyId=167601419,"Lifestyle Property, Docklands",81013,Added on 30/09/2025,2025-09-30T11:41:13Z,,,2025-10-15T18:50:01.586693,"{'let available date': 'Now', 'deposit': '£1,609', 'min. tenancy': '12 months', 'let type': 'Long term', 'furnish type': 'Unfurnished', 'council tax': 'Ask agent'}",,,True,,"(51.5952338, 0.0221962)",14.210444158354502,80.11111111111111,71.57911168329099,43.729438202247195,69.42,estimated,geocoded
166064060,335,"£1,452 pcm",weekly,Flat,1,1.0,"Burton Road, Kilburn",Lovely one bedroom flat on 2nd floor of period conversion. Bright neutral décor and wooden flooring throughout. Open plan kitchen lounge area with washing machine. Bedroom on separate level. Three piece shower room with attached power shower. Fully furnished. Great for couples and sharers.,https://www.rightmove.co.uk/properties/166064060#/?channel=RES_LET,/property-to-rent/contactBranch.html?propertyId=166064060,"parkinsonfarr, Willesden Green",29643,Reduced today,2025-08-21T15:21:52Z,,,2025-10-15T18:49:25.586976,"{'let available date': 'Now', 'deposit': 'Ask agent', 'min. tenancy': 'Ask agent', 'let type': 'Long term', 'furnish type': 'Furnished', 'council tax': 'Ask agent'}",35.0,3.0,True,,"(51.5421571, -0.4719096)",24.19441590669675,100.0,51.61116818660649,43.729438202247195,69.39,corrected,geocoded
166579106,1450,"£1,450 pcm",monthly,Flat,1,1.0,"Gleneagle Road, Streatham, London, SW16",ZERO DEPOSIT AVAILABLE. LONG LET. This charming 1 bedroom flat is situated on the 1st floor and boasts bright and airy interiors throughout. It offers great accommodation including a spacious reception room and a double bedroom.,https://www.rightmove.co.uk/properties/166579106#/?channel=RES_LET,/property-to-rent/contactBranch.html?propertyId=166579106,"Foxtons, Streatham",71419,Reduced on 13/10/2025,2025-09-04T11:59:25Z,,SW16,2025-10-15T18:49:33.363219,"{'let available date': 'Ask agent', 'deposit': '£1,674', 'min. tenancy': 'Ask agent', 'let type': 'Long term', 'furnish type': 'Unfurnished', 'council tax': 'Ask agent'}",267.0,25.0,True,,"(51.4270941, -0.1316405)",9.016863375052491,78.88888888888889,81.96627324989501,25.0,69.34,actual,geocoded
167785229,1500,"£1,500 pcm",monthly,Flat,1,1.0,"Gilbert Close, Royal Herbert Pavilions, London, SE18",Larger than average ground floor apartment to let set within this popular Grade II listed development which includes use of the on site Leisure facilities and parking,https://www.rightmove.co.uk/properties/167785229#/?channel=RES_LET,/property-to-rent/contactBranch.html?propertyId=167785229,"Kinleigh Folkard & Hayward - Lettings, Blackheath",57916,Added on 03/10/2025,2025-10-03T16:52:15Z,,SE18,2025-10-15T18:49:56.802717,"{'let available date': 'Now', 'deposit': '£1,730', 'min. tenancy': 'Ask agent', 'let type': 'Long term', 'furnish type': 'Unfurnished', 'council tax': 'Ask agent'}",,,True,,"(51.4704849, 0.0523776)",13.182582633986796,77.77777777777779,73.6348347320264,43.729438202247195,69.31,estimated,geocoded
168107426,1450,"£1,450 pcm",monthly,Apartment,1,1.0,"Edward Avenue, Chingford E4","Coultons are thrilled to offer for rent in good decorative condition throughout, this one bedroom ground floor flat situated within a 15 minute walk of Highams Park Station, close to Chingford Mount local shops and amenities as well as a short bus ride from Blackhorse Road (Victoria Line) undergr...",https://www.rightmove.co.uk/properties/168107426#/?channel=RES_LET,/property-to-rent/contactBranch.html?propertyId=168107426,"Coultons, London",115756,Added on 10/10/2025,2025-10-10T19:24:00Z,,E4,2025-10-15T18:49:38.504341,"{'let available date': 'Now', 'deposit': '£1,673', 'min. tenancy': 'Ask agent', 'let type': 'Long term', 'furnish type': 'Unfurnished', 'council tax': 'Ask agent'}",,,True,,"(51.609506, -0.0138787)",13.765565389050257,78.88888888888889,72.46886922189948,43.729438202247195,69.29,estimated,geocoded
168212261,1450,"£1,450 pcm",monthly,Flat,1,1.0,"Walpole Road, London, E18","Charming 1-bedroom unfurnished apartment on the first floor. Located in a vibrant neighbourhood with on-street parking available. The property boasts a good size kitchen, spacious living area, and easy access to local amenities. Ideal for professionals or couples seeking a convenient city lifestyle.",https://www.rightmove.co.uk/properties/168212261#/?channel=RES_LET,/property-to-rent/contactBranch.html?propertyId=168212261,"Portico, Woodford",247475,Added today,2025-10-15T15:28:14Z,,E18,2025-10-15T18:49:23.151628,"{'let available date': '18/10/2025', 'deposit': 'Ask agent', 'min. tenancy': 'Ask agent', 'let type': 'Long term', 'furnish type': 'Unfurnished', 'council tax': 'Ask agent'}",,,True,,"(51.5955994, 0.014094)",13.833434140499676,78.88888888888889,72.33313171900065,43.729438202247195,69.23,estimated,geocoded
87325095,1450,"£1,450 pcm",monthly,Apartment,1,1.0,"Fishguard Way, E16","Available to move into now is this well presented one bedroom ground floor apartment in the popular Galleons Lock Development. Internally the property boasts a spacious open plan living room and kitchen, large bedroom with en-suite bathroom and further guest WC. The property further benefits from...",https://www.rightmove.co.uk/properties/87325095#/?channel=RES_LET,/property-to-rent/contactBranch.html?propertyId=87325095,"Spencer James Residential, London",283697,Added yesterday,2025-10-14T18:04:40Z,,E16,2025-10-15T18:49:28.011606,"{'let available date': 'Now', 'deposit': 'Ask agent', 'min. tenancy': 'Ask agent', 'let type': 'Long term', 'furnish type': 'Furnished', 'council tax': 'Ask agent'}",,,True,,"(51.5013487, 0.0716095)",13.852156236411702,78.88888888888889,72.2956875271766,43.729438202247195,69.22,estimated,geocoded
167537585,1300,"£1,300 pcm",monthly,Flat,1,1.0,"Hounslow Road, Twickenham, TW2",A stylish second floor conversion apartment with great views to the front and rear. With a modern finish this compact but well thought-out one bedroom home is well presented throughout with a larg... ** Property Reference: 2640676 **,https://www.rightmove.co.uk/properties/167537585#/?channel=RES_LET,/property-to-rent/contactBranch.html?propertyId=167537585,"OpenRent, London",96668,Reduced on 09/10/2025,2025-09-28T23:09:24Z,,TW2,2025-10-15T18:49:43.835056,"{'let available date': '01/11/2025', 'deposit': '£1,500', 'min. tenancy': 'Ask agent', 'let type': 'Long term', 'furnish type': 'Furnished', 'council tax': 'Ask agent'}",,,True,,"(51.4467444, -0.3281887)",15.517924312349846,82.22222222222221,68.9641513753003,43.729438202247195,69.22,estimated,geocoded
166949615,1350,"£1,350 pcm",monthly,Apartment,1,1.0,"Plumstead Common, SE18","** Zero Deposit Guarantee Available **
THIRD FLOOR FLAT TO RENT IN THE POPULAR PLUMSTEAD COMMON. LARGE PROPERTY WITH BALCONY AND SEPARATE KITCHEN!!",https://www.rightmove.co.uk/properties/166949615#/?channel=RES_LET,/property-to-rent/contactBranch.html?propertyId=166949615,"Mann Lettings, Woolwich",74383,Reduced yesterday,2025-09-12T18:46:58Z,,SE18,2025-10-15T18:49:30.583875,"{'let available date': '24/10/2025', 'deposit': '£1,153', 'min. tenancy': 'Ask agent', 'let type': 'Long term', 'furnish type': 'Furnished or unfurnished, landlord is flexible', 'council tax': 'Ask agent'}",,,True,,"(51.4817048, 0.0841523)",14.996175467657704,81.11111111111111,70.00764906468459,43.729438202247195,69.19,estimated,geocoded
163715369,1350,"£1,350 pcm",monthly,Flat,1,1.0,"St. Johns Road, Isleworth, TW7","Summary   Woodland Estate Agents are delighted to present this beautifully presented one-bedroom ground floor flat located in the heart of Isleworth, just moments from Isleworth Station, local buses, and shops. This modern property is ideal for professionals looking for comfort, and...",https://www.rightmove.co.uk/properties/163715369#/?channel=RES_LET,/property-to-rent/contactBranch.html?propertyId=163715369,"Woodlands, Isleworth",115159,Reduced on 10/09/2025,2025-06-24T10:34:38Z,,TW7,2025-10-15T18:49:23.151444,"{'let available date': 'Now', 'deposit': '£1,557', 'min. tenancy': 'Ask agent', 'let type': 'Long term', 'furnish type': 'Furnished', 'council tax': 'Ask agent'}",,,True,,"(51.4748823, -0.3368946)",14.998673899442988,81.11111111111111,70.00265220111402,43.729438202247195,69.19,estimated,geocoded
167871755,1350,"£1,350 pcm",monthly,Not Specified,1,1.0,"Hale Lane, London, NW7","Spacious open-plan living and dining areaGenerous double bedroom with built-in storageLocated in a quiet residential area close to Mill Hill BroadwayExcellent transport links – Mill Hill Broadway Station (Thameslink) within easy reachClose to local shops, cafes, restaurants, and parksEasy access ...",https://www.rightmove.co.uk/properties/167871755#/?channel=RES_LET,/property-to-rent/contactBranch.html?propertyId=167871755,"Joseph Scott, Edgware",17295,Added on 06/10/2025,2025-10-06T17:17:52Z,,NW7,2025-10-15T18:49:51.505874,"{'let available date': 'Ask agent', 'deposit': '£1,350', 'min. tenancy': '6 months', 'let type': 'Long term', 'furnish type': 'Unfurnished', 'council tax': 'Ask agent'}",,,True,,"(51.6161095, -0.2570216)",14.998579696000082,81.11111111111111,70.00284060799984,43.729438202247195,69.19,estimated,geocoded
167983109,1350,"£1,350 pcm",monthly,Flat,1,1.0,"Church Street, London","IC Property is proud to offer to the market this one double-bedroom ground-floor property, located in the heart of Edmonton N9 and all local amenities. The property boasts a modernised and open-plan kitchen and living area that includes all white goods, a bathroom suite, and",https://www.rightmove.co.uk/properties/167983109#/?channel=RES_LET,/property-to-rent/contactBranch.html?propertyId=167983109,"IC Property, Edmonton",122323,Added on 08/10/2025,2025-10-08T13:15:09Z,,,2025-10-15T18:49:46.492391,"{'let available date': 'Ask agent', 'deposit': '£1,150', 'min. tenancy': 'Ask agent', 'let type': 'Long term', 'furnish type': 'Unfurnished', 'council tax': 'Ask agent'}",,,True,,"(51.373648, -0.1041797)",15.047061234114205,81.11111111111111,69.9058775317716,43.729438202247195,69.15,estimated,geocoded
167102822,1300,"£1,300 pcm",monthly,Apartment,1,1.0,"Benhill Road, Sutton, SM1","UNFURNISHED 1 BEDROOM FLAT, NO CHAIN. This spacious GROUND FLOOR FLAT comes with a larger double aspect living/dining room, good sized double bedroom with built-in wardrobe, separate modern kitchen, fully tiled bathroom with shower, allocated parking space & free street parking. Easily access...",https://www.rightmove.co.uk/properties/167102822#/?channel=RES_LET,/property-to-rent/contactBranch.html?propertyId=167102822,"Martin & Co, Sutton",80767,Added on 27/09/2025,2025-09-27T15:11:03Z,,SM1,2025-10-15T18:50:04.125782,"{'let available date': 'Now', 'deposit': '£1,500', 'min. tenancy': 'Ask agent', 'let type': 'Long term', 'furnish type': 'Unfurnished', 'council tax': 'Ask agent'}",,,True,,"(51.3723535, -0.1845655)",15.61346613277774,82.22222222222221,68.77306773444452,43.729438202247195,69.14,estimated,geocoded
167996153,1400,"£1,400 pcm",monthly,Maisonette,2,1.0,"Green Wrythe Lane, Carshalton, Sutton, SM5","Welcome to this charming and spacious two-bedroom unfurnished maisonette, ideally positioned on Green Wrythe Lane in Carshalton, within the popular borough of Sutton (SM5). Set across two levels, this well-presented home offers the perfect balance of privacy, comfort, and convenience — an i...",https://www.rightmove.co.uk/properties/167996153#/?channel=RES_LET,/property-to-rent/contactBranch.html?propertyId=167996153,"Choices, Croydon",12401,Added on 08/10/2025,2025-10-08T16:05:51Z,,SM5,2025-10-15T18:49:46.492374,"{'let available date': 'Now', 'deposit': '£0', 'min. tenancy': 'Ask agent', 'let type': 'Long term', 'furnish type': 'Unfurnished', 'council tax': 'Ask agent'}",,,True,,"(51.3800656, -0.1712847)",14.564883907502361,80.0,70.87023218499527,43.729438202247195,69.09,estimated,geocoded
168219689,1300,"£1,300 pcm",monthly,Flat,1,1.0,"Heath Road, Twickenham","Located on Twickenham high street is this newly redecorated apartment. Spread across over 880 sq feet of living accommodation, the property has two double bedrooms, a large reception room and separate kitchen that opens onto a south facing roof terrace with plenty of room for entertaining.",https://www.rightmove.co.uk/properties/168219689#/?channel=RES_LET,/property-to-rent/contactBranch.html?propertyId=168219689,"Dexters, Twickenham",84818,Added today,2025-10-15T16:26:46Z,,,2025-10-15T18:49:23.151615,"{'let available date': 'Ask agent', 'deposit': '£1,500', 'min. tenancy': 'Ask agent', 'let type': 'Long term', 'furnish type': 'Furnished', 'council tax': 'Ask agent'}",,,True,,"(51.44555, -0.3300349)",15.691858069139585,82.22222222222221,68.61628386172083,43.729438202247195,69.08,estimated,geocoded
167723069,1350,"£1,350 pcm",monthly,Flat,1,1.0,"Seymour Gardens, Twickenham Riverside, TW1","This is a 3 month let only available from November 6th to 28th January . It is a furnished bright, spacious conversion flat in an Edwardian Terrace house situated in a quiet cul-de-sac locate... ** Property Reference: 2641257 **",https://www.rightmove.co.uk/properties/167723069#/?channel=RES_LET,/property-to-rent/contactBranch.html?propertyId=167723069,"OpenRent, London",96668,Reduced today,2025-10-02T15:36:14Z,,TW1,2025-10-15T18:49:28.011592,"{'let available date': '06/11/2025', 'deposit': '£0', 'min. tenancy': 'Ask agent', 'let type': 'Short term', 'furnish type': 'Furnished', 'council tax': 'Ask agent'}",,,True,,"(51.4468179, -0.3223048)",15.14819273585209,81.11111111111111,69.70361452829582,43.729438202247195,69.07,estimated,geocoded
168053801,1450,"£1,450 pcm",monthly,Flat,1,1.0,"Union Lane, Isleworth","A bright and airy one bedroom apartment in the highly sought-after Union Lane development. The property offers a spacious open-plan living room and kitchen, a double bedroom with built-in storage and a modern bathroom. Perfect for a couple or single occupant, this apartment presents an excellent ...",https://www.rightmove.co.uk/properties/168053801#/?channel=RES_LET,/property-to-rent/contactBranch.html?propertyId=168053801,"Dexters, St Margarets",84809,Added on 09/10/2025,2025-10-09T18:11:18Z,,,2025-10-15T18:49:40.916190,"{'let available date': 'Ask agent', 'deposit': '£1,673', 'min. tenancy': 'Ask agent', 'let type': 'Long term', 'furnish type': 'Unfurnished', 'council tax': 'Ask agent'}",,,True,,"(51.4766736, -0.3235869)",14.053584044419502,78.88888888888889,71.892831911161,43.729438202247195,69.06,estimated,geocoded
168080321,1300,"£1,300 pcm",monthly,Apartment,1,1.0,"Fieldfare Road, London, SE28",Bright and spacious top floor one bed flat.,https://www.rightmove.co.uk/properties/168080321#/?channel=RES_LET,/property-to-rent/contactBranch.html?propertyId=168080321,"jdm, Greenwich",250727,Added on 10/10/2025,2025-10-10T13:11:27Z,,SE28,2025-10-15T18:49:30.583802,"{'let available date': 'Now', 'deposit': '£1,500', 'min. tenancy': '12 months', 'let type': 'Long term', 'furnish type': 'Unfurnished', 'council tax': 'Ask agent'}",540.0,50.0,True,,"(51.5073493, 0.1215649)",17.29940754852457,82.22222222222221,65.40118490295086,50.0,69.05,actual,geocoded
168085889,1450,"£1,450 pcm",monthly,Flat,1,1.0,"Chase Side, London, N14",Deposit Free Option!!!Oyster Properties are proud to present this one-bedroom flat located on the First Floor.,https://www.rightmove.co.uk/properties/168085889#/?channel=RES_LET,/property-to-rent/contactBranch.html?propertyId=168085889,"Oyster Properties, London",37065,Added on 10/10/2025,2025-10-10T14:26:10Z,,N14,2025-10-15T18:49:38.504363,"{'let available date': 'Now', 'deposit': '£1,812', 'min. tenancy': '6 months', 'let type': 'Long term', 'furnish type': 'Unfurnished', 'council tax': 'Ask agent'}",,,True,,"(51.634404, -0.1341437)",14.05980287040204,78.88888888888889,71.88039425919592,43.729438202247195,69.05,estimated,geocoded
167874137,1500,"£1,500 pcm",monthly,Flat,1,1.0,"Rabbits Road, London, E12","We are pleased to present this well-situated first floor flat, comprising: One bedroom One reception room One bathroom Availability: From 28 October 2025 Furnishing: Unfurnished (please note... ** Property Reference: 2649747 **",https://www.rightmove.co.uk/properties/167874137#/?channel=RES_LET,/property-to-rent/contactBranch.html?propertyId=167874137,"OpenRent, London",96668,Reduced on 13/10/2025,2025-10-06T17:44:30Z,,E12,2025-10-15T18:49:35.769181,"{'let available date': '28/10/2025', 'deposit': '£1,500', 'min. tenancy': 'Ask agent', 'let type': 'Long term', 'furnish type': 'Unfurnished', 'council tax': 'Ask agent'}",,,True,,"(51.5541271, 0.0527166)",13.520075206343869,77.77777777777779,72.95984958731226,43.729438202247195,69.04,estimated,geocoded
