id,price,price_display,frequency,property_type,bedrooms,bathrooms,address,summary,property_url,contact_url,branch,branch_id,added_or_reduced,first_visible_date,let_type,postcode,search_date,letting_details,property_size_sqft,property_size_sqm,scraping_success,scraping_error,coordinates,distance_to_center_km,price_score,location_score,size_score,overall_score,size_data_status,geocoding_status
167966717,345,"£1,495 pcm",weekly,Flat,1,1.0,"Chapter Road, Willesden Green","This one bedroom top floor flat in Willesden Green has a spacious open plan living area with a contemporary kitchen, a well sized bedroom and tiled bathroom. The flat has neutral decor throughout and is situated close to local amenities and transport links.",https://www.rightmove.co.uk/properties/167966717#/?channel=RES_LET,/property-to-rent/contactBranch.html?propertyId=167966717,"Dexters, Cricklewood",72541,Reduced on 13/10/2025,2025-10-08T09:32:13Z,,,2025-10-15T18:49:35.769187,"{'let available date': 'Ask agent', 'deposit': '£1,845', 'min. tenancy': 'Ask agent', 'let type': 'Long term', 'furnish type': 'Unfurnished', 'council tax': 'Ask agent'}",,,True,,"(51.4857711, -0.101756)",3.0647449375193485,100.0,93.8705101249613,43.729438202247195,86.29,estimated,geocoded
166296290,335,"£1,452 pcm",weekly,Apartment,1,,"Shepherds Bush Road, LONDON","Recently Fully refurbished large studio lower ground apartment. The apartment features separate eat in kitchen with sleek integrated kitchen appliances, worktops and a washer/dryer. Carpet flooring and a small patio area. Over 300 sqft available early October The apartment has additional ...",https://www.rightmove.co.uk/properties/166296290#/?channel=RES_LET,/property-to-rent/contactBranch.html?propertyId=166296290,"Barnard Marcus Lettings, West Kensington - Lettings",50966,Added on 28/08/2025,2025-08-28T10:34:21Z,,,2025-10-15T18:50:16.521116,"{'let available date': 'Now', 'deposit': 'Ask agent', 'min. tenancy': 'Ask agent', 'let type': 'Long term', 'furnish type': 'Furnished or unfurnished, landlord is flexible', 'council tax': 'Ask agent'}",,,True,,"(51.501156, -0.2219707)",6.5978742220614235,100.0,86.80425155587716,43.729438202247195,83.47,estimated,geocoded
167971880,335,"£1,452 pcm",weekly,Flat,1,1.0,"Fortune Green Road, West Hampstead NW6",Cedar Estates are delighted to offer this 1-bedroom flat with a private patio conveniently located a short walk from the shops and transport links of West Hampstead. The property consists of a modern open plan kitchen with laminate flooring and a fully tiled bathroom.,https://www.rightmove.co.uk/properties/167971880#/?channel=RES_LET,/property-to-rent/contactBranch.html?propertyId=167971880,"Cedar Estates, West Hampstead",79883,Added on 08/10/2025,2025-10-08T10:43:21Z,,NW6,2025-10-15T18:49:46.492450,"{'let available date': 'Now', 'deposit': 'Ask agent', 'min. tenancy': 'Ask agent', 'let type': 'Long term', 'furnish type': 'Furnished or unfurnished, landlord is flexible', 'council tax': 'Ask agent'}",,,True,,"(51.5526977, -0.1930498)",6.726699374390917,100.0,86.54660125121816,43.729438202247195,83.36,estimated,geocoded
168005612,300,"£1,300 pcm",weekly,Flat,1,1.0,"Hudson Close, White City Estate","This lovely one bedroom flat has recently been refurnished and offers a spacious lounge, with a newly fitted open plan kitchen and tiled bathroom.",https://www.rightmove.co.uk/properties/168005612#/?channel=RES_LET,/property-to-rent/contactBranch.html?propertyId=168005612,"Fletchers, Brook Green",50719,Reduced yesterday,2025-10-08T18:56:31Z,,,2025-10-15T18:49:28.011687,"{'let available date': 'Ask agent', 'deposit': '£1,500', 'min. tenancy': 'Ask agent', 'let type': 'Long term', 'furnish type': 'Furnished or unfurnished, landlord is flexible', 'council tax': 'Ask agent'}",,,True,,"(51.5127782, -0.2320877)",7.272670434432964,100.0,85.45465913113406,43.729438202247195,82.93,estimated,geocoded
165653903,346,"£1,499 pcm",weekly,Flat,1,1.0,"White City Estate, Shepherds Bush","This lovely one bedroom flat has recently been refurnished and offers a spacious lounge, with a newly fitted open plan kitchen and tiled bathroom.",https://www.rightmove.co.uk/properties/165653903#/?channel=RES_LET,/property-to-rent/contactBranch.html?propertyId=165653903,"Fletchers, Brook Green",50719,Reduced on 01/10/2025,2025-08-12T13:22:53Z,,,2025-10-15T18:49:59.184723,"{'let available date': 'Ask agent', 'deposit': '£1,730', 'min. tenancy': 'Ask agent', 'let type': 'Long term', 'furnish type': 'Ask agent', 'council tax': 'Ask agent'}",,,True,,"(51.5126389, -0.2326312)",7.309230445574748,100.0,85.3815391088505,43.729438202247195,82.9,estimated,geocoded
165738683,346,"£1,499 pcm",weekly,Flat,1,1.0,"White City Estate, Shepherds Bush",A large one bedroom property compromising a separate kitchen. The property has undergone a full re-paint and new carpet flooring.,https://www.rightmove.co.uk/properties/165738683#/?channel=RES_LET,/property-to-rent/contactBranch.html?propertyId=165738683,"Dexters, Shepherds Bush",84833,Reduced on 01/10/2025,2025-08-14T10:59:26Z,,,2025-10-15T18:49:59.184719,"{'let available date': 'Ask agent', 'deposit': '£1,730', 'min. tenancy': 'Ask agent', 'let type': 'Long term', 'furnish type': 'Furnished or unfurnished, landlord is flexible', 'council tax': 'Ask agent'}",,,True,,"(51.5126389, -0.2326312)",7.309230445574748,100.0,85.3815391088505,43.729438202247195,82.9,estimated,geocoded
166847507,323,"£1,400 pcm",weekly,Flat,1,1.0,"Cricklewood Lane, Cricklewood NW2","As sole agents, we are delighted to offer this well proportioned one-bedroom flat, located on the ground floor of a purpose-built block situated just moments from Cricklewood Thameslink station, this property offers excellent convenience and accessibility.",https://www.rightmove.co.uk/properties/166847507#/?channel=RES_LET,/property-to-rent/contactBranch.html?propertyId=166847507,"Cedar Estates, West Hampstead",79883,Added on 10/09/2025,2025-09-10T17:44:22Z,,NW2,2025-10-15T18:50:14.111245,"{'let available date': 'Now', 'deposit': 'Ask agent', 'min. tenancy': 'Ask agent', 'let type': 'Long term', 'furnish type': 'Furnished or unfurnished, landlord is flexible', 'council tax': 'Ask agent'}",,,True,,"(51.5497553, -0.2204186)",7.935288807365541,100.0,84.12942238526892,43.729438202247195,82.4,estimated,geocoded
168080051,306,"£1,326 pcm",weekly,Apartment,1,1.0,"Atelier Court North, Leven Road, London, E14","Modern 1-bed apartment in Atelier Court, E14. Bright open-plan living/kitchen area, private balcony, stylish bathroom, lift access & secure entry. Moments from Langdon Park DLR & close to Canary Wharf. Ideal for professionals or couples. Book your viewing today!",https://www.rightmove.co.uk/properties/168080051#/?channel=RES_LET,/property-to-rent/contactBranch.html?propertyId=168080051,"Sanctuary Housing, Sanctuary Housing",117370,Added on 13/10/2025,2025-10-13T17:11:21Z,,E14,2025-10-15T18:49:33.363210,"{'let available date': 'Now', 'deposit': '£1,836', 'min. tenancy': 'Ask agent', 'let type': 'Long term', 'furnish type': 'Unfurnished', 'council tax': 'Ask agent'}",,,True,,"(51.5167933, -0.0075744)",8.388315419802396,100.0,83.22336916039521,43.729438202247195,82.04,estimated,geocoded
164827133,323,"£1,400 pcm",weekly,Flat,2,1.0,"Cheviot Gardens, Golders Green Estate","This well presented top floor conversion is bight and spacious with a separate reception, fitted modern kitchen, a well sized double bedroom and a further room. The flat is has been recently refurbished and is ideally situated in the Golders Green Estate.",https://www.rightmove.co.uk/properties/164827133#/?channel=RES_LET,/property-to-rent/contactBranch.html?propertyId=164827133,"Dexters, Cricklewood",72541,Reduced on 03/10/2025,2025-07-22T19:21:17Z,,,2025-10-15T18:49:56.802786,"{'let available date': 'Ask agent', 'deposit': '£1,955', 'min. tenancy': 'Ask agent', 'let type': 'Long term', 'furnish type': 'Part furnished', 'council tax': 'Ask agent'}",,,True,,"(51.5643175, -0.2131995)",8.625368117739136,100.0,82.74926376452173,43.729438202247195,81.85,estimated,geocoded
87315885,1500,"£1,500 pcm",monthly,Apartment,1,1.0,"Grove Place, Eltham, London, SE9",Modern spacious one bedroom apartment in newly constructed portered development in prime Eltham location ,https://www.rightmove.co.uk/properties/87315885#/?channel=RES_LET,/property-to-rent/contactBranch.html?propertyId=87315885,"jdm, Greenwich",250727,Added yesterday,2025-10-14T15:49:51Z,,SE9,2025-10-15T18:49:28.011667,"{'let available date': '20/10/2025', 'deposit': '£1,730', 'min. tenancy': '12 months', 'let type': 'Long term', 'furnish type': 'Unfurnished', 'council tax': 'Ask agent'}",673.0,63.0,True,,"(51.4893335, -0.1440551)",2.380153846150935,77.77777777777779,95.23969230769814,63.0,81.81,actual,geocoded
41835423,1300,"£1,300 pcm",monthly,Flat,1,,"Chigwell Road, London, E18","Step inside this beautifully refurbished one/two bedroom apartment in the heart of South Woodford. Bright, stylish, and perfectly located for transport, shops, and cafés - it's ready for you to move in and make your own..",https://www.rightmove.co.uk/properties/41835423#/?channel=RES_LET,/property-to-rent/contactBranch.html?propertyId=41835423,"Yellands, South Woodford",62254,Reduced on 02/10/2025,2016-05-12T11:57:57Z,,E18,2025-10-15T18:49:59.184688,"{'let available date': 'Now', 'deposit': '£1,730', 'min. tenancy': 'Ask agent', 'let type': 'Long term', 'furnish type': 'Part furnished', 'council tax': 'Ask agent'}",,,True,,"(51.5074456, -0.1277653)",0.07370619589533926,82.22222222222221,99.85258760820932,43.729438202247195,81.58,estimated,geocoded
127639184,1300,"£1,300 pcm",monthly,Maisonette,1,,"Franklin Way, Croydon, London, CR0",** Ground Floor ** ** Maisonette ** ** One Bedroom ** ** Separate Kitchen ** ** Good Size Lounge ** ** Bathroom ** ** Available 4th November ** ** Bed & Wardrobe Included **,https://www.rightmove.co.uk/properties/127639184#/?channel=RES_LET,/property-to-rent/contactBranch.html?propertyId=127639184,"LG New Homes, London",80511,Added on 30/09/2025,2022-10-03T08:53:44Z,,CR0,2025-10-15T18:50:01.586540,"{'let available date': '04/11/2025', 'deposit': 'Ask agent', 'min. tenancy': 'Ask agent', 'let type': 'Long term', 'furnish type': 'Part furnished', 'council tax': 'Ask agent'}",,,True,,"(51.5074456, -0.1277653)",0.07370619589533926,82.22222222222221,99.85258760820932,43.729438202247195,81.58,estimated,geocoded
167891594,1300,"£1,300 pcm",monthly,Ground Flat,1,1.0,"Marlborough Lane, London, SE7",Newly refurbished and perfect for a single occupant or couple seeking modern comfort.,https://www.rightmove.co.uk/properties/167891594#/?channel=RES_LET,/property-to-rent/contactBranch.html?propertyId=167891594,"Berkleys Property Group, London",290588,Added on 07/10/2025,2025-10-07T09:33:52Z,,SE7,2025-10-15T18:49:51.505857,"{'let available date': 'Ask agent', 'deposit': '£1,300', 'min. tenancy': '6 months', 'let type': 'Long term', 'furnish type': 'Furnished', 'council tax': 'Ask agent'}",,,True,,"(51.5074456, -0.1277653)",0.07370619589533926,82.22222222222221,99.85258760820932,43.729438202247195,81.58,estimated,geocoded
167536760,1325,"£1,325 pcm",monthly,Maisonette,1,1.0,"Ashcroft, London, N14","Bright and well-presented one bedroom maisonette flat, offered inclusive of some bills including Council Tax and water but excluding electricity. It is situated on the ground floor of a small purp... ** Property Reference: 2640086 **",https://www.rightmove.co.uk/properties/167536760#/?channel=RES_LET,/property-to-rent/contactBranch.html?propertyId=167536760,"OpenRent, London",96668,Added on 28/09/2025,2025-09-28T20:07:42Z,,N14,2025-10-15T18:50:04.125774,"{'let available date': '18/10/2025', 'deposit': '£1,325', 'min. tenancy': 'Ask agent', 'let type': 'Long term', 'furnish type': 'Furnished', 'council tax': 'Ask agent'}",,,True,,"(51.5074456, -0.1277653)",0.07370619589533926,81.66666666666667,99.85258760820932,43.729438202247195,81.35,estimated,geocoded
167981456,1500,"£1,500 pcm",monthly,Flat,1,1.0,"Robin Hood Way, Kingston Vale, London, SW15","ZERO DEPOSIT AVAILABLE. LONG LET. A highly desirable location moments from Richmond Park, this spacious 1-bedroom apartment offers good size rooms throughout. Located in a fantastic location with lots of amenities close by.",https://www.rightmove.co.uk/properties/167981456#/?channel=RES_LET,/property-to-rent/contactBranch.html?propertyId=167981456,"Foxtons, Kingston",57272,Added on 08/10/2025,2025-10-08T12:46:40Z,,SW15,2025-10-15T18:49:46.492428,"{'let available date': 'Ask agent', 'deposit': '£1,731', 'min. tenancy': 'Ask agent', 'let type': 'Long term', 'furnish type': 'Part furnished', 'council tax': 'Ask agent'}",1166.0,108.0,True,,"(51.4329297, -0.2567637)",12.26760003506499,77.77777777777779,75.46479992987003,100.0,81.3,actual,geocoded
167684171,1400,"£1,400 pcm",monthly,Flat,1,1.0,"Oak Apple Court, London, SE12",Stunning and Spacious one Bedroom Purpose Built Flat in a Quiet Newly Built Estate based in quiet residential location which can be perfect for working professionals. Flat is meticulously maintain... ** Property Reference: 2559563 **,https://www.rightmove.co.uk/properties/167684171#/?channel=RES_LET,/property-to-rent/contactBranch.html?propertyId=167684171,"OpenRent, London",96668,Added on 01/10/2025,2025-10-01T17:33:27Z,,SE12,2025-10-15T18:49:59.184702,"{'let available date': 'Now', 'deposit': '£1,400', 'min. tenancy': 'Ask agent', 'let type': 'Long term', 'furnish type': 'Unfurnished', 'council tax': 'Ask agent'}",,,True,,"(51.5074456, -0.1277653)",0.07370619589533926,80.0,99.85258760820932,43.729438202247195,80.69,estimated,geocoded
167678723,1400,"£1,400 pcm",monthly,Flat,1,1.0,"Brackenbury Gardens, London, W6","Oaklands Estates are pleased to offer this spacious one bedroom Ground Floor flat close to Hammersmith Grove.The property has an ideal layout comprising of a double bedroom, separate living room with dining area, family bathroom and a fitted kitchen. Also, a huge rear communal garden with bench se",https://www.rightmove.co.uk/properties/167678723#/?channel=RES_LET,/property-to-rent/contactBranch.html?propertyId=167678723,"Oaklands Estates, London",98294,Added on 01/10/2025,2025-10-01T16:32:46Z,,W6,2025-10-15T18:49:59.184709,"{'let available date': 'Ask agent', 'deposit': 'Ask agent', 'min. tenancy': 'Ask agent', 'let type': 'Long term', 'furnish type': 'Furnished', 'council tax': 'Ask agent'}",,,True,,"(51.5074456, -0.1277653)",0.07370619589533926,80.0,99.85258760820932,43.729438202247195,80.69,estimated,geocoded
167708309,1400,"£1,400 pcm",monthly,Flat,1,1.0,"Charles Bradlaugh House, Haynes Close, Tottenham, London, N17","NEW! Knights are delighted to offer to let this ground floor one bedroom flat located close to all amenities including transport links. The flat has recently been refurbished and boasts a new fitted kitchen, new bathroom suite, separate lounge/diner, private balcony area, double bedroom, laminate...",https://www.rightmove.co.uk/properties/167708309#/?channel=RES_LET,/property-to-rent/contactBranch.html?propertyId=167708309,"Knights Residential, London",82394,Added on 02/10/2025,2025-10-02T12:20:59Z,,N17,2025-10-15T18:49:56.802836,"{'let available date': 'Now', 'deposit': 'Ask agent', 'min. tenancy': 'Ask agent', 'let type': 'Long term', 'furnish type': 'Unfurnished', 'council tax': 'Ask agent'}",,,True,,"(51.5074456, -0.1277653)",0.07370619589533926,80.0,99.85258760820932,43.729438202247195,80.69,estimated,geocoded
167758373,1400,"£1,400 pcm",monthly,Apartment,1,1.0,"Rambler Court, Swynford Gdns, Hendon, London, NW4","A Spacious One Bedroom First Floor Flat, Furnished, Fully Fitted Kitchen, One Bathroom, On Modern Development, Excellent Condition, Near Tube, Parking, Available 6th November 2025.",https://www.rightmove.co.uk/properties/167758373#/?channel=RES_LET,/property-to-rent/contactBranch.html?propertyId=167758373,"Jayson Russell, Hendon",43502,Added on 03/10/2025,2025-10-03T11:21:23Z,,NW4,2025-10-15T18:49:56.802802,"{'let available date': '06/11/2025', 'deposit': '£1,615', 'min. tenancy': 'Ask agent', 'let type': 'Long term', 'furnish type': 'Part furnished', 'council tax': 'Ask agent'}",,,True,,"(51.5074456, -0.1277653)",0.07370619589533926,80.0,99.85258760820932,43.729438202247195,80.69,estimated,geocoded
146039813,1400,"£1,400 pcm",monthly,Flat,1,1.0,"Martin Close, London, N9","Superb One-Bedroom Flat First Floor EdmontonAvailable from 20th October 2025, this bright and spacious first-floor flat offers a fantastic living space in one of Edmonton's most convenient locations.The property features a light-filled reception room, a separate fully fitted kitchen, a large do",https://www.rightmove.co.uk/properties/146039813#/?channel=RES_LET,/property-to-rent/contactBranch.html?propertyId=146039813,"Discover Residential Ltd, Loughton",184304,Added on 06/10/2025,2024-03-22T11:17:09Z,,N9,2025-10-15T18:49:54.205747,"{'let available date': 'Ask agent', 'deposit': '£1,615', 'min. tenancy': 'Ask agent', 'let type': 'Long term', 'furnish type': 'Part furnished', 'council tax': 'Ask agent'}",,,True,,"(51.5074456, -0.1277653)",0.07370619589533926,80.0,99.85258760820932,43.729438202247195,80.69,estimated,geocoded
167916326,323,"£1,400 pcm",weekly,Flat,1,1.0,"Hendon Lane, Finchley, N3","A delightful one double bedroom apartment situated only moments to Finchley Central Underground Station. This bright and airy property benefits from family bathroom, open plan kitchen with integrated white goods, spacious reception and large double bedroom. Located only a stones throw from the m...",https://www.rightmove.co.uk/properties/167916326#/?channel=RES_LET,/property-to-rent/contactBranch.html?propertyId=167916326,"Primden Group, Camden",261275,Reduced on 09/10/2025,2025-10-07T14:26:08Z,,N3,2025-10-15T18:49:43.835126,"{'let available date': 'Now', 'deposit': '£1,615', 'min. tenancy': 'Ask agent', 'let type': 'Long term', 'furnish type': 'Ask agent', 'council tax': 'Ask agent'}",,,True,,"(51.5973246, -0.1805587)",10.584822954630809,100.0,78.83035409073838,43.729438202247195,80.28,estimated,geocoded
168146225,323,"£1,400 pcm",weekly,Flat,1,1.0,"Hendon Lane, Finchley, N3","A delightful one double bedroom apartment situated only moments to Finchley Central Underground Station. This bright and airy property benefits from bathroom, open plan kitchen with integrated white goods, spacious reception and large double bedroom. Located only a stones throw from the many won...",https://www.rightmove.co.uk/properties/168146225#/?channel=RES_LET,/property-to-rent/contactBranch.html?propertyId=168146225,"Primden Group, Camden",261275,Added on 13/10/2025,2025-10-13T11:36:32Z,,N3,2025-10-15T18:49:35.769190,"{'let available date': 'Now', 'deposit': '£1,615', 'min. tenancy': 'Ask agent', 'let type': 'Long term', 'furnish type': 'Ask agent', 'council tax': 'Ask agent'}",,,True,,"(51.5973246, -0.1805587)",10.584822954630809,100.0,78.83035409073838,43.729438202247195,80.28,estimated,geocoded
167925380,1450,"£1,450 pcm",monthly,Flat,1,1.0,"Caroe Court, London, N9","1 Bed Flat, Caroe Court, N9 We are proud to offer this delightful 1 bedroom, 1 bathroom flat in a great location. Available to move in from 31 October 2025, this property benefits from available... ** Property Reference: 2650910 **",https://www.rightmove.co.uk/properties/167925380#/?channel=RES_LET,/property-to-rent/contactBranch.html?propertyId=167925380,"OpenRent, London",96668,Added on 07/10/2025,2025-10-07T16:01:18Z,,N9,2025-10-15T18:49:48.893144,"{'let available date': '31/10/2025', 'deposit': '£1,450', 'min. tenancy': 'Ask agent', 'let type': 'Long term', 'furnish type': 'Unfurnished', 'council tax': 'Ask agent'}",,,True,,"(51.5074456, -0.1277653)",0.07370619589533926,78.88888888888889,99.85258760820932,43.729438202247195,80.24,estimated,geocoded
167282201,1450,"£1,450 pcm",monthly,Flat,1,1.0,"95 Telford Road, London, N11",Perfect 1 bedroom flat!,https://www.rightmove.co.uk/properties/167282201#/?channel=RES_LET,/property-to-rent/contactBranch.html?propertyId=167282201,"EweMove, Covering Greater London",264530,Reduced on 02/10/2025,2025-09-22T18:41:23Z,,N11,2025-10-15T18:49:59.184680,"{'let available date': 'Now', 'deposit': '£1,788', 'min. tenancy': '12 months', 'let type': 'Long term', 'furnish type': 'Unfurnished', 'council tax': 'Ask agent'}",,,True,,"(51.5074456, -0.1277653)",0.07370619589533926,78.88888888888889,99.85258760820932,43.729438202247195,80.24,estimated,geocoded
167195036,1450,"£1,450 pcm",monthly,Flat,1,1.0,"Wellmeadow Road, London, SE6",An Immaculate and stunning one double bedroom flat on the sought after Wellmeadow Road,https://www.rightmove.co.uk/properties/167195036#/?channel=RES_LET,/property-to-rent/contactBranch.html?propertyId=167195036,"Kinleigh Folkard & Hayward - Lettings, Catford",148610,Reduced on 04/10/2025,2025-09-19T14:02:17Z,,SE6,2025-10-15T18:49:54.205788,"{'let available date': '01/12/2025', 'deposit': '£1,730', 'min. tenancy': 'Ask agent', 'let type': 'Long term', 'furnish type': 'Furnished', 'council tax': 'Ask agent'}",,,True,,"(51.5074456, -0.1277653)",0.07370619589533926,78.88888888888889,99.85258760820932,43.729438202247195,80.24,estimated,geocoded
161032610,1300,"£1,300 pcm",monthly,Ground Flat,1,1.0,"Boscombe Gardens, London, SW16","Spacious 1-Bedroom Garden Flat - Streatham, SW16 A rare find! This bright and generously sized 1-bedroom ground floor flat",https://www.rightmove.co.uk/properties/161032610#/?channel=RES_LET,/property-to-rent/contactBranch.html?propertyId=161032610,"ROCKWELL GREEN PROPERTIES LIMITED, London",288347,Added on 24/04/2025,2025-04-24T14:18:52Z,,SW16,2025-10-15T18:50:21.311040,"{'let available date': 'Ask agent', 'deposit': '£1,300', 'min. tenancy': '6 months', 'let type': 'Long term', 'furnish type': 'Unfurnished', 'council tax': 'Ask agent'}",500.0,46.0,True,,"(51.4893335, -0.1440551)",2.380153846150935,82.22222222222221,95.23969230769814,46.0,80.18,actual,geocoded
167042723,1400,"£1,400 pcm",monthly,Flat,1,1.0,"Daisy Road, James Court, E18",Set within a modern development and just a one minute walk from South Woodford Central Line Station is this superb top floor one bedroom apartment.,https://www.rightmove.co.uk/properties/167042723#/?channel=RES_LET,/property-to-rent/contactBranch.html?propertyId=167042723,"Abode, Woodford Green",77447,Reduced today,2025-09-16T11:51:49Z,,E18,2025-10-15T18:49:25.586962,"{'let available date': 'Now', 'deposit': '£1,400', 'min. tenancy': '12 months', 'let type': 'Long term', 'furnish type': 'Unfurnished', 'council tax': 'Ask agent'}",,,True,,"(51.5145033, -0.1307586)",0.7454021207663117,80.0,98.50919575846737,43.729438202247195,80.15,estimated,geocoded
167792003,1500,"£1,500 pcm",monthly,Flat,1,1.0,"Cunard Crescent, London, N21","Applicant Requirements: We are searching for tenant(s) with a minimum household income of £45,000pa+ - Baker and Chase are delighted to present this nicely decorated 1-bedroom, ground floor flat, with allocated residents parking. Located on a sought-after and ...",https://www.rightmove.co.uk/properties/167792003#/?channel=RES_LET,/property-to-rent/contactBranch.html?propertyId=167792003,"Baker and Chase, North London",283727,Added on 03/10/2025,2025-10-03T18:01:58Z,,N21,2025-10-15T18:49:56.802684,"{'let available date': '20/10/2025', 'deposit': '£1,730', 'min. tenancy': 'Ask agent', 'let type': 'Long term', 'furnish type': 'Unfurnished', 'council tax': 'Ask agent'}",,,True,,"(51.5074456, -0.1277653)",0.07370619589533926,77.77777777777779,99.85258760820932,43.729438202247195,79.8,estimated,geocoded
167581937,1500,"£1,500 pcm",monthly,Flat,1,1.0,"Aragon Court, London, W13","We are proud to offer this delightful 1 bedroom, 1 bathroom flat in a great location. Available to move in from 29 September 2025. Property is offered unfurnished. Viewing highly recommended. Co... ** Property Reference: 2557586 **",https://www.rightmove.co.uk/properties/167581937#/?channel=RES_LET,/property-to-rent/contactBranch.html?propertyId=167581937,"OpenRent, London",96668,Added on 29/09/2025,2025-09-29T20:08:05Z,,W13,2025-10-15T18:50:04.125741,"{'let available date': 'Now', 'deposit': '£1,500', 'min. tenancy': 'Ask agent', 'let type': 'Long term', 'furnish type': 'Unfurnished', 'council tax': 'Ask agent'}",,,True,,"(51.5074456, -0.1277653)",0.07370619589533926,77.77777777777779,99.85258760820932,43.729438202247195,79.8,estimated,geocoded
87083523,1500,"£1,500 pcm",monthly,Maisonette,2,,"Trafalgar Road, London, TW2","WITH PRIVATE REAR GARDEN - WELL PRESENTED & SPACIOUS TWO BEDROOM GROUND FLOOR MAISONETTE SITUATED IN SOUGHT AFTER LOCATION IDEALLY POSITIONED FOR MAINLINE TRAIN STATION & LOCAL SHOPS. The property has just been refurbished and benefits from a spacious lounge/diner, separate modern fitted kitchen, tw",https://www.rightmove.co.uk/properties/87083523#/?channel=RES_LET,/property-to-rent/contactBranch.html?propertyId=87083523,"Octagon, Staines",149270,Added on 06/10/2025,2025-02-12T11:10:16Z,,TW2,2025-10-15T18:49:51.505889,"{'let available date': 'Ask agent', 'deposit': 'Ask agent', 'min. tenancy': 'Ask agent', 'let type': 'Long term', 'furnish type': 'Ask agent', 'council tax': 'Ask agent'}",,,True,,"(51.5074456, -0.1277653)",0.07370619589533926,77.77777777777779,99.85258760820932,43.729438202247195,79.8,estimated,geocoded
168222701,1300,"£1,300 pcm",monthly,Flat,1,1.0,"Albert Road, Mottingham, London, SE9","This well-maintained property offers a bright lounge separate from a fully equipped kitchen, providing plenty of space for cooking and relaxing. The comfortable double bedroom is perfect for singles or couples. Residents also benefit from access to a communal garden, a peaceful outdoo...",https://www.rightmove.co.uk/properties/168222701#/?channel=RES_LET,/property-to-rent/contactBranch.html?propertyId=168222701,"Leaders Lettings, Bromley",15224,Reduced today,2025-10-15T16:56:51Z,,SE9,2025-10-15T18:49:23.151612,"{'let available date': 'Now', 'deposit': 'Ask agent', 'min. tenancy': 'Ask agent', 'let type': 'Long term', 'furnish type': 'Unfurnished', 'council tax': 'Ask agent'}",,,True,,"(51.4893335, -0.1440551)",2.380153846150935,82.22222222222221,95.23969230769814,43.729438202247195,79.73,estimated,geocoded
165491564,1300,"£1,300 pcm",monthly,Flat,1,1.0,"Bromley Road, London, N18","Knights are proud to offer to the market this One Bedroom Second Floor Flat, situated on one of Edmonton's most prestigious roads. This well-presented property benefits from One Double Bedroom, Spacious Lounge, Modern Shower Room, Juliet Balcony, Off-street Parking, Gas Central Heating and Do...",https://www.rightmove.co.uk/properties/165491564#/?channel=RES_LET,/property-to-rent/contactBranch.html?propertyId=165491564,"Knights Residential, Edmonton",199451,Added on 07/08/2025,2025-08-07T18:37:04Z,,N18,2025-10-15T18:50:19.037709,"{'let available date': 'Ask agent', 'deposit': 'Ask agent', 'min. tenancy': 'Ask agent', 'let type': 'Long term', 'furnish type': 'Ask agent', 'council tax': 'Ask agent'}",,,True,,"(51.4893335, -0.1440551)",2.380153846150935,82.22222222222221,95.23969230769814,43.729438202247195,79.73,estimated,geocoded
167852945,1450,"£1,450 pcm",monthly,Flat,1,1.0,"Charlton Road, N9","Target Property is delighted to present this attractive rental opportunity, ideally suited for professionals, couples, or families looking for a comfortable and well-located home. The property offers a blend of modern living and convenience, with access to local amenities and transport links. Ear...",https://www.rightmove.co.uk/properties/167852945#/?channel=RES_LET,/property-to-rent/contactBranch.html?propertyId=167852945,"Target Property, Cheshunt",74120,Added on 06/10/2025,2025-10-06T13:16:10Z,,N9,2025-10-15T18:49:51.505908,"{'let available date': 'Now', 'deposit': '£1,450', 'min. tenancy': 'Ask agent', 'let type': 'Long term', 'furnish type': 'Unfurnished', 'council tax': 'Ask agent'}",1120.0,104.0,True,,"(51.5881467, -0.2992138)",14.867058654923373,78.88888888888889,70.26588269015326,100.0,79.66,actual,geocoded
167347229,334,"£1,447 pcm",weekly,Flat,1,1.0,"Cygnet Close, Stonebridge, NW10 8TP",Spacious purpose built 1 bedroom ground floor flat * Fitted kitchen * Good size bedroom * Modern bathroom * Offered in very good condition * Free Parking Located on a quiet residential area. With good access to local amenities as the development is located just off the Bre...,https://www.rightmove.co.uk/properties/167347229#/?channel=RES_LET,/property-to-rent/contactBranch.html?propertyId=167347229,"Churchill & Mathesons, Harlesden",266774,Reduced yesterday,2025-09-24T09:38:20Z,,NW10,2025-10-15T18:49:30.583850,"{'let available date': 'Now', 'deposit': '£1,730', 'min. tenancy': 'Ask agent', 'let type': 'Long term', 'furnish type': 'Furnished or unfurnished, landlord is flexible', 'council tax': 'Ask agent'}",408.0,38.0,True,,"(51.55134, -0.2577999)",10.236206485184272,100.0,79.52758702963146,38.0,79.41,actual,geocoded
167350325,1350,"£1,350 pcm",monthly,Flat,1,,"Tower Buildings, Brewhouse Lane, London, E1W","SITUATED IN A CHARMING PERIOD BUILDING IS THIS COMPACT ONE BEDROOM UNFURNISHED TOP FLOOR FLAT. SITUATED IN A SOUGHT AFTER LOCATION CLOSE TO THE THAMES AND NOT FAR FROM WAPPING STATION. SUITABLE FOR A SINGLE TENANT. EPC RATING E. COUNCIL TAX BAND A. DAMAGES DEPOSIT £1,350.00",https://www.rightmove.co.uk/properties/167350325#/?channel=RES_LET,/property-to-rent/contactBranch.html?propertyId=167350325,"Wade Residential, Upminster",163091,Added on 24/09/2025,2025-09-24T18:29:30Z,,E1W,2025-10-15T18:50:06.850847,"{'let available date': 'Ask agent', 'deposit': 'Ask agent', 'min. tenancy': 'Ask agent', 'let type': 'Long term', 'furnish type': 'Ask agent', 'council tax': 'Ask agent'}",,,True,,"(51.4893335, -0.1440551)",2.380153846150935,81.11111111111111,95.23969230769814,43.729438202247195,79.29,estimated,geocoded
166264826,1350,"£1,350 pcm",monthly,Flat,1,1.0,"The Vista Building, 30 Calderwood Street, London, SE18","Ideally located within the centre of Woolwich town centre is this lovely one bedroom fifth floor flat. Within a short walk of Woolwich Town Centre for shopping, Elizabeth Line, DLR & main line railway stations with trains into centre London. The property comprises entrance hall, lounge ...",https://www.rightmove.co.uk/properties/166264826#/?channel=RES_LET,/property-to-rent/contactBranch.html?propertyId=166264826,"hi-residential, South East London",5609,Added on 27/08/2025,2025-08-27T14:01:45Z,,SE18,2025-10-15T18:50:19.037616,"{'let available date': 'Now', 'deposit': '£1,557', 'min. tenancy': 'Ask agent', 'let type': 'Long term', 'furnish type': 'Unfurnished', 'council tax': 'Ask agent'}",,,True,,"(51.4893335, -0.1440551)",2.380153846150935,81.11111111111111,95.23969230769814,43.729438202247195,79.29,estimated,geocoded
168203609,1350,"£1,350 pcm",monthly,Semi-Detached,1,,"Kings Parade, Askew Road, London, W12","1-Bedroom Flat in Great Location - Ready to Move In!Looking for a modern place to live? This 1-bedroom flat is in a top location, close to shops, restaurants, and public transport. What You Get:A bright bedroom with space for storageOpen living and dining areakitchen with appliancesClean",https://www.rightmove.co.uk/properties/168203609#/?channel=RES_LET,/property-to-rent/contactBranch.html?propertyId=168203609,"G&M Living Spaces Limited, Covering London",290723,Added today,2025-10-15T13:49:42Z,,W12,2025-10-15T18:49:23.151647,"{'let available date': 'Ask agent', 'deposit': 'Ask agent', 'min. tenancy': 'Ask agent', 'let type': 'Long term', 'furnish type': 'Ask agent', 'council tax': 'Ask agent'}",,,True,,"(51.4893335, -0.1440551)",2.380153846150935,81.11111111111111,95.23969230769814,43.729438202247195,79.29,estimated,geocoded
167624735,1350,"£1,350 pcm",monthly,Not Specified,1,1.0,"Dorking Court, Hampden Lane, Tottenham, London, N17","NEW! Knights are delighted to let this ground floor one bedroom flat located within a purpose built development and located close to transport links. The flat boasts laminated flooring, fitted kitchen, modern bathroom suite, separate lounge/diner, double glazing, gas central heating and off stree...",https://www.rightmove.co.uk/properties/167624735#/?channel=RES_LET,/property-to-rent/contactBranch.html?propertyId=167624735,"Knights Residential, London",82394,Reduced on 13/10/2025,2025-09-30T16:19:39Z,,N17,2025-10-15T18:49:33.363254,"{'let available date': 'Now', 'deposit': 'Ask agent', 'min. tenancy': 'Ask agent', 'let type': 'Long term', 'furnish type': 'Unfurnished', 'council tax': 'Ask agent'}",,,True,,"(51.4893335, -0.1440551)",2.380153846150935,81.11111111111111,95.23969230769814,43.729438202247195,79.29,estimated,geocoded
87336630,1375,"£1,375 pcm",monthly,Flat,1,1.0,"Windmill Drive, Cricklewood, London, NW2","A well-presented first floor studio/one-bedroom flat situated within a modern development in Cricklewood. The property features a bright reception room with an archway leading to the sleeping area, a fully fitted separate kitchen, and a full bathroom. Additional benefits include off-street parkin...",https://www.rightmove.co.uk/properties/87336630#/?channel=RES_LET,/property-to-rent/contactBranch.html?propertyId=87336630,"Living Residential, West Hampstead-London",5243,Added today,2025-10-15T09:04:58Z,,NW2,2025-10-15T18:49:28.011583,"{'let available date': '21/10/2025', 'deposit': '£1,586', 'min. tenancy': 'Ask agent', 'let type': 'Long term', 'furnish type': 'Unfurnished', 'council tax': 'Ask agent'}",,,True,,"(51.4893335, -0.1440551)",2.380153846150935,80.55555555555556,95.23969230769814,43.729438202247195,79.06,estimated,geocoded
168180629,1450,"£1,450 pcm",monthly,Flat,1,,"New Horizons Court, London, TW8",Quick Access to Central London & Heathrow - WIFI Included - Bright Interiors - Communal Courtyards - Pet Friendly - On-Site Parking - Modern Kitchens,https://www.rightmove.co.uk/properties/168180629#/?channel=RES_LET,/property-to-rent/contactBranch.html?propertyId=168180629,"Vonder, Vonder",79578,Added yesterday,2025-10-14T01:56:33Z,,TW8,2025-10-15T18:49:33.363188,"{'let available date': 'Now', 'deposit': 'Ask agent', 'min. tenancy': '12 months', 'let type': 'Long term', 'furnish type': 'Furnished or unfurnished, landlord is flexible', 'council tax': 'Ask agent'}",504.0,47.0,True,,"(51.4893335, -0.1440551)",2.380153846150935,78.88888888888889,95.23969230769814,47.0,79.05,actual,geocoded
166029131,1400,"£1,400 pcm",monthly,Flat,1,1.0,"London Road, London","Welcome to this one-bedroom apartment, perfect for singles or couples seeking a comfortable and convenient lifestyle. Located in a quiet, well-kept secure building, this unit offers a smart layout and plenty of natural light. The open-plan living and dining area is bright and inviting, with an o...",https://www.rightmove.co.uk/properties/166029131#/?channel=RES_LET,/property-to-rent/contactBranch.html?propertyId=166029131,"James Alexander, Norbury",287633,Reduced on 09/10/2025,2025-08-20T17:55:46Z,,,2025-10-15T18:49:43.835062,"{'let available date': 'Ask agent', 'deposit': '£1,615', 'min. tenancy': 'Ask agent', 'let type': 'Long term', 'furnish type': 'Part furnished', 'council tax': 'Ask agent'}",,,True,,"(51.4969217, -0.1025064)",2.14073379287902,80.0,95.71853241424196,43.729438202247195,79.03,estimated,geocoded
167262659,1400,"£1,400 pcm",monthly,Apartment,1,1.0,"Ivy Road, London, SE4","Reeds Rains are proud to present this stunning one bedroom purpose built apartment situated in the heart of Brockley.  The property boasts an expansive reception room including space for dining, a fully fitted kitchen with integrated appliances, a double bedroom to the rear and a ...",https://www.rightmove.co.uk/properties/167262659#/?channel=RES_LET,/property-to-rent/contactBranch.html?propertyId=167262659,"Reeds Rains, Catford",46473,Added on 22/09/2025,2025-09-22T13:28:41Z,,SE4,2025-10-15T18:50:09.284973,"{'let available date': 'Now', 'deposit': '£1,150', 'min. tenancy': '6 months', 'let type': 'Long term', 'furnish type': 'Unfurnished', 'council tax': 'Ask agent'}",,,True,,"(51.4893335, -0.1440551)",2.380153846150935,80.0,95.23969230769814,43.729438202247195,78.84,estimated,geocoded
167429426,1400,"£1,400 pcm",monthly,Flat,1,1.0,"Tyrwhitt Road, Brockley, London, SE4",A top floor apartment to rent in this popular converted house in a fantastic location to local amenities and train links.,https://www.rightmove.co.uk/properties/167429426#/?channel=RES_LET,/property-to-rent/contactBranch.html?propertyId=167429426,"Kinleigh Folkard & Hayward - Lettings, Brockley",121789,Added on 25/09/2025,2025-09-25T15:30:58Z,,SE4,2025-10-15T18:50:06.850823,"{'let available date': 'Now', 'deposit': '£1,344', 'min. tenancy': 'Ask agent', 'let type': 'Long term', 'furnish type': 'Unfurnished', 'council tax': 'Ask agent'}",,,True,,"(51.4893335, -0.1440551)",2.380153846150935,80.0,95.23969230769814,43.729438202247195,78.84,estimated,geocoded
167141327,1400,"£1,400 pcm",monthly,Flat,1,1.0,"Parr Close, London, N9","Spacious one-bedroom flat, 2nd Floor Flat for Rent in Edmonton Available now! This well-maintained flat is ready for immediate occupancy, with all necessary documents provided. Please note: there... ** Property Reference: 2593720 **",https://www.rightmove.co.uk/properties/167141327#/?channel=RES_LET,/property-to-rent/contactBranch.html?propertyId=167141327,"OpenRent, London",96668,Reduced on 25/09/2025,2025-09-18T12:19:18Z,,N9,2025-10-15T18:50:06.850836,"{'let available date': 'Now', 'deposit': '£1,615', 'min. tenancy': 'Ask agent', 'let type': 'Long term', 'furnish type': 'Furnished or unfurnished, landlord is flexible', 'council tax': 'Ask agent'}",,,True,,"(51.4893335, -0.1440551)",2.380153846150935,80.0,95.23969230769814,43.729438202247195,78.84,estimated,geocoded
168197303,1400,"£1,400 pcm",monthly,Flat,1,1.0,"Beaconsfield Road, London, N11","Discover the perfect rental opportunity in this newly refurbished one-bedroom apartment on Beaconsfield Road, London, N11. Boasting a spacious open plan kitchen lounge, fully fitted kitchen/diner, and close proximity to shops, public transport, and reputable schools, this brand new flat offers a ...",https://www.rightmove.co.uk/properties/168197303#/?channel=RES_LET,/property-to-rent/contactBranch.html?propertyId=168197303,"Chris Anthony Estates, London",122383,Added today,2025-10-15T12:15:29Z,,N11,2025-10-15T18:49:25.586923,"{'let available date': 'Now', 'deposit': '£1,400', 'min. tenancy': 'Ask agent', 'let type': 'Long term', 'furnish type': 'Ask agent', 'council tax': 'Ask agent'}",,,True,,"(51.4893335, -0.1440551)",2.380153846150935,80.0,95.23969230769814,43.729438202247195,78.84,estimated,geocoded
167261819,1400,"£1,400 pcm",monthly,Flat,1,1.0,"Hillside House, 2-6 Friern Park, London, N12","Welcome to this stunning newly refurbished 1-bedroom flat, nestled in the heart of North Finchley. Situated in a vibrant and well-connected area. Ideal for first-time renters, young professionals, or investors, this flat promises a comfortable and stylish lifestyle.",https://www.rightmove.co.uk/properties/167261819#/?channel=RES_LET,/property-to-rent/contactBranch.html?propertyId=167261819,"Chris Anthony Estates, London",122383,Added on 22/09/2025,2025-09-22T13:15:55Z,,N12,2025-10-15T18:50:09.284977,"{'let available date': 'Now', 'deposit': '£1,400', 'min. tenancy': 'Ask agent', 'let type': 'Long term', 'furnish type': 'Ask agent', 'council tax': 'Ask agent'}",,,True,,"(51.4893335, -0.1440551)",2.380153846150935,80.0,95.23969230769814,43.729438202247195,78.84,estimated,geocoded
166270622,1408,"£1,408 pcm",monthly,Flat,1,1.0,"Edith Villas, London, W14","1 bed flat located on the Lower ground floor
Inclusive of Gas and Water bills
Minutes form Kensington Olympia and West Kensington stations",https://www.rightmove.co.uk/properties/166270622#/?channel=RES_LET,/property-to-rent/contactBranch.html?propertyId=166270622,"Colet Estates, London",75829,Added on 27/08/2025,2025-08-27T15:27:31Z,,W14,2025-10-15T18:50:19.037605,"{'let available date': '28/11/2025', 'deposit': '£1,625', 'min. tenancy': '6 months', 'let type': 'Long term', 'furnish type': 'Furnished or unfurnished, landlord is flexible', 'council tax': 'Ask agent'}",,,True,,"(51.4893335, -0.1440551)",2.380153846150935,79.82222222222222,95.23969230769814,43.729438202247195,78.77,estimated,geocoded
168040472,346,"£1,499 pcm",weekly,Flat,2,1.0,"High Street, South Norwood",Absolute Living are delighted to market this bright and spacious two bed flat close to Norwood Junction Station. The property comes furnished and is Available Now.,https://www.rightmove.co.uk/properties/168040472#/?channel=RES_LET,/property-to-rent/contactBranch.html?propertyId=168040472,"Absolute Living, London",91853,Reduced today,2025-10-09T14:48:39Z,,,2025-10-15T18:49:23.151601,"{'let available date': '18/10/2025', 'deposit': '£1,730', 'min. tenancy': 'Ask agent', 'let type': 'Long term', 'furnish type': 'Furnished', 'council tax': 'Ask agent'}",,,True,,"(51.4005795, -0.0731241)",12.547411341763711,100.0,74.90517731647257,43.729438202247195,78.71,estimated,geocoded
160874993,1400,"£1,400 pcm",monthly,Flat,1,1.0,"Trafalgar Avenue, London, SE15",We are proud to present to the lettings market this beautiful 1 bedroom flat in characteristic Victorian terrace,https://www.rightmove.co.uk/properties/160874993#/?channel=RES_LET,/property-to-rent/contactBranch.html?propertyId=160874993,"ROCKWELL GREEN PROPERTIES LIMITED, London",288347,Reduced on 28/04/2025,2025-04-18T10:06:53Z,,SE15,2025-10-15T18:50:21.311034,"{'let available date': 'Now', 'deposit': '£1,400', 'min. tenancy': '6 months', 'let type': 'Long term', 'furnish type': 'Unfurnished', 'council tax': 'Ask agent'}",550.0,51.0,True,,"(51.4856411, -0.0740773)",4.478724189097558,80.0,91.04255162180489,51.0,78.62,actual,geocoded
168126194,1425,"£1,425 pcm",monthly,Flat,1,1.0,"Canning Crescent, London, N22",Description 1 Bed Flat- Self Contained- few minutes from Wood Green Underground. Rent of £1400 without bills. Monthly Bills (Council Tax + Gas +Electricity+ Water) £206 approximately. to be pai... ** Property Reference: 2655872 **,https://www.rightmove.co.uk/properties/168126194#/?channel=RES_LET,/property-to-rent/contactBranch.html?propertyId=168126194,"OpenRent, London",96668,Added on 11/10/2025,2025-10-11T22:15:55Z,,N22,2025-10-15T18:49:35.769226,"{'let available date': '02/01/2026', 'deposit': '£1,600', 'min. tenancy': 'Ask agent', 'let type': 'Long term', 'furnish type': 'Furnished', 'council tax': 'Ask agent'}",,,True,,"(51.4893335, -0.1440551)",2.380153846150935,79.44444444444444,95.23969230769814,43.729438202247195,78.62,estimated,geocoded
168202469,1425,"£1,425 pcm",monthly,Apartment,1,1.0,"1 Heybourne Crescent, London, NW9","1 bedroom modern, open-plan and furnished apartment with a private balcony. A short walk to Colindale station to get you in Kings Cross in 20mins.",https://www.rightmove.co.uk/properties/168202469#/?channel=RES_LET,/property-to-rent/contactBranch.html?propertyId=168202469,"Folio London, London",97670,Reduced today,2025-10-15T13:32:29Z,,NW9,2025-10-15T18:49:23.151641,"{'let available date': '28/10/2025', 'deposit': '£1,644', 'min. tenancy': 'Ask agent', 'let type': 'Long term', 'furnish type': 'Furnished', 'council tax': 'Ask agent'}",,,True,,"(51.4893335, -0.1440551)",2.380153846150935,79.44444444444444,95.23969230769814,43.729438202247195,78.62,estimated,geocoded
168018077,1400,"£1,400 pcm",monthly,Flat,1,1.0,"Baildon Street, London, SE8","Contemporary one bedroom flat within a unique development, well-located for all local amenities and transport links. Comprising of wooden flooring, gas central heating and double glazing. Also benefiting from a separate kitchen, modern shower suite, one double bedroom with built-in wardrobe and ...",https://www.rightmove.co.uk/properties/168018077#/?channel=RES_LET,/property-to-rent/contactBranch.html?propertyId=168018077,"Keatons, Deptford",2915,Reduced on 13/10/2025,2025-10-09T10:20:03Z,,SE8,2025-10-15T18:49:35.769206,"{'let available date': 'Now', 'deposit': '£1,615', 'min. tenancy': 'Ask agent', 'let type': 'Long term', 'furnish type': 'Unfurnished', 'council tax': 'Ask agent'}",449.0,42.0,True,,"(51.4893335, -0.1440551)",2.380153846150935,80.0,95.23969230769814,42.0,78.5,actual,geocoded
166661579,1445,"£1,445 pcm",monthly,Flat,1,1.0,"Rufford Street, London, N1","Modern Self-Contained Studio Flat in Prime Location with Private Patio. The final rent is £1,749.00 per calendar month, inclusive of all bills except Wi-Fi. The property cannot be let without bill... ** Property Reference: 2582178 **",https://www.rightmove.co.uk/properties/166661579#/?channel=RES_LET,/property-to-rent/contactBranch.html?propertyId=166661579,"OpenRent, London",96668,Reduced on 05/09/2025,2025-09-06T01:05:06Z,,N1,2025-10-15T18:50:14.111266,"{'let available date': 'Now', 'deposit': '£1,667', 'min. tenancy': 'Ask agent', 'let type': 'Long term', 'furnish type': 'Furnished', 'council tax': 'Ask agent'}",,,True,,"(51.4893335, -0.1440551)",2.380153846150935,79.0,95.23969230769814,43.729438202247195,78.44,estimated,geocoded
168057854,1449,"£1,449 pcm",monthly,Flat,1,1.0,"Hickory Close, London, N9",ONE BEDROOM Flat in a nice location.***Please note unfortunately claimants are not eligible to rent this property*** This property is within easy reach of all local amenities and t... ** Property Reference: 2632702 **,https://www.rightmove.co.uk/properties/168057854#/?channel=RES_LET,/property-to-rent/contactBranch.html?propertyId=168057854,"OpenRent, London",96668,Added on 09/10/2025,2025-10-09T23:08:57Z,,N9,2025-10-15T18:49:40.916164,"{'let available date': 'Now', 'deposit': '£1,449', 'min. tenancy': 'Ask agent', 'let type': 'Long term', 'furnish type': 'Furnished', 'council tax': 'Ask agent'}",,,True,,"(51.4893335, -0.1440551)",2.380153846150935,78.91111111111111,95.23969230769814,43.729438202247195,78.41,estimated,geocoded
168227648,1450,"£1,450 pcm",monthly,Flat,1,1.0,"Raleigh Road, Haringey, London, N8","First floor, one bedroom apartment set in a period house, situated on the Haringey ladder. Accomidation comprises double bedroom, fully fitted kitchen diner, separate spacious reception and modern bathroom, furnished. The property will be offered newly decorated throughout. further benefits inclu...",https://www.rightmove.co.uk/properties/168227648#/?channel=RES_LET,/property-to-rent/contactBranch.html?propertyId=168227648,"Paul Simon Estate Agents, London",45303,Added today,2025-10-15T18:34:07Z,,N8,2025-10-15T18:49:23.151594,"{'let available date': '18/11/2025', 'deposit': '£1,673', 'min. tenancy': '12 months', 'let type': 'Long term', 'furnish type': 'Furnished', 'council tax': 'Ask agent'}",,,True,,"(51.4893335, -0.1440551)",2.380153846150935,78.88888888888889,95.23969230769814,43.729438202247195,78.4,estimated,geocoded
167132726,1450,"£1,450 pcm",monthly,Flat,1,1.0,"Gunnersbury Gardens, London, W3",Bright & airy throughout. Only 5 minutes from Acton Town and the Piccadilly Line. Loads of storage space. Security alarm.,https://www.rightmove.co.uk/properties/167132726#/?channel=RES_LET,/property-to-rent/contactBranch.html?propertyId=167132726,"The Online Letting Agents Ltd, Bury St Edmunds",82831,Added on 18/09/2025,2025-09-18T10:36:32Z,,W3,2025-10-15T18:50:09.285002,"{'let available date': 'Now', 'deposit': '£1,673', 'min. tenancy': '12 months', 'let type': 'Long term', 'furnish type': 'Part furnished', 'council tax': 'Ask agent'}",,,True,,"(51.4893335, -0.1440551)",2.380153846150935,78.88888888888889,95.23969230769814,43.729438202247195,78.4,estimated,geocoded
168132680,1450,"£1,450 pcm",monthly,Flat,1,1.0,"Salehurst Road, London, SE4","A beautifully renovated basement flat with a double bedroom with walk-in wardrobe and outside space - includes bills! Key features: Utility bills, excludes internet at £1450/month Unfurnished... ** Property Reference: 2656593 **",https://www.rightmove.co.uk/properties/168132680#/?channel=RES_LET,/property-to-rent/contactBranch.html?propertyId=168132680,"OpenRent, London",96668,Added on 13/10/2025,2025-10-13T00:08:23Z,,SE4,2025-10-15T18:49:35.769220,"{'let available date': '25/10/2025', 'deposit': '£1,673', 'min. tenancy': 'Ask agent', 'let type': 'Long term', 'furnish type': 'Unfurnished', 'council tax': 'Ask agent'}",,,True,,"(51.4893335, -0.1440551)",2.380153846150935,78.88888888888889,95.23969230769814,43.729438202247195,78.4,estimated,geocoded
167438399,1450,"£1,450 pcm",monthly,Flat,1,1.0,"Poplars Court, London, E17","A beautifully presented, one bedroom apartment set within a private development on Poplars Rd near Bakers Arm. This stylish apartment offers: One double bedroom with fitted wardrobes Conte... ** Property Reference: 2574023 **",https://www.rightmove.co.uk/properties/167438399#/?channel=RES_LET,/property-to-rent/contactBranch.html?propertyId=167438399,"OpenRent, London",96668,Added on 25/09/2025,2025-09-25T17:28:54Z,,E17,2025-10-15T18:50:06.850817,"{'let available date': 'Now', 'deposit': '£1,673', 'min. tenancy': 'Ask agent', 'let type': 'Long term', 'furnish type': 'Unfurnished', 'council tax': 'Ask agent'}",,,True,,"(51.4893335, -0.1440551)",2.380153846150935,78.88888888888889,95.23969230769814,43.729438202247195,78.4,estimated,geocoded
167568098,1450,"£1,450 pcm",monthly,House of Multiple Occupation,1,1.0,"Downhills Way, London, N17",Spacious Double Bedroom with En Suite in a Shared Home Overlooking Downhills Park – All Bills Included + Parking,https://www.rightmove.co.uk/properties/167568098#/?channel=RES_LET,/property-to-rent/contactBranch.html?propertyId=167568098,"COZEE, London",262232,Reduced on 24/09/2025,2025-09-29T15:40:00Z,,N17,2025-10-15T18:50:06.850849,"{'let available date': 'Ask agent', 'deposit': 'Ask agent', 'min. tenancy': 'Ask agent', 'let type': 'Long term', 'furnish type': 'Furnished', 'council tax': 'Ask agent'}",,,True,,"(51.4893335, -0.1440551)",2.380153846150935,78.88888888888889,95.23969230769814,43.729438202247195,78.4,estimated,geocoded
46503491,335,"£1,452 pcm",weekly,Flat,1,1.0,"Pulse Development, Joslin Avenue, Colindale NW9","One bedroom apartment situated in the Pulse Development, Colindale NW9. Located on the top floor with lift access and ideally positioned next door to Colindale tube station as well as local amenities including supermarkets, restaurants & coffee shops. Available to rent NOW.",https://www.rightmove.co.uk/properties/46503491#/?channel=RES_LET,/property-to-rent/contactBranch.html?propertyId=46503491,"Becker & Co, Mill Hill",76631,Added on 09/10/2025,2014-05-23T18:19:40Z,,NW9,2025-10-15T18:49:40.916260,"{'let available date': 'Now', 'deposit': 'Ask agent', 'min. tenancy': 'Ask agent', 'let type': 'Long term', 'furnish type': 'Furnished or unfurnished, landlord is flexible', 'council tax': 'Ask agent'}",,,True,,"(51.5951943, -0.2519507)",12.972682003156637,100.0,74.05463599368673,43.729438202247195,78.37,estimated,geocoded
87302499,1480,"£1,480 pcm",monthly,Flat,1,1.0,"The Limes Avenue, London, N11","Bright one bedroom apartment with views of Alexandra Palace. 4 mins walk to the Piccadilly line, 7 mins to New Southgate overground. Summary & Exclusions: - Rent Amount: £1,480.00 per month (£341... ** Property Reference: 2658366 **",https://www.rightmove.co.uk/properties/87302499#/?channel=RES_LET,/property-to-rent/contactBranch.html?propertyId=87302499,"OpenRent, London",96668,Added yesterday,2025-10-14T12:48:12Z,,N11,2025-10-15T18:49:30.583868,"{'let available date': '18/11/2025', 'deposit': '£1,480', 'min. tenancy': 'Ask agent', 'let type': 'Long term', 'furnish type': 'Furnished', 'council tax': 'Ask agent'}",,,True,,"(51.4893335, -0.1440551)",2.380153846150935,78.22222222222223,95.23969230769814,43.729438202247195,78.13,estimated,geocoded
60747017,1500,"£1,500 pcm",monthly,Flat,1,1.0,"Windermere Road, London, N19","A well-proportioned one double-bedroom apartment, situated on the lower ground floor of a development on Windermere Road. Benefiting from a separate lounge and kitchen, central gas heating, double glazing, and a communal garden. Close to Archway tube station. Available 2nd January 2026",https://www.rightmove.co.uk/properties/60747017#/?channel=RES_LET,/property-to-rent/contactBranch.html?propertyId=60747017,"CP Papas Property Centre, London",78719,Added today,2016-07-20T14:58:54Z,,N19,2025-10-15T18:49:25.586943,"{'let available date': '02/01/2026', 'deposit': 'Ask agent', 'min. tenancy': '12 months', 'let type': 'Long term', 'furnish type': 'Furnished', 'council tax': 'Ask agent'}",474.0,44.0,True,,"(51.4893335, -0.1440551)",2.380153846150935,77.77777777777779,95.23969230769814,44.0,78.01,actual,geocoded
165830678,1495,"£1,495 pcm",monthly,Flat,1,,"The Limes Avenue, London, N11",Woodhouse Estates are delighted to offer this well presented first floor one bedroom flat set in Arnos Grove - Available 26th September,https://www.rightmove.co.uk/properties/165830678#/?channel=RES_LET,/property-to-rent/contactBranch.html?propertyId=165830678,"Woodhouse Estates, Friern Barnet",77192,Added on 16/08/2025,2025-08-16T12:08:58Z,,N11,2025-10-15T18:50:19.037683,"{'let available date': 'Ask agent', 'deposit': 'Ask agent', 'min. tenancy': 'Ask agent', 'let type': 'Long term', 'furnish type': 'Unfurnished', 'council tax': 'Ask agent'}",,,True,,"(51.4893335, -0.1440551)",2.380153846150935,77.88888888888889,95.23969230769814,43.729438202247195,78.0,estimated,geocoded
167888192,1500,"£1,500 pcm",monthly,Apartment,1,1.0,"The Vista Building, 30 Calderwood Street, Woolwich, London, SE18","Perfectly located in the heart of Woolwich! We are pleased to offer this well presented one bedroom apartment found on the 6th floor of this modern block. Offered unfurnished and available from 1st November 2025, your earliest viewing is advised.",https://www.rightmove.co.uk/properties/167888192#/?channel=RES_LET,/property-to-rent/contactBranch.html?propertyId=167888192,"Winkworth, Greenwich",99271,Reduced today,2025-10-07T08:54:04Z,,SE18,2025-10-15T18:49:23.151635,"{'let available date': '01/11/2025', 'deposit': '£1,730', 'min. tenancy': 'Ask agent', 'let type': 'Long term', 'furnish type': 'Unfurnished', 'council tax': 'Ask agent'}",,,True,,"(51.4893335, -0.1440551)",2.380153846150935,77.77777777777779,95.23969230769814,43.729438202247195,77.95,estimated,geocoded
163841918,1500,"£1,500 pcm",monthly,Flat,1,1.0,"Queens Parade, Green Lanes, London, N8","Recently refurbished 1bed flat on Green Lanes. Bright openplan lounge with modern fitted kitchen, spacious double bedroom. Close to shops, restaurants, and transport links. Ideal for a professional or couple. Stylish, convenient, and ready to move in.",https://www.rightmove.co.uk/properties/163841918#/?channel=RES_LET,/property-to-rent/contactBranch.html?propertyId=163841918,"Maxwells Estates, Islington",88079,Reduced on 15/07/2025,2025-06-26T15:39:49Z,,N8,2025-10-15T18:50:19.037775,"{'let available date': 'Now', 'deposit': '£1,700', 'min. tenancy': 'Ask agent', 'let type': 'Long term', 'furnish type': 'Furnished', 'council tax': 'Ask agent'}",,,True,,"(51.4893335, -0.1440551)",2.380153846150935,77.77777777777779,95.23969230769814,43.729438202247195,77.95,estimated,geocoded
167013857,1500,"£1,500 pcm",monthly,Apartment,1,1.0,"Middle Lane, Crouch End, London, N8","The Property Company is pleased to present this lovely one-bedroom flat with a study in the heart of Crouch End. Located on the first floor, the property features a bright and spacious living area with an open-plan modern fitted kitchen, fantastic views over Priory Park, a contemporary...",https://www.rightmove.co.uk/properties/167013857#/?channel=RES_LET,/property-to-rent/contactBranch.html?propertyId=167013857,"The Property Company, Crouch End",76256,Reduced on 11/10/2025,2025-09-15T16:35:45Z,,N8,2025-10-15T18:49:35.769236,"{'let available date': '23/10/2025', 'deposit': '£1,730', 'min. tenancy': 'Ask agent', 'let type': 'Long term', 'furnish type': 'Furnished', 'council tax': 'Ask agent'}",,,True,,"(51.4893335, -0.1440551)",2.380153846150935,77.77777777777779,95.23969230769814,43.729438202247195,77.95,estimated,geocoded
167893463,1500,"£1,500 pcm",monthly,End of Terrace,1,1.0,"Boycroft Avenue, Kingsbury, London, NW9","""No Deposit Option Available"" A Ground Floor one bedroom maisonette with own drive and rear garden ready to move in October 2025. The property is offered unfurnished and comprises of One Double Bedroom, Kitchen with all of the required appliance and bathroom with a...",https://www.rightmove.co.uk/properties/167893463#/?channel=RES_LET,/property-to-rent/contactBranch.html?propertyId=167893463,"Andrews Letting and Management, Kingsbury",34325,Added on 11/09/2025,2025-10-07T09:55:13Z,,NW9,2025-10-15T18:50:14.111241,"{'let available date': '25/10/2025', 'deposit': '£1,730', 'min. tenancy': '12 months', 'let type': 'Long term', 'furnish type': 'Unfurnished', 'council tax': 'Ask agent'}",,,True,,"(51.4893335, -0.1440551)",2.380153846150935,77.77777777777779,95.23969230769814,43.729438202247195,77.95,estimated,geocoded
167301833,1500,"£1,500 pcm",monthly,Flat,1,,"Leaside Road, London, E5",Refurbished One Bedroom Flat near Clapton Overground,https://www.rightmove.co.uk/properties/167301833#/?channel=RES_LET,/property-to-rent/contactBranch.html?propertyId=167301833,"Rayners.com, Hackney",282839,Reduced on 17/09/2025,2025-09-23T11:43:13Z,,E5,2025-10-15T18:50:11.737992,"{'let available date': 'Now', 'deposit': 'Ask agent', 'min. tenancy': 'Ask agent', 'let type': 'Long term', 'furnish type': 'Unfurnished', 'council tax': 'Ask agent'}",,,True,,"(51.4893335, -0.1440551)",2.380153846150935,77.77777777777779,95.23969230769814,43.729438202247195,77.95,estimated,geocoded
168159611,1500,"£1,500 pcm",monthly,Flat,1,1.0,"Priestley Road, London, CR4","We are pleased to offer this 1 double bedroom first floor flat with fully fitted kitchen, separate living area and bathroom with driveway next to Mitcham Eastfield Rail Station.*Available immediately*All bills included except Council Tax*Ideal for Professional Singles or Couples only*",https://www.rightmove.co.uk/properties/168159611#/?channel=RES_LET,/property-to-rent/contactBranch.html?propertyId=168159611,"SW16, Streatham",76165,Added on 13/10/2025,2025-10-13T14:37:32Z,,CR4,2025-10-15T18:49:33.363236,"{'let available date': 'Ask agent', 'deposit': '£1,500', 'min. tenancy': 'Ask agent', 'let type': 'Long term', 'furnish type': 'Furnished', 'council tax': 'Ask agent'}",,,True,,"(51.4893335, -0.1440551)",2.380153846150935,77.77777777777779,95.23969230769814,43.729438202247195,77.95,estimated,geocoded
156328391,1500,"£1,500 pcm",monthly,Flat,1,1.0,"Burgoyne Road, Haringey, London, N4","NEW! Knights are delighted to offer to let this one bedroom flat located off Green Lanes and close to all amenities including transport links. The top floor flat has recently been decorated and boasts part laminated flooring, gas central heating, open plan kitchen/lounge, bathroom suite and large...",https://www.rightmove.co.uk/properties/156328391#/?channel=RES_LET,/property-to-rent/contactBranch.html?propertyId=156328391,"Knights Residential, London",82394,Added today,2024-12-30T11:36:50Z,,N4,2025-10-15T18:49:28.011572,"{'let available date': 'Now', 'deposit': 'Ask agent', 'min. tenancy': 'Ask agent', 'let type': 'Long term', 'furnish type': 'Part furnished', 'council tax': 'Ask agent'}",,,True,,"(51.4893335, -0.1440551)",2.380153846150935,77.77777777777779,95.23969230769814,43.729438202247195,77.95,estimated,geocoded
168057161,1500,"£1,500 pcm",monthly,Flat,1,1.0,"Ringles Court, London, E6",Key features Newly refurbished one bedroom flat Allocated gated parking Close to East Ham station Great location with an array of amenitiesDescription A great opportunity to rent this newly refur... ** Property Reference: 2345509 **,https://www.rightmove.co.uk/properties/168057161#/?channel=RES_LET,/property-to-rent/contactBranch.html?propertyId=168057161,"OpenRent, London",96668,Added on 09/10/2025,2025-10-09T22:12:45Z,,E6,2025-10-15T18:49:40.916172,"{'let available date': 'Now', 'deposit': '£1,500', 'min. tenancy': 'Ask agent', 'let type': 'Long term', 'furnish type': 'Unfurnished', 'council tax': 'Ask agent'}",,,True,,"(51.4893335, -0.1440551)",2.380153846150935,77.77777777777779,95.23969230769814,43.729438202247195,77.95,estimated,geocoded
167424560,1500,"£1,500 pcm",monthly,Flat,1,1.0,"Silver Birch Close, London, N11",Stunning one bedroom flat situated on this popular development is a 1 bed GROUND FLOOR purpose built flat. Light and airy with bay windows. The flat is double glazed and offers gas central heating... ** Property Reference: 2631744 **,https://www.rightmove.co.uk/properties/167424560#/?channel=RES_LET,/property-to-rent/contactBranch.html?propertyId=167424560,"OpenRent, London",96668,Added on 25/09/2025,2025-09-25T14:28:34Z,,N11,2025-10-15T18:50:06.850829,"{'let available date': 'Now', 'deposit': '£1,500', 'min. tenancy': 'Ask agent', 'let type': 'Long term', 'furnish type': 'Unfurnished', 'council tax': 'Ask agent'}",,,True,,"(51.4893335, -0.1440551)",2.380153846150935,77.77777777777779,95.23969230769814,43.729438202247195,77.95,estimated,geocoded
167343077,1500,"£1,500 pcm",monthly,Apartment,1,1.0,"Queens Parade, Harringey, London, N8","A newly refurbished 1 bed apartment available in Harringay only a short walk to Turnpike Lane Station (Piccadilly Line). This apartment boasts neutral decor, Massive kitchen/ Diner/ living Open Plan with all modern appliances and many more wonderful features. The property comes furnished. Located...",https://www.rightmove.co.uk/properties/167343077#/?channel=RES_LET,/property-to-rent/contactBranch.html?propertyId=167343077,"Claremont Estates, London",270461,Reduced on 04/08/2025,2025-09-24T07:24:49Z,,N8,2025-10-15T18:50:19.037723,"{'let available date': 'Now', 'deposit': '£0', 'min. tenancy': 'Ask agent', 'let type': 'Long term', 'furnish type': 'Furnished or unfurnished, landlord is flexible', 'council tax': 'Ask agent'}",,,True,,"(51.4893335, -0.1440551)",2.380153846150935,77.77777777777779,95.23969230769814,43.729438202247195,77.95,estimated,geocoded
164170001,1500,"£1,500 pcm",monthly,Flat,2,1.0,"Melbourne Court, Anerley Road, London, SE20",Spacious 2 Bedroom Flat | 2nd Floor | Open-plan Living Room & Kitchen | 2 Double Bedrooms | Off Street Parking | Balcony | Unfurnished | Available Immediately,https://www.rightmove.co.uk/properties/164170001#/?channel=RES_LET,/property-to-rent/contactBranch.html?propertyId=164170001,"Milegate, London",123322,Reduced on 11/09/2025,2025-07-04T13:10:38Z,,SE20,2025-10-15T18:50:14.111233,"{'let available date': 'Ask agent', 'deposit': '£1,730', 'min. tenancy': 'Ask agent', 'let type': 'Long term', 'furnish type': 'Unfurnished', 'council tax': 'Ask agent'}",,,True,,"(51.4893335, -0.1440551)",2.380153846150935,77.77777777777779,95.23969230769814,43.729438202247195,77.95,estimated,geocoded
95816894,1450,"£1,450 pcm",monthly,Apartment,1,1.0,"Pullman Court, Streatham Hill, London, SW2","A one bedroom purpose built flat in a Grade II listed modernist block on Streatham Hill. The property benefits from having new secondary glazing, new electrical heaters and is ideally placed for easy access to Brixton, Balham, Clapham and Tulse Hill.",https://www.rightmove.co.uk/properties/95816894#/?channel=RES_LET,/property-to-rent/contactBranch.html?propertyId=95816894,"Winkworth, Streatham",34334,Added today,2020-08-07T22:10:43Z,,SW2,2025-10-15T18:49:25.586929,"{'let available date': '17/12/2025', 'deposit': '£0', 'min. tenancy': '12 months', 'let type': 'Long term', 'furnish type': 'Unfurnished', 'council tax': 'Ask agent'}",442.0,41.0,True,,"(51.4893335, -0.1440551)",2.380153846150935,78.88888888888889,95.23969230769814,41.0,77.85,actual,geocoded
167976746,1350,"£1,350 pcm",monthly,Flat,1,1.0,"First Floor Flat, Granville Road, London, Greater London, N12","A recently refurbished first floor one bedroom flat. Located in Granville Road, North Finchley the flat is within walking distance of Finchley Central Underground Station and West Finchley Underground Station.",https://www.rightmove.co.uk/properties/167976746#/?channel=RES_LET,/property-to-rent/contactBranch.html?propertyId=167976746,"Benjamin Stevens, Edgware",93881,Added on 08/10/2025,2025-10-08T11:39:49Z,,N12,2025-10-15T18:49:46.492439,"{'let available date': '24/10/2025', 'deposit': '£1,557', 'min. tenancy': '12 months', 'let type': 'Long term', 'furnish type': 'Unfurnished', 'council tax': 'Ask agent'}",,,True,,"(51.500021, -0.192442)",4.591110580491865,81.11111111111111,90.81777883901627,43.729438202247195,77.52,estimated,geocoded
87303537,1400,"£1,400 pcm",monthly,Flat,1,1.0,"133 Eglinton Hill, London, United Kingdom, SE18","Property Ref: 15711 99home are pleased to market this newly refurbished, good size 1 bedroom first floor flat in quiet …",https://www.rightmove.co.uk/properties/87303537#/?channel=RES_LET,/property-to-rent/contactBranch.html?propertyId=87303537,"gLocalAgents.co.uk, Covering Nationwide",176603,Added yesterday,2025-10-14T13:02:00Z,,SE18,2025-10-15T18:49:30.583859,"{'let available date': 'Now', 'deposit': '£1,750', 'min. tenancy': 'Ask agent', 'let type': 'Long term', 'furnish type': 'Unfurnished', 'council tax': 'Ask agent'}",,,True,,"(51.500021, -0.192442)",4.591110580491865,80.0,90.81777883901627,43.729438202247195,77.07,estimated,geocoded
167839208,1300,"£1,300 pcm",monthly,Apartment,1,1.0,"Buttermere Close, Morden, Surrey, SM4","Welcome to this charming one-bedroom flat located in the heart of Morden. This delightful residence offers a perfect blend of comfort and style, ideal for singles or couples seeking a cozy urban retreat. As you step inside, you are greeted by a lovely entrance hallway that sets the ton...",https://www.rightmove.co.uk/properties/167839208#/?channel=RES_LET,/property-to-rent/contactBranch.html?propertyId=167839208,"Choices, Croydon",12401,Added on 06/10/2025,2025-10-06T10:13:10Z,,SM4,2025-10-15T18:49:54.205740,"{'let available date': '13/11/2025', 'deposit': '£0', 'min. tenancy': 'Ask agent', 'let type': 'Long term', 'furnish type': 'Ask agent', 'council tax': 'Ask agent'}",,,True,,"(51.4934207, -0.0478319)",5.7748009817443515,82.22222222222221,88.4503980365113,43.729438202247195,77.01,estimated,geocoded
167700761,1300,"£1,300 pcm",monthly,Flat,1,1.0,"Walnut Mews, Sutton, Surrey, SM2","To Rent – One Bedroom Apartment | SM2 Your Move are pleased to present this well-maintained one bedroom purpose-built apartment, ideally located in the sought-after SM2 area. This bright and spacious property features: One double bedroom Modern fi...",https://www.rightmove.co.uk/properties/167700761#/?channel=RES_LET,/property-to-rent/contactBranch.html?propertyId=167700761,"Your Move, Sutton",6592,Added on 02/10/2025,2025-10-02T10:36:57Z,,SM2,2025-10-15T18:49:59.184678,"{'let available date': '30/10/2026', 'deposit': '£1,500', 'min. tenancy': '12 months', 'let type': 'Long term', 'furnish type': 'Furnished', 'council tax': 'Ask agent'}",,,True,,"(51.4934207, -0.0478319)",5.7748009817443515,82.22222222222221,88.4503980365113,43.729438202247195,77.01,estimated,geocoded
167685842,346,"£1,499 pcm",weekly,Flat,1,1.0,"Factory Yard, Hanwell","Newly refurbished one bedroom cottage offering modern interiors with classic charm. Ideally located close to excellent transport links, perfect for single professionals or a couple seeking comfort and convenience.",https://www.rightmove.co.uk/properties/167685842#/?channel=RES_LET,/property-to-rent/contactBranch.html?propertyId=167685842,"Dexters, Northfields",202016,Added on 01/10/2025,2025-10-01T18:14:30Z,,,2025-10-15T18:49:59.184700,"{'let available date': 'Ask agent', 'deposit': '£1,730', 'min. tenancy': 'Ask agent', 'let type': 'Long term', 'furnish type': 'Ask agent', 'council tax': 'Ask agent'}",,,True,,"(51.5080753, -0.3406901)",14.794462502932479,100.0,70.41107499413505,43.729438202247195,76.91,estimated,geocoded
167526719,1300,"£1,300 pcm",monthly,Flat,1,1.0,"Myers Lane, London, New Cross, SE14","First floor one bedroom apartment in quiet development close to South Bermondsey and New Cross Gate stations. The property offers a large and bright reception room, spacious kitchen, double bedroom and bathroom. It also benefits from off street parking. Available part furnished.",https://www.rightmove.co.uk/properties/167526719#/?channel=RES_LET,/property-to-rent/contactBranch.html?propertyId=167526719,"Reside, New Cross",9349,Reduced on 10/10/2025,2025-09-27T14:42:13Z,,SE14,2025-10-15T18:49:40.916156,"{'let available date': '25/10/2025', 'deposit': '£1,500', 'min. tenancy': 'Ask agent', 'let type': 'Long term', 'furnish type': 'Furnished', 'council tax': 'Ask agent'}",,,True,,"(51.4834967, -0.0470755)",6.226177999065287,82.22222222222221,87.54764400186943,43.729438202247195,76.65,estimated,geocoded
168077426,1450,"£1,450 pcm",monthly,Flat,2,1.0,"Philips Close, Carshalton, Greater London, SM5",A modern and newly decorated two bedroom top floor flat only a 5 minute walk to Hackbridge station. Unfurnished. Ample residents parking. AVAILABLE IMMEDIATELY,https://www.rightmove.co.uk/properties/168077426#/?channel=RES_LET,/property-to-rent/contactBranch.html?propertyId=168077426,"Kenyons Estate Agents, Carshalton",8348,Added on 10/10/2025,2025-10-10T12:39:02Z,,SM5,2025-10-15T18:49:38.504372,"{'let available date': '18/10/2025', 'deposit': 'Ask agent', 'min. tenancy': '12 months', 'let type': 'Long term', 'furnish type': 'Unfurnished', 'council tax': 'Ask agent'}",,,True,,"(51.500021, -0.192442)",4.591110580491865,78.88888888888889,90.81777883901627,43.729438202247195,76.63,estimated,geocoded
166260860,1350,"£1,350 pcm",monthly,Apartment,1,1.0,"Acacia Road, Mitcham, Surrey, CR4","***STYLISH ONE BEDROOM IDEAL FOR COMMUTERS*** A modern and well presented one bedroom purpose built flat, this lovely property is ideally located close to Mitcham Eastfield's Station. Offering generous double bedroom, ample storage throughout the property, and large open kitchen reception with mo...",https://www.rightmove.co.uk/properties/166260860#/?channel=RES_LET,/property-to-rent/contactBranch.html?propertyId=166260860,"Goodfellows, Mitcham Lettings",89321,Reduced on 05/09/2025,2025-08-27T12:51:13Z,,CR4,2025-10-15T18:50:16.520959,"{'let available date': 'Now', 'deposit': '£1,557', 'min. tenancy': 'Ask agent', 'let type': 'Long term', 'furnish type': 'Unfurnished', 'council tax': 'Ask agent'}",,,True,,"(51.4934207, -0.0478319)",5.7748009817443515,81.11111111111111,88.4503980365113,43.729438202247195,76.57,estimated,geocoded
166792439,1350,"£1,350 pcm",monthly,Apartment,1,1.0,"Canon Court, 91 Manor Road, WALLINGTON, Surrey, SM6",One Bedroom Flat on the top floor of a high-rise block opposite Wallington Train Station,https://www.rightmove.co.uk/properties/166792439#/?channel=RES_LET,/property-to-rent/contactBranch.html?propertyId=166792439,"Andrews Letting and Management, Wallington",34373,Reduced on 29/09/2025,2025-09-09T17:28:37Z,,SM6,2025-10-15T18:50:04.125738,"{'let available date': 'Now', 'deposit': '£1,557', 'min. tenancy': 'Ask agent', 'let type': 'Long term', 'furnish type': 'Unfurnished', 'council tax': 'Ask agent'}",,,True,,"(51.4934207, -0.0478319)",5.7748009817443515,81.11111111111111,88.4503980365113,43.729438202247195,76.57,estimated,geocoded
167848610,1500,"£1,500 pcm",monthly,Apartment,1,1.0,"Goodwin Close, London SE16 3TL","ENS Property Group are delighted to offer you this ground floor apartment located in a quiet cul-de-sac. Offered Furnished and available now. EPC band C. The property is well presented throughout, set on the ground floor, with spacious bedroom with large wardrobe, open-plan kitchen and family bat...",https://www.rightmove.co.uk/properties/167848610#/?channel=RES_LET,/property-to-rent/contactBranch.html?propertyId=167848610,"ENS Property Group Ltd, London",247784,Reduced today,2025-10-06T12:13:37Z,,SE16,2025-10-15T18:49:25.586974,"{'let available date': 'Now', 'deposit': '£1,730', 'min. tenancy': 'Ask agent', 'let type': 'Long term', 'furnish type': 'Furnished', 'council tax': 'Ask agent'}",,,True,,"(51.4947842, -0.0712717)",4.1825119725729545,77.77777777777779,91.63497605485409,43.729438202247195,76.51,estimated,geocoded
168208199,1500,"£1,500 pcm",monthly,Flat,1,1.0,"Kentish Town Road, London, NW1","We are proud to offer this delightful 1 bedroom, 1 bathroom flat in a great location. Available to move in from 01 October 2025. Property is offered furnished. Viewing highly recommended. Contac... ** Property Reference: 2638201 **",https://www.rightmove.co.uk/properties/168208199#/?channel=RES_LET,/property-to-rent/contactBranch.html?propertyId=168208199,"OpenRent, London",96668,Reduced on 30/09/2025,2025-10-15T14:45:39Z,,NW1,2025-10-15T18:50:04.125730,"{'let available date': 'Now', 'deposit': '£1,731', 'min. tenancy': 'Ask agent', 'let type': 'Long term', 'furnish type': 'Furnished', 'council tax': 'Ask agent'}",,,True,,"(51.5450738, -0.141652)",4.22765879713385,77.77777777777779,91.5446824057323,43.729438202247195,76.47,estimated,geocoded
168069146,1350,"£1,350 pcm",monthly,Apartment,1,1.0,"Lower Road, London SE16 2LW","Now on the market is this second floor, one bedroom flat, ideal for single occupancy. The entire building was completely new throughout approx 6 years ago. Modern and bright with a separate shower-room. Gas central heating and double-glazing. Offered as unfurnished available from 4th November 202...",https://www.rightmove.co.uk/properties/168069146#/?channel=RES_LET,/property-to-rent/contactBranch.html?propertyId=168069146,"ENS Property Group Ltd, London",247784,Added on 10/10/2025,2025-10-10T10:32:16Z,,SE16,2025-10-15T18:49:40.916058,"{'let available date': '04/11/2025', 'deposit': '£1,557', 'min. tenancy': 'Ask agent', 'let type': 'Long term', 'furnish type': 'Unfurnished', 'council tax': 'Ask agent'}",,,True,,"(51.492181, -0.045333)",5.980899266656421,81.11111111111111,88.03820146668716,43.729438202247195,76.41,estimated,geocoded
122077037,1450,"£1,450 pcm",monthly,Flat,1,1.0,"Towerside, Wapping","A beautiful studio apartment located in the heart of Wapping. Property boasts spacious living area with fold away bed, compact kitchen and a family bathroom. Towerside located within a stone's throw from Wapping overground station",https://www.rightmove.co.uk/properties/122077037#/?channel=RES_LET,/property-to-rent/contactBranch.html?propertyId=122077037,"Felicity J Lord, Wapping Wall Lettings",11495,Reduced yesterday,2022-04-07T10:34:53Z,,,2025-10-15T18:49:28.011654,"{'let available date': '31/10/2025', 'deposit': '£1,673', 'min. tenancy': 'Ask agent', 'let type': 'Long term', 'furnish type': 'Ask agent', 'council tax': 'Ask agent'}",,,True,,"(51.5047838, -0.0552633)",5.0359231896166285,78.88888888888889,89.92815362076675,43.729438202247195,76.27,estimated,geocoded
167552708,1350,"£1,350 pcm",monthly,Flat,1,1.0,"Myers Lane,  New Cross, SE14","One bedroom apartment in modern development. Modern kitchen, fresh and sparkling bathroom, sunny reception and roomy double bedroom. Double glazing and gas central heating throughout. Midway between New Cross Gate and South Bermondsey stations with links to The City and Central London. Available ...",https://www.rightmove.co.uk/properties/167552708#/?channel=RES_LET,/property-to-rent/contactBranch.html?propertyId=167552708,"Reside, New Cross",9349,Added on 29/09/2025,2025-09-29T12:00:03Z,,SE14,2025-10-15T18:50:04.125767,"{'let available date': 'Now', 'deposit': '£1,555', 'min. tenancy': 'Ask agent', 'let type': 'Long term', 'furnish type': 'Furnished', 'council tax': 'Ask agent'}",,,True,,"(51.4834967, -0.0470755)",6.226177999065287,81.11111111111111,87.54764400186943,43.729438202247195,76.21,estimated,geocoded
166630376,1500,"£1,500 pcm",monthly,Flat,1,1.0,"Church Street, Enfield, Greater London, EN2","Located on the second floor of a private residential block on 63 Church Street, EN2",https://www.rightmove.co.uk/properties/166630376#/?channel=RES_LET,/property-to-rent/contactBranch.html?propertyId=166630376,"Chris Anthony Estates, London",122383,Added on 05/09/2025,2025-09-05T12:24:16Z,,EN2,2025-10-15T18:50:16.520947,"{'let available date': 'Now', 'deposit': '£1,500', 'min. tenancy': 'Ask agent', 'let type': 'Long term', 'furnish type': 'Ask agent', 'council tax': 'Ask agent'}",,,True,,"(51.500021, -0.192442)",4.591110580491865,77.77777777777779,90.81777883901627,43.729438202247195,76.18,estimated,geocoded
167541665,1325,"£1,325 pcm",monthly,Flat,1,1.0,"East Dulwich Grove, East Dulwich","An exceptional newly refurbished studio/room set within a charming Victorian property, just seconds from the vibrant bars, cafés, and restaurants of Lordship Lane. The studio/room has been thoughtfully designed to maximise space, comfortably accommodating a double bed, desk, dining area, and s...",https://www.rightmove.co.uk/properties/167541665#/?channel=RES_LET,/property-to-rent/contactBranch.html?propertyId=167541665,"Dexters, East Dulwich",255212,Reduced on 06/10/2025,2025-09-29T09:20:48Z,,,2025-10-15T18:49:51.505884,"{'let available date': 'Ask agent', 'deposit': '£1,615', 'min. tenancy': 'Ask agent', 'let type': 'Long term', 'furnish type': 'Ask agent', 'council tax': 'Ask agent'}",,,True,,"(51.4548433, -0.0851144)",6.6195871590445075,81.66666666666667,86.76082568191099,43.729438202247195,76.12,estimated,geocoded
87324111,1400,"£1,400 pcm",monthly,Flat,1,1.0,"The Spinney, Granville Road, London","*AVAILABLE NOW* *FURNISHED* One Bedroom Ground Floor Flat - West Finchley, N12 Located on the sought-after Granville Road, this charming ground floor flat offers the perfect balance of comfort and convenience.",https://www.rightmove.co.uk/properties/87324111#/?channel=RES_LET,/property-to-rent/contactBranch.html?propertyId=87324111,"James Kei London, London",79893,Added on 03/10/2025,2025-10-14T17:43:36Z,,,2025-10-15T18:49:56.802754,"{'let available date': 'Now', 'deposit': 'Ask agent', 'min. tenancy': 'Ask agent', 'let type': 'Long term', 'furnish type': 'Furnished', 'council tax': 'Ask agent'}",463.0,43.0,True,,"(51.53289, -0.1979564)",5.608439415407511,80.0,88.78312116918498,43.0,76.11,actual,geocoded
167619239,340,"£1,473 pcm",weekly,Flat,1,1.0,"Great West Road, Brentford","A one-bedroom studio apartment featuring an open-plan kitchen, offering plenty of storage space and wooden flooring throughout. The reception room provides access to a private balcony, overlooking the communal gardens for residents. The property also benefits from on-site concierge service and a ...",https://www.rightmove.co.uk/properties/167619239#/?channel=RES_LET,/property-to-rent/contactBranch.html?propertyId=167619239,"Dexters, Brentford",248528,Added on 30/09/2025,2025-09-30T15:14:20Z,,,2025-10-15T18:50:01.586663,"{'let available date': 'Ask agent', 'deposit': '£1,700', 'min. tenancy': 'Ask agent', 'let type': 'Long term', 'furnish type': 'Furnished', 'council tax': 'Ask agent'}",,,True,,"(51.4809696, -0.3509057)",15.79933062059499,100.0,68.40133875881003,43.729438202247195,76.11,estimated,geocoded
87302568,1450,"£1,450 pcm",monthly,Flat,1,1.0,"Milkwood Rd, London, SE24",GUARANTOR REQUIRED FOR ALL TENANTS. Smart 1 bed flat in trendy Herne hill. The apartment is unfurnished. The apartments consists of a good sized living area with a separate fully integrated kitc... ** Property Reference: 2658595 **,https://www.rightmove.co.uk/properties/87302568#/?channel=RES_LET,/property-to-rent/contactBranch.html?propertyId=87302568,"OpenRent, London",96668,Added yesterday,2025-10-14T12:48:31Z,,SE24,2025-10-15T18:49:30.583865,"{'let available date': 'Now', 'deposit': '£0', 'min. tenancy': 'Ask agent', 'let type': 'Long term', 'furnish type': 'Unfurnished', 'council tax': 'Ask agent'}",,,True,,"(51.4636767, -0.1012263)",5.271025054518704,78.88888888888889,89.4579498909626,43.729438202247195,76.08,estimated,geocoded
167159576,1500,"£1,500 pcm",monthly,Flat,1,1.0,"Corbyn Street, London, N4",A spacious one-bedroom garden flat to rent. The property is located close to amenities of Stroud Green and excellent transport links including Finsbury Park Tube.,https://www.rightmove.co.uk/properties/167159576#/?channel=RES_LET,/property-to-rent/contactBranch.html?propertyId=167159576,"Kinleigh Folkard & Hayward - Lettings, Crouch End",55432,Added on 18/09/2025,2025-09-18T16:33:33Z,,N4,2025-10-15T18:50:09.284994,"{'let available date': 'Now', 'deposit': '£0', 'min. tenancy': 'Ask agent', 'let type': 'Long term', 'furnish type': 'Furnished', 'council tax': 'Ask agent'}",370.0,34.0,True,,"(51.4893335, -0.1440551)",2.380153846150935,77.77777777777779,95.23969230769814,34.0,76.01,actual,geocoded
166898438,1400,"£1,400 pcm",monthly,Flat,1,1.0,"Graham Road, London","We are pleased to offer this second floor, one bed Victorian conversion. The property comprises of a double bedroom, a spacious living room which leads to the kitchen, and family bathroom/WC.",https://www.rightmove.co.uk/properties/166898438#/?channel=RES_LET,/property-to-rent/contactBranch.html?propertyId=166898438,"Dexters, Hendon",44870,Added on 11/09/2025,2025-09-11T18:41:17Z,,,2025-10-15T18:50:14.111235,"{'let available date': 'Ask agent', 'deposit': '£1,615', 'min. tenancy': 'Ask agent', 'let type': 'Long term', 'furnish type': 'Part furnished', 'council tax': 'Ask agent'}",,,True,,"(51.5459728, -0.0663214)",5.986687074062836,80.0,88.02662585187433,43.729438202247195,75.96,estimated,geocoded
168074018,1430,"£1,430 pcm",monthly,Apartment,1,1.0,"Mulgrave Road, Sutton, Surrey, SM2","AVAILABLE NOW Conveniently located in Mulgrave Road walking distance to Sutton mainline station, we are pleased to offer for sale this really spacious one bedroom ground floor apartment with share of freehold and 990 year lease. The accommodation is exceptional: spacious entrance ...",https://www.rightmove.co.uk/properties/168074018#/?channel=RES_LET,/property-to-rent/contactBranch.html?propertyId=168074018,"Burn & Warne, Sutton",13793,Added on 10/10/2025,2025-10-10T11:39:41Z,,SM2,2025-10-15T18:49:38.504376,"{'let available date': '18/10/2025', 'deposit': '£0', 'min. tenancy': 'Ask agent', 'let type': 'Long term', 'furnish type': 'Ask agent', 'council tax': 'Ask agent'}",,,True,,"(51.4934207, -0.0478319)",5.7748009817443515,79.33333333333333,88.4503980365113,43.729438202247195,75.86,estimated,geocoded
167869997,1500,"£1,500 pcm",monthly,Flat,1,1.0,"Shirland Road, Maida Vale W9","Excellent one bed apartment in Maida Vale benefitting from a spacious reception room with a modern fitted kitchen, modern bathroom and double bedroom. Bright and airy throughout with carpets and neutral décor.",https://www.rightmove.co.uk/properties/167869997#/?channel=RES_LET,/property-to-rent/contactBranch.html?propertyId=167869997,"Black Katz, West Hampstead",32793,Added on 06/10/2025,2025-10-06T17:00:03Z,,W9,2025-10-15T18:49:51.505886,"{'let available date': 'Ask agent', 'deposit': 'Ask agent', 'min. tenancy': 'Ask agent', 'let type': 'Long term', 'furnish type': 'Furnished', 'council tax': 'Ask agent'}",,,True,,"(51.5271061, -0.1952126)",5.147621823664184,77.77777777777779,89.70475635267164,43.729438202247195,75.74,estimated,geocoded
166724297,1400,"£1,400 pcm",monthly,Apartment,1,1.0,"Hind House, Lewisham, SE14","Newly Refurbished Studio Flat in Lewisham SE14 - Bright, Spacious, and Available Now",https://www.rightmove.co.uk/properties/166724297#/?channel=RES_LET,/property-to-rent/contactBranch.html?propertyId=166724297,"Holland Properties, London",36516,Reduced on 07/10/2025,2025-09-08T14:16:50Z,,SE14,2025-10-15T18:49:48.893298,"{'let available date': 'Now', 'deposit': 'Ask agent', 'min. tenancy': 'Ask agent', 'let type': 'Long term', 'furnish type': 'Unfurnished', 'council tax': 'Ask agent'}",,,True,,"(51.4821431, -0.0473617)",6.276261380329699,80.0,87.4474772393406,43.729438202247195,75.72,estimated,geocoded
87299397,1450,"£1,450 pcm",monthly,Flat,1,1.0,"Choumert Road, Peckham, London, SE15","ZERO DEPOSIT AVAILABLE. LONG LET. Presented in excellent condition throughout, this wonderful one bedroom flat is set within a superb modern development offering ample living space, quality fixtures, separate kitchen/dining room and double bedroom.",https://www.rightmove.co.uk/properties/87299397#/?channel=RES_LET,/property-to-rent/contactBranch.html?propertyId=87299397,"Foxtons, Peckham",66768,Added yesterday,2025-10-14T12:08:39Z,,SE15,2025-10-15T18:49:30.583872,"{'let available date': 'Ask agent', 'deposit': '£1,674', 'min. tenancy': 'Ask agent', 'let type': 'Long term', 'furnish type': 'Unfurnished', 'council tax': 'Ask agent'}",477.0,44.0,True,,"(51.4681258, -0.0679604)",6.077813676810385,78.88888888888889,87.84437264637923,44.0,75.49,actual,geocoded
167879996,1500,"£1,500 pcm",monthly,Apartment,1,1.0,"Newington Green Road, London, N1",Situated on the renowned Newington Green Road on the cusp of Highbury & Islington and Newington Green is this one double bedroom flat found in the midst of it all. The flat is positioned on the first floor of a charming building and within close proximity is Canonbury and Highbury & Islin...,https://www.rightmove.co.uk/properties/167879996#/?channel=RES_LET,/property-to-rent/contactBranch.html?propertyId=167879996,"Property Inc, Harringay",191252,Added on 06/10/2025,2025-10-06T23:24:11Z,,N1,2025-10-15T18:49:51.505860,"{'let available date': 'Now', 'deposit': '£1,499', 'min. tenancy': 'Ask agent', 'let type': 'Long term', 'furnish type': 'Ask agent', 'council tax': 'Ask agent'}",,,True,,"(51.5501529, -0.0866854)",5.472871453180371,77.77777777777779,89.05425709363925,43.729438202247195,75.48,estimated,geocoded
166938110,1350,"£1,350 pcm",monthly,Apartment,1,1.0,"Richardson House, Malting Way","We are pleased to present this lovely one bedroom first floor apartment located in the highly sought after and popular modern Maltings development. The property comprises double bedroom with built in wardrobes, spacious lounge/dining room, separate kitchen and bathroom with bath and over head sho...",https://www.rightmove.co.uk/properties/166938110#/?channel=RES_LET,/property-to-rent/contactBranch.html?propertyId=166938110,"Anthony James Manser, Isleworth",37403,Reduced on 13/10/2025,2025-09-12T15:45:43Z,,,2025-10-15T18:49:35.769184,"{'let available date': 'Now', 'deposit': '£1,557', 'min. tenancy': 'Ask agent', 'let type': 'Long term', 'furnish type': 'Unfurnished', 'council tax': 'Ask agent'}",,,True,,"(51.5168395, -0.0246957)",7.209645868782677,81.11111111111111,85.58070826243464,43.729438202247195,75.42,estimated,geocoded
166864766,1500,"£1,500 pcm",monthly,Flat,2,1.0,"Baizdon Road, London, SE3","""Cosy 2-bed flat in prime location. Bright living space, separate kitchen, private balcony. Residents' permit parking. EPC rating C (71), council tax band C.",https://www.rightmove.co.uk/properties/166864766#/?channel=RES_LET,/property-to-rent/contactBranch.html?propertyId=166864766,"Kallars, London",289823,Reduced on 02/10/2025,2025-09-11T10:42:12Z,,SE3,2025-10-15T18:49:59.184692,"{'let available date': 'Now', 'deposit': '£1,730', 'min. tenancy': '12 months', 'let type': 'Long term', 'furnish type': 'Part furnished', 'council tax': 'Ask agent'}",667.0,62.0,True,,"(51.4680206, 0.0040514)",10.173624603765601,77.77777777777779,79.6527507924688,62.0,75.37,actual,geocoded
167913068,1500,"£1,500 pcm",monthly,Flat,1,1.0,"Blanchedowne, Camberwell","Beautifully presented and thoughtfully designed, this charming ground-floor studio offers a stylish and comfortable living space. Boasting a modern interior throughout, the property is move-in ready and designed to make the most of every inch of space The main studio room is bright and welcoming...",https://www.rightmove.co.uk/properties/167913068#/?channel=RES_LET,/property-to-rent/contactBranch.html?propertyId=167913068,"Dexters, East Dulwich",255212,Reduced today,2025-10-07T13:48:31Z,,,2025-10-15T18:49:23.151606,"{'let available date': 'Ask agent', 'deposit': '£1,846', 'min. tenancy': 'Ask agent', 'let type': 'Long term', 'furnish type': 'Furnished', 'council tax': 'Ask agent'}",,,True,,"(51.4635529, -0.0898016)",5.608695969382472,77.77777777777779,88.78260806123505,43.729438202247195,75.37,estimated,geocoded
167707613,1450,"£1,450 pcm",monthly,Flat,1,1.0,"Rye Lane, London, SE15","An expansive 1 bed apartment, complete with a generously sized separate kitchen, is now available for rent on Rye Lane in the lively heart of Peckham. This well-designed living space boasts abunda... ** Property Reference: 2618820 **",https://www.rightmove.co.uk/properties/167707613#/?channel=RES_LET,/property-to-rent/contactBranch.html?propertyId=167707613,"OpenRent, London",96668,Added on 02/10/2025,2025-10-02T12:13:21Z,,SE15,2025-10-15T18:49:56.802840,"{'let available date': 'Now', 'deposit': '£1,673', 'min. tenancy': 'Ask agent', 'let type': 'Long term', 'furnish type': 'Furnished', 'council tax': 'Ask agent'}",,,True,,"(51.4669503, -0.0660185)",6.265490532536741,78.88888888888889,87.46901893492652,43.729438202247195,75.29,estimated,geocoded
133346288,1500,"£1,500 pcm",monthly,Flat,2,1.0,"Central Road, Worcester Park, Surrey, KT4","A first floor two bedroom flat with a lounge 13'9 X 12'4, fitted kitchen with appliances, white bathroom suite and an outside terrace space. Situated on Central Road with its various shops, restaurants and mainline station giving access to Waterloo in 25 minutes.",https://www.rightmove.co.uk/properties/133346288#/?channel=RES_LET,/property-to-rent/contactBranch.html?propertyId=133346288,"Connor Prince, Worcester Park",23486,Added on 24/09/2025,2023-04-13T14:54:18Z,,KT4,2025-10-15T18:50:06.850858,"{'let available date': 'Now', 'deposit': '£1,730', 'min. tenancy': 'Ask agent', 'let type': 'Long term', 'furnish type': 'Unfurnished', 'council tax': 'Ask agent'}",,,True,,"(51.4934207, -0.0478319)",5.7748009817443515,77.77777777777779,88.4503980365113,43.729438202247195,75.24,estimated,geocoded
85601922,1350,"£1,350 pcm",monthly,Flat,1,1.0,"Homerton High Street, London, E9",Delightful 1 bedroom flat located on the 1st floor. Open-plan kitchen & living room. Close to Homerton Hospital and the station. Furnished or unfurnished. Available immediately.,https://www.rightmove.co.uk/properties/85601922#/?channel=RES_LET,/property-to-rent/contactBranch.html?propertyId=85601922,"Milegate, London",123322,Reduced on 16/09/2025,2022-06-10T17:45:28Z,,E9,2025-10-15T18:50:11.738005,"{'let available date': 'Ask agent', 'deposit': '£1,557', 'min. tenancy': 'Ask agent', 'let type': 'Long term', 'furnish type': 'Furnished or unfurnished, landlord is flexible', 'council tax': 'Ask agent'}",,,True,,"(51.5487127, -0.0415015)",7.491165696322497,81.11111111111111,85.017668607355,43.729438202247195,75.2,estimated,geocoded
167994068,1450,"£1,450 pcm",monthly,Flat,1,1.0,"High Road, Wood Green, N22","Great location! Havilands present this 1 bed flat just moments walk from Wood Green underground station (zone 3 Piccadilly line) and all the local amenities - shops and restaurants. The flat benefits from a large kitchen/diner, lounge, bedroom and spacious bathroom. Suitable for professional coup...",https://www.rightmove.co.uk/properties/167994068#/?channel=RES_LET,/property-to-rent/contactBranch.html?propertyId=167994068,"Havilands, London",82874,Added on 08/10/2025,2025-10-08T15:37:40Z,,N22,2025-10-15T18:49:46.492380,"{'let available date': 'Now', 'deposit': '£1,450', 'min. tenancy': 'Ask agent', 'let type': 'Long term', 'furnish type': 'Ask agent', 'council tax': 'Ask agent'}",603.0,56.0,True,,"(51.5920697, -0.1053176)",9.469356641797235,78.88888888888889,81.06128671640553,56.00000000000001,75.18,actual,geocoded
168135293,1500,"£1,500 pcm",monthly,Flat,1,1.0,"Kingswood Road, Brixton Hill, SW2",A spacious one bedroom flat with direct access onto a shared garden. This property would be perfect for professional couple or single occupant.,https://www.rightmove.co.uk/properties/168135293#/?channel=RES_LET,/property-to-rent/contactBranch.html?propertyId=168135293,"Jacksons Estate Agents, Clapham",99865,Added on 13/10/2025,2025-10-13T08:59:10Z,,SW2,2025-10-15T18:49:35.769215,"{'let available date': 'Ask agent', 'deposit': '£1,730', 'min. tenancy': 'Ask agent', 'let type': 'Long term', 'furnish type': 'Unfurnished', 'council tax': 'Ask agent'}",,,True,,"(51.4554446, -0.1192178)",5.887175457765936,77.77777777777779,88.22564908446813,43.729438202247195,75.15,estimated,geocoded
167217980,1450,"£1,450 pcm",monthly,Apartment,1,1.0,"East Dulwich Road, East Dulwich, London, SE22",This charming top floor one bedroom flat is situated in a fantastic Victorian detached house opposite Goose Green.,https://www.rightmove.co.uk/properties/167217980#/?channel=RES_LET,/property-to-rent/contactBranch.html?propertyId=167217980,"Winkworth, Dulwich",47825,Reduced on 07/10/2025,2025-09-20T00:00:22Z,,SE22,2025-10-15T18:49:46.492464,"{'let available date': '01/11/2025', 'deposit': '£0', 'min. tenancy': 'Ask agent', 'let type': 'Long term', 'furnish type': 'Part furnished', 'council tax': 'Ask agent'}",,,True,,"(51.4617743, -0.070122)",6.519629460297181,78.88888888888889,86.96074107940564,43.729438202247195,75.09,estimated,geocoded
167240186,1500,"£1,500 pcm",monthly,Flat,1,1.0,"Brixton Hill, London, SW2",DON'T MISS OUT ON: cosy one-bedroom flat on Brixton Hill that is perfectly located between Streatham Hill station and Brixton Hill station. Available 9th of October 2025! Benefits of the property... ** Property Reference: 2651971 **,https://www.rightmove.co.uk/properties/167240186#/?channel=RES_LET,/property-to-rent/contactBranch.html?propertyId=167240186,"OpenRent, London",96668,Added on 21/09/2025,2025-09-21T19:07:45Z,,SW2,2025-10-15T18:50:09.284981,"{'let available date': 'Now', 'deposit': '£1,500', 'min. tenancy': 'Ask agent', 'let type': 'Long term', 'furnish type': 'Furnished', 'council tax': 'Ask agent'}",,,True,,"(51.454366, -0.1199944)",6.001611307901112,77.77777777777779,87.99677738419777,43.729438202247195,75.06,estimated,geocoded
168046307,1400,"£1,400 pcm",monthly,Apartment,1,1.0,"The Quarterdeck, London, E14","BRIGHT & SPACIOUS one bedroom apartment near Canary Wharf, offering west-facing views and a wealth of storage space.",https://www.rightmove.co.uk/properties/168046307#/?channel=RES_LET,/property-to-rent/contactBranch.html?propertyId=168046307,"The Online Letting Agents Ltd, Bury St Edmunds",82831,Added on 09/10/2025,2025-10-09T16:11:51Z,,E14,2025-10-15T18:49:40.916253,"{'let available date': 'Now', 'deposit': '£1,615', 'min. tenancy': '6 months', 'let type': 'Long term', 'furnish type': 'Furnished', 'council tax': 'Ask agent'}",500.0,,True,,"(51.4980746, -0.0248071)",7.224137667249806,80.0,85.55172466550039,43.729438202247195,74.97,estimated,geocoded
167785823,1500,"£1,500 pcm",monthly,Apartment,1,1.0,"Jemotts Court, Myers Lane, SE14","This modern, one bed property is available in the quiet development, Jemotts Court. The fully furnished property opens to a spacious hallway, with the bright living area and neutral kitchen to the right, and double bedroom to the left. The property is filled with light due to the double aspect wi...",https://www.rightmove.co.uk/properties/167785823#/?channel=RES_LET,/property-to-rent/contactBranch.html?propertyId=167785823,"Living in London, Canada Water Tube Station",55268,Added on 03/10/2025,2025-10-03T16:57:08Z,,SE14,2025-10-15T18:49:56.802708,"{'let available date': 'Now', 'deposit': '£0', 'min. tenancy': 'Ask agent', 'let type': 'Long term', 'furnish type': 'Ask agent', 'council tax': 'Ask agent'}",,,True,,"(51.4828871, -0.0470069)",6.260584496805449,77.77777777777779,87.4788310063891,43.729438202247195,74.85,estimated,geocoded
168093854,1450,"£1,450 pcm",monthly,Apartment,1,1.0,"Norwood Road, Tulse Hill","Oaks Estate Agents are delighted to offer to the market this charming one-bedroom, first floor apartment, situated a stone’s throw from Tulse Hill station",https://www.rightmove.co.uk/properties/168093854#/?channel=RES_LET,/property-to-rent/contactBranch.html?propertyId=168093854,"Oaks Estate Agents, Streatham Lettings",201446,Added on 10/10/2025,2025-10-10T15:53:06Z,,,2025-10-15T18:49:38.504353,"{'let available date': '17/10/2025', 'deposit': '£1,673', 'min. tenancy': 'Ask agent', 'let type': 'Long term', 'furnish type': 'Unfurnished', 'council tax': 'Ask agent'}",,,True,,"(51.4485669, -0.1021285)",6.855814848778016,78.88888888888889,86.28837030244397,43.729438202247195,74.82,estimated,geocoded
152516030,1500,"£1,500 pcm",monthly,Apartment,1,1.0,"John Williams Close, London, SE14","A superb one-bedroom flat situated in a purpose-built apartment building offering contemporary living within a central location in the sought after area of New Cross. This flat is offered in great condition throughout with a spacious reception room, fully fitted kitchen and a genuine double room....",https://www.rightmove.co.uk/properties/152516030#/?channel=RES_LET,/property-to-rent/contactBranch.html?propertyId=152516030,"Winkworth, New Cross",269888,Added on 15/09/2025,2024-09-16T18:45:19Z,,SE14,2025-10-15T18:50:11.738031,"{'let available date': '10/11/2025', 'deposit': '£0', 'min. tenancy': '12 months', 'let type': 'Long term', 'furnish type': 'Ask agent', 'council tax': 'Ask agent'}",,,True,,"(51.4808156, -0.0480135)",6.305932162709372,77.77777777777779,87.38813567458126,43.729438202247195,74.81,estimated,geocoded
167722607,1500,"£1,500 pcm",monthly,Ground Flat,1,0.0,"Kingsdown Road, London","This contemporary one bedroom period conversion is offered to rent immediately on a part furnished basis. The property has been finished to a high standard and is ideally located close to excellent transport links and local amenities. Easy access to Camden, Kings Cross, The City & West End.
...",https://www.rightmove.co.uk/properties/167722607#/?channel=RES_LET,/property-to-rent/contactBranch.html?propertyId=167722607,"JTM Homes, North London",29933,Added on 02/10/2025,2025-10-02T15:29:12Z,,,2025-10-15T18:49:56.802820,"{'let available date': 'Now', 'deposit': '£1,731', 'min. tenancy': 'Ask agent', 'let type': 'Long term', 'furnish type': 'Unfurnished', 'council tax': 'Ask agent'}",,,True,,"(51.5649505, -0.1206424)",6.3434989829953325,77.77777777777779,87.31300203400933,43.729438202247195,74.78,estimated,geocoded
168033092,1400,"£1,400 pcm",monthly,Flat,1,1.0,"Amersham Road, New Cross, SE14",AVAILABLE NOW - FURNISHED. A light and bright apartment located within a short walk of New Cross Station and local amenities. MORE PICS TO COME,https://www.rightmove.co.uk/properties/168033092#/?channel=RES_LET,/property-to-rent/contactBranch.html?propertyId=168033092,"Nested, Nationwide",269723,Added on 09/10/2025,2025-10-09T13:10:11Z,,SE14,2025-10-15T18:49:43.835032,"{'let available date': 'Now', 'deposit': '£1,615', 'min. tenancy': '12 months', 'let type': 'Long term', 'furnish type': 'Furnished', 'council tax': 'Ask agent'}",,,True,,"(51.4758709, -0.0328992)",7.4911535757649235,80.0,85.01769284847015,43.729438202247195,74.75,estimated,geocoded
167924939,1500,"£1,500 pcm",monthly,Flat,1,0.0,"Grove Vale, London","Nestled in the vibrant area of Grove Vale, London, this charming one-bedroom flat offers a delightful blend of period features and modern comforts. Spanning an inviting 463 square feet, the property has been thoughtfully refurbished to create a warm and welcoming atmosphere. The flat boa...",https://www.rightmove.co.uk/properties/167924939#/?channel=RES_LET,/property-to-rent/contactBranch.html?propertyId=167924939,"Hammonds, London",39003,Added on 07/10/2025,2025-10-07T15:56:33Z,,,2025-10-15T18:49:48.893149,"{'let available date': 'Now', 'deposit': '£1,730', 'min. tenancy': 'Ask agent', 'let type': 'Long term', 'furnish type': 'Unfurnished', 'council tax': 'Ask agent'}",463.0,43.0,True,,"(51.4614378, -0.0787173)",6.203369894945749,77.77777777777779,87.5932602101085,43.0,74.75,actual,geocoded
